Issue Type,Issue key,Issue id,Parent id,Summary,Assignee,Reporter,Priority,Status,Resolution,Created,Updated,Due Date
Bug,OODT-53,12478195,,OODT Agility setup.py references missing file HISTORY.txt (renamed to RELEASE_NOTES.txt in r979524),woollard,kelly,Major,Resolved,Fixed,24/Oct/10 21:49,24/Oct/10 21:51,24/Oct/10 00:00
Bug,OODT-44,12475674,,OODT doesn't build in JDK5 because of stringPropertyNames() in cas/workflow/structs/TaskJobInput.java,chrismattmann,davekale,Major,Resolved,Fixed,01/Oct/10 23:32,02/Oct/10 02:00,08/Oct/10 00:00
Improvement,OODT-25,12470595,,Remove product and profile's dependency on jacorb,chrismattmann,woollard,Major,Resolved,Not A Problem,01/Aug/10 21:12,27/Sep/10 02:35,
Bug,OODT-40,12474898,,DataSourceCatalogFactory default validation layer class is incorrect,chrismattmann,pramirez,Major,Resolved,Fixed,23/Sep/10 02:56,23/Sep/10 18:02,
Bug,OODT-39,12474896,,LuceneCatalogFactory default validation layer class is incorrect,chrismattmann,pramirez,Major,Resolved,Fixed,23/Sep/10 02:52,23/Sep/10 14:35,
New Feature,OODT-29,12472759,,Import (ERNE) XMLPS component,chrismattmann,davekale,Major,Resolved,Fixed,27/Aug/10 23:05,16/Sep/10 04:07,
Task,OODT-27,12471956,,Import Web Grid component,,davekale,Major,Resolved,Fixed,18/Aug/10 23:10,03/Sep/10 01:18,
New Feature,OODT-16,12463526,,OODT website,kelly,chrismattmann,Major,Resolved,Fixed,02/May/10 18:40,03/Aug/10 02:15,
Improvement,OODT-23,12470417,,remove pushpull's javamail dependency,chrismattmann,woollard,Major,Resolved,Fixed,29/Jul/10 07:57,01/Aug/10 05:14,
Bug,OODT-7,12458499,,Curator adds escaped sequenced spaces when reading extractorBinPath tag from extractor config files,chrismattmann,joshuaga,Major,Resolved,Fixed,09/Mar/10 04:49,01/Aug/10 02:05,
Improvement,OODT-5,12457616,,Reorganize OODT codebase to remove edm-* and cas-*,chrismattmann,chrismattmann,Major,Resolved,Fixed,26/Feb/10 23:52,04/May/10 01:29,
Question,OODT-6,12457815,,Import OODT Agility?,,kelly,Major,Resolved,Won't Fix,02/Mar/10 01:46,21/Mar/10 22:17,
Task,OODT-2,12455594,,Import CAS components into OODT SVN,,chrismattmann,Major,Closed,Fixed,07/Feb/10 23:20,23/Feb/10 05:21,
Task,OODT-1,12455593,,"Import grid product, profile, and query services into OODT SVN",chrismattmann,chrismattmann,Major,Resolved,Fixed,07/Feb/10 23:19,22/Feb/10 17:55,
Improvement,OODT-1038,13405119,,"Dependency org.apache.httpcomponents:httpclient, leading to CVE problem",,Baronoda,Minor,Open,,06/Oct/21 05:33,06/Oct/21 05:33,
Improvement,OODT-1021,13252043,,Unify Logging through SLF4J,imesha,yasithmilinda,Minor,Open,,21/Aug/19 08:09,29/Jan/21 04:00,
Sub-task,OODT-484,12601603,12605909,Enhance Workflow Lifecycle to include state change logic,bfoster,bfoster,Minor,Open,,06/Aug/12 19:03,04/Feb/20 08:04,
Bug,OODT-1027,13252849,,Two test cases fail in cas-metadata module,imesha,imesha,Minor,Resolved,Fixed,25/Aug/19 07:18,24/Oct/19 17:28,
Sub-task,OODT-1011,13234062,13234061,Use Error Payloads for exception handling,imesha,Gimo,Minor,Open,,17/May/19 21:12,23/Sep/19 21:18,
Question,OODT-1014,13242642,,What is the version of SOLR used in OODT?,imesha,yasithmilinda,Minor,Open,,02/Jul/19 03:09,23/Sep/19 21:18,
Improvement,OODT-1001,13200387,,OpsUI React Components,bugg_tb,bugg_tb,Minor,Open,,24/Nov/18 22:16,23/Sep/19 21:17,
New Feature,OODT-977,13156882,,Use zookeeper to identify and transparently query multiple file managers,,imesha,Minor,Open,,03/May/18 14:52,23/Sep/19 21:17,
Sub-task,OODT-1025,13252800,13166000,React Components for File Manager,imesha,Gimo,Minor,Open,,24/Aug/19 10:59,23/Sep/19 21:17,
Sub-task,OODT-1026,13252805,13166000,FileManager V2 JAX-RS REST APIs,imesha,Gimo,Minor,Resolved,Implemented,24/Aug/19 11:11,21/Sep/19 08:36,
Sub-task,OODT-1028,13253046,13166000,Swagger Implementations for REST APIs,,Gimo,Minor,Resolved,Done,26/Aug/19 14:10,28/Aug/19 14:23,
Bug,OODT-1019,13250594,,"Incorrect Log Levels on .level, .FileHandler.level and .ConsoleHandler.level",imesha,yasithmilinda,Minor,Resolved,Fixed,13/Aug/19 16:27,25/Aug/19 07:51,
Improvement,OODT-1022,13252083,,Revive the test cases in cas-metadata,imesha,yasithmilinda,Minor,Closed,Done,21/Aug/19 09:29,25/Aug/19 07:19,
Improvement,OODT-1018,13250528,,OPSUI throwing NotSerializableException on several classes,imesha,yasithmilinda,Minor,Resolved,Fixed,13/Aug/19 12:02,24/Aug/19 14:37,
Bug,OODT-1013,13242641,,Update Beta Versions of Maven Assembly Plugin in OODT Radix Builds,imesha,yasithmilinda,Minor,Resolved,Done,02/Jul/19 03:02,20/Jul/19 15:25,
Documentation,OODT-1005,13218888,,Update the README.md with descriptive Contribution guidelines,,Gimo,Minor,Closed,Done,01/Mar/19 13:34,17/Mar/19 14:18,
Improvement,OODT-1006,13220700,,Add dockerfile,bugg_tb,bugg_tb,Minor,Resolved,Fixed,10/Mar/19 20:15,10/Mar/19 20:18,
Improvement,OODT-896,12907724,,code quality - unnecessary interface modifier,,bugg_tb,Minor,Resolved,Won't Fix,25/Oct/15 10:22,30/Nov/18 04:49,
Bug,OODT-998,13196038,,The startup script of cas-filemgr fails if distribution is located in a path with blank spaces,,madhawav,Minor,Resolved,Done,03/Nov/18 07:36,03/Nov/18 16:50,
Improvement,OODT-975,13154951,,Upgrade Tomcat in radix,lewismc,lewismc,Minor,Resolved,Resolved,24/Apr/18 21:38,29/Sep/18 09:28,
Sub-task,OODT-987,13169325,12714236,Update Configuration Management to use Log4J2 over Log4J,imesha,imesha,Minor,Resolved,Done,30/Jun/18 13:17,30/Aug/18 06:07,
Sub-task,OODT-984,13165145,12714236,Update PGE to use SLF4J logging API,imesha,imesha,Minor,Resolved,Fixed,09/Jun/18 18:00,30/Aug/18 06:06,
Bug,OODT-973,13149960,,Update mvn/archetypes/radix module script templates to remove ghost PID files,chrismattmann,ThejanWijesinghe,Minor,Resolved,Fixed,04/Apr/18 11:05,06/Apr/18 10:47,
Bug,OODT-951,13081458,,Wrong null checker,chrismattmann,lifove,Minor,Resolved,Fixed,21/Jun/17 15:29,26/Feb/18 02:29,
Improvement,OODT-959,13101558,,Update tika,,bugg_tb,Minor,Resolved,Fixed,12/Sep/17 08:26,26/Feb/18 02:23,
Improvement,OODT-965,13108776,,Configuration change listening feature for distributed configuration management,imesha,imesha,Minor,Resolved,Fixed,12/Oct/17 02:34,23/Oct/17 16:29,
Sub-task,OODT-952,13084063,13040447,CLI For distributed configuration publishing,,imesha,Minor,Closed,Fixed,02/Jul/17 15:40,09/Sep/17 07:13,
New Feature,OODT-393,12544360,,Column Based Catalog for Filemanager,chrismattmann,mstarch,Minor,Resolved,Won't Fix,28/Feb/12 04:11,17/Jul/17 22:48,
Improvement,OODT-853,12837173,,OODT PGE printing of null keys,chrismattmann,andrea86,Minor,Resolved,Won't Fix,11/Jun/15 15:34,17/Jul/17 22:47,
Improvement,OODT-917,12909856,,replace hashtable with hashmap,,bugg_tb,Minor,Resolved,Won't Fix,03/Nov/15 00:16,17/Jul/17 22:38,
Bug,OODT-908,12908055,,replace system.out.println with log calls,,bugg_tb,Minor,Resolved,Won't Fix,26/Oct/15 23:11,17/Jul/17 22:32,
Bug,OODT-907,12907783,,code quality - remove never queried collections,,bugg_tb,Minor,Resolved,Won't Fix,25/Oct/15 22:35,17/Jul/17 22:32,
Improvement,OODT-906,12907754,,remove redundant assignment,bugg_tb,bugg_tb,Minor,Resolved,Won't Fix,25/Oct/15 15:50,17/Jul/17 22:31,
Improvement,OODT-904,12907750,,remove redundant throws,,bugg_tb,Minor,Resolved,Won't Fix,25/Oct/15 15:44,17/Jul/17 22:31,
Improvement,OODT-903,12907748,,code quality - simplify flows,bugg_tb,bugg_tb,Minor,Resolved,Won't Fix,25/Oct/15 15:33,17/Jul/17 22:31,
Improvement,OODT-902,12907747,,remove redundant modifiers from enums,bugg_tb,bugg_tb,Minor,Resolved,Won't Fix,25/Oct/15 15:31,17/Jul/17 22:31,
Improvement,OODT-901,12907738,,resolve some javadoc issues,,bugg_tb,Minor,Resolved,Won't Fix,25/Oct/15 11:39,17/Jul/17 22:31,
Improvement,OODT-900,12907735,,"code-quality remove unneeded boxing, unboxing, swap indexof to contains, stringbuffer to builder",,bugg_tb,Minor,Resolved,Won't Fix,25/Oct/15 11:33,17/Jul/17 22:30,
Improvement,OODT-899,12907734,,code quality - redundant local variable,,bugg_tb,Minor,Resolved,Won't Fix,25/Oct/15 11:30,17/Jul/17 22:30,
Improvement,OODT-898,12907733,,code quality - remove redundant private final call,,bugg_tb,Minor,Resolved,Won't Fix,25/Oct/15 11:28,17/Jul/17 22:30,
Improvement,OODT-897,12907725,,code quality - unnecessary module dependency,,bugg_tb,Minor,Resolved,Won't Fix,25/Oct/15 10:25,17/Jul/17 22:30,
Improvement,OODT-895,12907723,,code quality - redundant measure unit,,bugg_tb,Minor,Resolved,Won't Fix,25/Oct/15 10:22,17/Jul/17 22:29,
Improvement,OODT-894,12907687,,Tidy up inefficient constructors (sonar),bugg_tb,bugg_tb,Minor,Resolved,Won't Fix,24/Oct/15 21:21,17/Jul/17 22:29,
Bug,OODT-888,12903976,,Replace appended string with StringBuilder to improve performance,bugg_tb,bugg_tb,Minor,Resolved,Won't Fix,10/Oct/15 13:17,17/Jul/17 22:29,
Bug,OODT-859,12848601,,Convert Jars to OSGI Bundles,bugg_tb,bugg_tb,Minor,Resolved,Incomplete,23/Jul/15 15:13,17/Jul/17 22:28,
Bug,OODT-766,12751255,,NullPointerException occurs when no result returned from the query_tool script,,angela_wang,Minor,Resolved,Won't Fix,28/Oct/14 22:26,17/Jul/17 22:27,
Bug,OODT-760,12747218,,Allow for pushpull fileretriction parsers to support metadata parsing,bfoster,bfoster,Minor,Resolved,Won't Fix,10/Oct/14 06:32,17/Jul/17 22:27,
Improvement,OODT-743,12736740,,Check OODT date time utility classes and work out what can be removed/optimised,,bugg_tb,Minor,Resolved,Won't Fix,26/Aug/14 08:18,17/Jul/17 22:27,
Bug,OODT-683,12712145,,Create deleteOnSuccess option for pushpull config files,bfoster,bfoster,Minor,Resolved,Won't Fix,03/May/14 22:27,17/Jul/17 22:27,
Bug,OODT-730,12731675,,Add Protocol CLI action for deleting empty directories from sites,bfoster,bfoster,Minor,Resolved,Won't Fix,04/Aug/14 06:32,17/Jul/17 22:26,
Task,OODT-714,12721162,,Make OODT RADiX vagrant boxes available on vagrantcloud.com,sherylj,sherylj,Minor,Resolved,Won't Fix,13/Jun/14 18:45,17/Jul/17 22:25,
Bug,OODT-702,12717714,,Add Encryption support to S3 DataTransferer,bfoster,bfoster,Minor,Resolved,Won't Fix,31/May/14 06:17,17/Jul/17 22:25,
Bug,OODT-684,12712147,,Multi-Threaded ingests for Crawler,bfoster,bfoster,Minor,Resolved,Won't Fix,03/May/14 22:59,17/Jul/17 22:24,
Improvement,OODT-682,12712101,,Filemgr behaves differently when clientTransfer is enabled,bfoster,bfoster,Minor,Resolved,Won't Fix,03/May/14 07:37,17/Jul/17 22:24,
Improvement,OODT-680,12712088,,Filemgr should delete files using DataTransferer,bfoster,bfoster,Minor,Resolved,Won't Fix,03/May/14 01:59,17/Jul/17 21:51,
Bug,OODT-671,12702279,,Ensure OODT trunk builds and tests successfully on Windows OS,lewismc,lewismc,Minor,Resolved,Fixed,18/Mar/14 23:01,17/Jul/17 21:51,
Improvement,OODT-581,12638609,,Update and upgrade usage of Lucene core dependency to write File Manager catalogs ,chrismattmann,lewismc,Minor,Resolved,Won't Fix,22/Mar/13 22:42,17/Jul/17 21:51,
Bug,OODT-567,12634684,,show JAVA_HOME env var in RADiX start command in all cases,ahart,ahart,Minor,Resolved,Won't Fix,28/Feb/13 21:11,17/Jul/17 21:49,
Bug,OODT-559,12631845,,"Unit test failure in testDoDynamicReplacement for ""Europe/London"" timezone",chrismattmann,varunratnakar,Minor,Resolved,Fixed,11/Feb/13 23:35,17/Jul/17 21:48,
New Feature,OODT-539,12618969,,New maven archetype for generating a template MetExtractor project,riverma,riverma,Minor,Resolved,Won't Fix,05/Dec/12 23:45,17/Jul/17 21:48,
Bug,OODT-536,12616799,,maven-cas-install plugin cannot handle tarballs with -dist in name. ,,mjoyce,Minor,Resolved,Won't Fix,19/Nov/12 20:20,17/Jul/17 21:48,
Improvement,OODT-461,12556931,,GXP support in CAS-PGE,bfoster,bfoster,Minor,Resolved,Won't Fix,22/May/12 22:00,17/Jul/17 21:41,
New Feature,OODT-475,12599769,,Tool to automatically validate regular expressions in PushPull RemoteSpecs,chrismattmann,chrismattmann,Minor,Resolved,Won't Fix,22/Jul/12 17:45,17/Jul/17 21:40,
Bug,OODT-479,12600540,,Add getHost() method to Protocol API Interface,bfoster,bfoster,Minor,Resolved,Won't Fix,28/Jul/12 00:32,17/Jul/17 21:40,
Improvement,OODT-524,12613728,,Make Curator Task List Persist Across Restarts,chrismattmann,mjoyce,Minor,Resolved,Fixed,26/Oct/12 22:52,17/Jul/17 21:39,
Sub-task,OODT-526,12613731,12613728,Add base functionality in Curator for Task List persistence,chrismattmann,mjoyce,Minor,Resolved,Fixed,26/Oct/12 23:09,17/Jul/17 21:39,
Sub-task,OODT-527,12613732,12613728,Add configuration options to Curator Task List persistence,chrismattmann,mjoyce,Minor,Resolved,Won't Fix,26/Oct/12 23:15,17/Jul/17 21:13,
Sub-task,OODT-525,12613730,12613728,Export IngestTaskList from Curator,chrismattmann,mjoyce,Minor,Resolved,Fixed,26/Oct/12 23:03,17/Jul/17 21:13,
Bug,OODT-439,12550547,,Jobs Are Dropped When Queue Size Is Full,,mcayanan,Minor,Resolved,Fixed,11/Apr/12 15:13,17/Jul/17 18:24,
Bug,OODT-424,12547085,,Need to added a pre-run script to Jenkins to install javax.transaction:jta:jar:1.0.1B,bfoster,bfoster,Minor,Resolved,Fixed,19/Mar/12 21:03,17/Jul/17 18:23,
Improvement,OODT-417,12546789,,Refactor Paging in Lucene Catalog,pramirez,pramirez,Minor,Resolved,Won't Fix,16/Mar/12 14:27,17/Jul/17 18:23,
Improvement,OODT-416,12546787,,Remove Sort in LuceneCatalog.getNumHits(),pramirez,pramirez,Minor,Resolved,Won't Fix,16/Mar/12 14:21,17/Jul/17 18:03,
Bug,OODT-386,12544100,,The File Manager's filemgr-client script does not handle quoted parameter values.,,shardman,Minor,Resolved,Won't Fix,25/Feb/12 04:56,17/Jul/17 18:03,
Bug,OODT-384,12543810,,File manager queries not returning expected results unless each product-type has an ingested file and throws exceptions for '*' occurrence in the sql query,,sherylj,Minor,Resolved,Won't Fix,23/Feb/12 07:32,17/Jul/17 18:02,
New Feature,OODT-331,12526970,,Create baked-in xmlps config that can unlock products and profiles from CAS filemgr catalogs,chrismattmann,chrismattmann,Minor,Resolved,Won't Fix,13/Oct/11 03:38,17/Jul/17 18:02,
Improvement,OODT-304,12514831,,Add a Getter method to get the file handler configuration.,,mcayanan,Minor,Resolved,Fixed,20/Jul/11 21:06,17/Jul/17 17:57,
Bug,OODT-196,12508583,,Fix minor bugs in the ColumnBasedDataSourceCatalog,,mstarch,Minor,Resolved,Won't Fix,27/May/11 19:35,17/Jul/17 17:50,
Improvement,OODT-187,12506065,,Standardize File Pathing within filemgr.properties,cgoodale,cgoodale,Minor,Resolved,Won't Fix,03/May/11 14:19,17/Jul/17 17:50,13/May/11 00:00
New Feature,OODT-178,12504405,,Distributed-Pushpull -- allow for file downloads be cas-resoure manager jobs,bfoster,bfoster,Minor,Resolved,Won't Fix,15/Apr/11 20:25,17/Jul/17 17:50,
Improvement,OODT-126,12497280,,Clean up the javadoc warnings (currently 400+),cgoodale,cgoodale,Minor,Resolved,Won't Fix,01/Feb/11 03:44,17/Jul/17 17:50,
Improvement,OODT-92,12493372,,Make Ingester used by CAS-Crawler for product ingestion configurable,bfoster,bfoster,Minor,Resolved,Won't Fix,15/Dec/10 23:03,17/Jul/17 17:49,
Bug,OODT-69,12492564,,Filemgr Catalogs should load Element based off Element name and ProductType,bfoster,bfoster,Minor,Resolved,Won't Fix,07/Dec/10 00:22,17/Jul/17 17:40,
Improvement,OODT-10,12458832,,Make BatchMgrProxy an interface and node assignable,,bfoster,Minor,Resolved,Won't Fix,11/Mar/10 17:20,17/Jul/17 17:39,
Bug,OODT-875,12862430,,Additional jar files needed for workflow and filemgr,vmallder,vmallder,Minor,Resolved,Fixed,08/Sep/15 14:20,16/Jul/17 22:38,
Improvement,OODT-920,12919951,,Unable to serialize class: org.apache.oodt.cas.workflow.structs.WorkflowInstance,,karanjeets,Minor,Resolved,Won't Fix,08/Dec/15 05:03,16/Jul/17 21:07,
Sub-task,OODT-845,12826158,12717138,Create Deployment Scripts Using Python Fabric for Streaming Components,starchmd@umich.edu,starchmd@umich.edu,Minor,Resolved,Fixed,29/Apr/15 23:37,16/Jul/17 21:06,
Improvement,OODT-765,12750585,,Stale cas.workflow.pid PID files should be removed or set to blank,,sabarish.venkatraman,Minor,Resolved,Won't Fix,26/Oct/14 07:59,16/Jul/17 21:04,
New Feature,OODT-594,12642187,,Ability to Reload PGEPolicy While Workflow/Resource Manager are Running,chrismattmann,pramirez,Minor,Resolved,Won't Fix,12/Apr/13 05:44,16/Jul/17 20:56,
Sub-task,OODT-563,12632049,12631971,Task editing and Workflow execution,chrismattmann,varunratnakar,Minor,Resolved,Fixed,12/Feb/13 19:07,16/Jul/17 20:48,
Improvement,OODT-75,12492872,,Ability to submit jobs to a DRMAA based resource manager,bfoster,bfoster,Minor,Resolved,Won't Fix,09/Dec/10 19:18,16/Jul/17 19:39,
New Feature,OODT-847,12830039,,New FilemgrMetExtractor to extract File System Attributes,chrismattmann,riverma,Minor,Resolved,Fixed,15/May/15 01:13,10/Jul/17 18:23,
Bug,OODT-948,13049081,,Docker build does not work with latest version of ubuntu,,krishnarb3,Minor,Resolved,Fixed,07/Mar/17 23:36,09/Mar/17 15:04,
Improvement,OODT-113,12495425,,CAS Workflow Basic User Guide is Out Dated,cgoodale,cgoodale,Minor,Resolved,Cannot Reproduce,12/Jan/11 21:50,21/Jun/16 09:20,17/Jan/11 00:00
Task,OODT-293,12511521,,"Create Documentation Page on oodt.apache.org, with old content from JPL site",chrismattmann,sprhodes,Minor,Resolved,Fixed,25/Jun/11 03:34,21/Jun/16 09:20,
Bug,OODT-923,12938012,,fix start script for solr deployments,bugg_tb,bugg_tb,Minor,Resolved,Fixed,09/Feb/16 22:10,21/Jun/16 09:20,
Bug,OODT-781,12753233,,IllegalArgumentException: RADiX filemgr-client script cannot delete product by id or name,bugg_tb,angela_wang,Minor,Resolved,Fixed,06/Nov/14 00:09,09/Mar/16 18:54,
Bug,OODT-922,12936887,,filemgr-client returns Number of Products incorrectly,bugg_tb,shiwei,Minor,Resolved,Fixed,04/Feb/16 22:14,10/Feb/16 21:46,
Improvement,OODT-912,12909528,,replace print stacks with log output,,bugg_tb,Minor,Closed,Fixed,02/Nov/15 00:49,02/Nov/15 10:23,
New Feature,OODT-478,12600490,,Balance: New hook for hooks.php,ahart,nesbert,Minor,Resolved,Fixed,27/Jul/12 17:03,16/Oct/15 22:18,
Bug,OODT-886,12903535,,Unused imports in OODT,bugg_tb,bugg_tb,Minor,Closed,Fixed,08/Oct/15 22:39,10/Oct/15 13:13,
Bug,OODT-874,12862412,,"wmgr and resmgr scripts do not delete their cas.[workflow|resmgr].pid files",vmallder,vmallder,Minor,Resolved,Fixed,08/Sep/15 13:36,10/Sep/15 20:47,10/Sep/15 00:00
Improvement,OODT-246,12510828,,Give user the ability to print a detailed report on what jobs in the Resource Manager are running on what nodes,chrismattmann,gabe.resneck,Minor,Resolved,Fixed,19/Jun/11 05:41,31/Aug/15 06:20,
Improvement,OODT-248,12510830,,"Give user the ability to print a detailed report on the load, capacity and queues of all nodes in the Resource Manager",chrismattmann,gabe.resneck,Minor,Resolved,Fixed,19/Jun/11 05:47,31/Aug/15 02:56,
Improvement,OODT-245,12510827,,List results from the Resource Manager client should be sorted alphabetically,chrismattmann,gabe.resneck,Minor,Resolved,Fixed,19/Jun/11 05:39,31/Aug/15 02:56,
New Feature,OODT-560,12631971,,File Manager and Workflow Manager API additions to support integration with Wings,chrismattmann,varunratnakar,Minor,Resolved,Fixed,12/Feb/13 16:02,31/Aug/15 00:09,
Improvement,OODT-11,12458833,,Separate CAS-Resource serialization layers from interface implementations,,bfoster,Minor,Resolved,Won't Fix,11/Mar/10 17:21,30/Aug/15 21:41,
Improvement,OODT-12,12458834,,Allow configurable number of threads to monitor batch stubs,,bfoster,Minor,Resolved,Won't Fix,11/Mar/10 17:22,30/Aug/15 21:41,
Sub-task,OODT-562,12632044,12631971,Parent and Element editing for Product Types,,varunratnakar,Minor,Resolved,Fixed,12/Feb/13 19:04,30/Aug/15 07:14,
Improvement,OODT-244,12510826,,Allow the Resource Manager scheduler to cycle on a non-integer number of seconds,chrismattmann,gabe.resneck,Minor,Resolved,Fixed,19/Jun/11 05:36,30/Aug/15 05:05,
Dependency upgrade,OODT-864,12855445,,Upgrade to Tika 1.10,chrismattmann,tpalsulich,Minor,Resolved,Fixed,12/Aug/15 05:02,30/Aug/15 03:34,
New Feature,OODT-383,12543776,,Workflow Manager Client - Add Connection Limit Option,cgoodale,cgoodale,Minor,Resolved,Won't Fix,23/Feb/12 00:50,30/Aug/15 01:42,
Task,OODT-468,12595193,,Integration Test Infrastructure,bfoster,bfoster,Minor,Resolved,Won't Fix,20/Jun/12 01:17,30/Aug/15 01:41,
Improvement,OODT-325,12525662,,QueryTool does not retain query order,,lmzxq.tom,Minor,Resolved,Won't Fix,04/Oct/11 13:17,30/Aug/15 01:39,
Bug,OODT-307,12518262,,WEditor task level edges are always enabled ,chrismattmann,bfoster,Minor,Resolved,Won't Fix,08/Aug/11 23:59,30/Aug/15 01:38,
Test,OODT-32,12474514,,Provide Unit Tests for Actions,,pramirez,Minor,Resolved,Fixed,19/Sep/10 03:47,30/Aug/15 01:37,
Improvement,OODT-302,12514829,,Add support in the xmlquery package to handle HTTP Redirection,,mcayanan,Minor,Resolved,Fixed,20/Jul/11 20:56,28/Aug/15 18:48,
Improvement,OODT-303,12514830,,Add support in the Grid Package to throw an HTTP Servlet Response,,mcayanan,Minor,Resolved,Fixed,20/Jul/11 21:00,27/Aug/15 03:11,
Bug,OODT-149,12499996,,XmlRpcStructFactory when creating XmlRpc Job converts a Job's JobId to empty String but doesn't convert it back to null,bfoster,bfoster,Minor,Resolved,Won't Fix,01/Mar/11 00:27,27/Aug/15 02:40,
Bug,OODT-480,12600686,,Balance: default view not found,,nesbert,Minor,Resolved,Fixed,30/Jul/12 17:19,27/Aug/15 02:39,
New Feature,OODT-312,12520996,,Add the ability to pause and unpause the Resource Manager scheduler,gabe.resneck,gabe.resneck,Minor,Resolved,Won't Fix,01/Sep/11 00:16,27/Aug/15 02:30,
Question,OODT-370,12538427,,OODT Architectural aspect:Query-Workflow,,bw,Minor,Resolved,Cannot Reproduce,15/Jan/12 06:34,27/Aug/15 02:28,
New Feature,OODT-380,12542809,,Pypes UX,,adamestrada,Minor,Resolved,Won't Fix,16/Feb/12 01:00,27/Aug/15 02:27,
Bug,OODT-550,12626363,,'getFirstPage' Command Throws Exception After Restarting Server,chrismattmann,mcayanan,Minor,Resolved,Fixed,07/Jan/13 15:59,27/Aug/15 02:22,
Bug,OODT-587,12640148,,crawler-launcher fails to run,,arni.sumarlidason,Minor,Resolved,Not A Problem,01/Apr/13 18:49,27/Aug/15 02:16,
Bug,OODT-653,12673242,,Fix default port numbers in RADiX distribution,pramirez,pramirez,Minor,Resolved,Fixed,10/Oct/13 14:50,27/Aug/15 02:12,
Improvement,OODT-298,12513994,,Adding the ability to modify dataset name through the curator interface,chrismattmann,johnjtran,Minor,Resolved,Fixed,13/Jul/11 22:16,24/Aug/15 16:17,
Improvement,OODT-90,12493369,,CAS-PGE returns success even if product file(s) failed to ingest,chrismattmann,bfoster,Minor,Resolved,Fixed,15/Dec/10 22:39,21/Jun/15 20:51,
New Feature,OODT-826,12779441,, Add the capability to check external preconditions before ingesting a file.,vmallder,vmallder,Minor,Resolved,Done,04/Mar/15 16:57,23/Apr/15 15:31,
Bug,OODT-823,12776772,,OODT JDK8 Maven3 build errors,chrismattmann,1ceb00da,Minor,Resolved,Fixed,23/Feb/15 05:31,07/Apr/15 05:52,
Improvement,OODT-385,12543834,,Upgrade Tika  to version 1.0,tpalsulich,lmzxq.tom,Minor,Resolved,Fixed,23/Feb/12 13:08,06/Apr/15 17:01,
Improvement,OODT-515,12609980,,Implement an HDF5 Server Side Metadata Extractor,,mcayanan,Minor,Resolved,Won't Fix,02/Oct/12 20:39,05/Apr/15 06:00,
Bug,OODT-521,12613529,,ExpImpCatalog Tool doesn't wrap product_type_id in single quotes,cgoodale,cgoodale,Minor,Resolved,Not A Problem,25/Oct/12 17:59,05/Apr/15 05:55,29/Oct/12 00:00
Bug,OODT-761,12748103,,cas-workflow-0.3.jar delivered in radix installation resmgr/lib with oodt-0.7,pramirez,vmallder,Minor,Resolved,Fixed,14/Oct/14 18:25,29/Jan/15 07:22,
Bug,OODT-771,12752122,,push_pull_framework.properties path reference for config.external.properties.files in incorrect,lewismc,lewismc,Minor,Resolved,Fixed,01/Nov/14 00:03,29/Jan/15 07:22,
Task,OODT-645,12658374,,Fix discrepancies with 0.6 Release,tpalsulich,lewismc,Minor,Resolved,Fixed,17/Jul/13 21:22,13/Dec/14 23:53,
Bug,OODT-787,12754049,,PGE_ROOT env variable does not work in PGEConfig.xml and tasks.xml,chrismattmann,sneharad,Minor,Resolved,Fixed,10/Nov/14 04:20,12/Nov/14 10:41,
Bug,OODT-763,12749610,,Incorrect path to OODT_HOME and FILEMGR_HOME in query_tool,chrismattmann,vishalhemnani,Minor,Resolved,Fixed,21/Oct/14 20:33,06/Nov/14 06:34,
Improvement,OODT-782,12753302,,Resource manager port number must be compatible with the one used in workflow.properties,chrismattmann,murick,Minor,Resolved,Fixed,06/Nov/14 04:26,06/Nov/14 05:55,
Sub-task,OODT-764,12750440,12717138,Create a Resource Manager Backend That Muliplexes,,starchmd@umich.edu,Minor,Closed,Fixed,24/Oct/14 19:39,05/Nov/14 21:46,
Bug,OODT-767,12751855,,Add PGE to RADiX Archetype,,sshankars,Minor,Closed,Duplicate,31/Oct/14 02:19,01/Nov/14 22:37,
Bug,OODT-756,12745965,,HttpClient NoClassDefFoundError For the url-downloader Script,chrismattmann,angela_wang,Minor,Resolved,Fixed,05/Oct/14 03:04,05/Oct/14 16:58,
New Feature,OODT-669,12699673,,Make Resource Manager work without Ganglia,chrismattmann,rajiths,Minor,Resolved,Fixed,09/Mar/14 04:33,14/Sep/14 15:45,
Bug,OODT-473,12599490,,"Remove ""Deleted"" Metadata Flag from Solr Indexer",bugg_tb,pramirez,Minor,Closed,Fixed,19/Jul/12 16:06,26/Aug/14 09:58,
Bug,OODT-690,12713153,,"RADiX example policy for GenericFile missing ""<metadata/>"" node",chrismattmann,riverma,Minor,Resolved,Fixed,08/May/14 18:45,03/Aug/14 18:03,
Test,OODT-716,12721556,,Vagrant user on VM unable to start/stop oodt services,riverma,sherylj,Minor,Resolved,Fixed,17/Jun/14 00:21,03/Aug/14 17:50,
Bug,OODT-717,12721854,,OODT RADiX README has misleading build directions,riverma,riverma,Minor,Resolved,Fixed,18/Jun/14 07:09,18/Jun/14 07:13,
Improvement,OODT-679,12712084,,Create date time expander Filemgr MetExtractor,bfoster,bfoster,Minor,Resolved,Fixed,03/May/14 01:04,09/Jun/14 13:57,
Bug,OODT-703,12718365,,DataUtil.createProductZipFile throws exception when creating a zipfile of a hierarchical product,lmzxq.tom,lmzxq.tom,Minor,Resolved,Fixed,04/Jun/14 12:06,09/Jun/14 10:08,
Bug,OODT-675,12711355,,Correct typo in radix env.sh,skhudiky,skhudiky,Minor,Resolved,Fixed,30/Apr/14 01:14,09/Jun/14 04:51,
Improvement,OODT-681,12712099,,Create configurable MetadataBasedFileVersioner,bfoster,bfoster,Minor,Resolved,Fixed,03/May/14 06:55,03/May/14 15:43,
Improvement,OODT-629,12652756,,python wrapper for workflow xml-rpc,,sumarlidason,Minor,Resolved,Done,13/Jun/13 22:02,12/Feb/14 06:22,
