Issue Type,Issue key,Issue id,Parent id,Summary,Assignee,Reporter,Priority,Status,Resolution,Created,Updated,Due Date
Improvement,OODT-545,12624186,,Configure Curator back-end Catalog from web application XML descriptor,cinquini,cinquini,Major,Resolved,Fixed,16/Dec/12 13:00,17/Dec/12 16:17,
Bug,OODT-542,12623868,,Need to update logging.properties for all servers post CAS CLI,chrismattmann,chrismattmann,Major,Resolved,Not A Problem,14/Dec/12 00:14,14/Dec/12 00:31,
Improvement,OODT-535,12616416,,Allow Curator to remove existing metadata tags,cinquini,cinquini,Major,Resolved,Fixed,16/Nov/12 14:53,22/Nov/12 22:50,
Improvement,OODT-522,12613692,,Curator REST endpoint for updating existing catalog metadata ,cinquini,cinquini,Major,Resolved,Fixed,26/Oct/12 17:52,22/Nov/12 11:46,30/Nov/12 00:00
Improvement,OODT-529,12614447,,Lenient Lucene Catalog,cinquini,cinquini,Major,Resolved,Fixed,01/Nov/12 23:14,07/Nov/12 15:28,
Improvement,OODT-528,12614080,,Merge back changes made to CuratorLuceneCatalog into main stream LuceneCatalog,cinquini,cinquini,Major,Resolved,Fixed,30/Oct/12 20:45,07/Nov/12 15:25,
Improvement,OODT-534,12615163,,Better error message when product is not found in catalog,cinquini,cinquini,Major,Resolved,Fixed,07/Nov/12 14:59,07/Nov/12 15:01,
Improvement,OODT-533,12614998,,Allow SolrIndexer to ingest products by name,cinquini,cinquini,Major,Resolved,Fixed,06/Nov/12 18:11,06/Nov/12 21:25,
Bug,OODT-532,12614450,,"Missing file manager URL property in bean ""AprioriUniquessCheckWithFilemgr""",cinquini,cinquini,Major,Resolved,Fixed,01/Nov/12 23:27,01/Nov/12 23:32,
Bug,OODT-531,12614449,,Missing configuration options in cmd-line legacy beans,cinquini,cinquini,Major,Resolved,Fixed,01/Nov/12 23:23,01/Nov/12 23:25,
Bug,OODT-530,12614448,,MetExtractorProductCrawler gives NPE when wired with more than one preconditions,cinquini,cinquini,Major,Resolved,Fixed,01/Nov/12 23:18,01/Nov/12 23:19,
Improvement,OODT-523,12613693,,Update CXF dependency for Curator,cinquini,cinquini,Major,Resolved,Fixed,26/Oct/12 17:55,31/Oct/12 10:02,
Improvement,OODT-272,12510855,,Enable Removal of Finished Ingestion Tasks,chrismattmann,cgoodale,Major,Resolved,Fixed,19/Jun/11 08:02,25/Oct/12 14:04,
Bug,OODT-328,12526301,,Remove jpl.nasa.gov references from code,chrismattmann,chrismattmann,Major,Resolved,Fixed,08/Oct/11 03:15,25/Oct/12 14:02,
Sub-task,OODT-502,12607853,12605909,Support pre and post conditions in Workflow Processor Queue,chrismattmann,chrismattmann,Major,Resolved,Fixed,17/Sep/12 05:00,11/Oct/12 17:42,
Sub-task,OODT-516,12610330,12605909,Add WorkflowLifecycle tests that check pctComplete for wengine and w1 style lifecycles,chrismattmann,chrismattmann,Major,Resolved,Fixed,04/Oct/12 14:05,06/Oct/12 21:39,
Sub-task,OODT-501,12607852,12605909,Method to create Processor from Instance should be based on Graph structure,chrismattmann,chrismattmann,Major,Resolved,Fixed,17/Sep/12 04:58,27/Sep/12 18:38,
Sub-task,OODT-496,12607381,12605909,Convert EngineRunner interface to take TaskProcessor,chrismattmann,chrismattmann,Major,Resolved,Fixed,13/Sep/12 01:51,20/Sep/12 06:36,
Sub-task,OODT-505,12607917,12605909,Remove synchronous Runner,chrismattmann,chrismattmann,Major,Resolved,Fixed,17/Sep/12 15:47,17/Sep/12 15:48,
Sub-task,OODT-494,12605913,12605909,Decide whether or not we need ParallelProcessor,chrismattmann,chrismattmann,Major,Resolved,Fixed,02/Sep/12 17:06,17/Sep/12 05:11,
Sub-task,OODT-498,12607832,12605909,Overwrite and bring back 0.3 ThreadPoolWorkflowEngine plus patches,chrismattmann,chrismattmann,Major,Resolved,Fixed,16/Sep/12 20:26,16/Sep/12 21:41,
Sub-task,OODT-497,12607389,12605909,Make WorkflowProcessor PrioritySorters thread-safe,chrismattmann,chrismattmann,Major,Resolved,Fixed,13/Sep/12 02:57,13/Sep/12 02:58,
Sub-task,OODT-493,12605912,12605909,"Refactor TaskProcessor, ConditionProcessor, and SequentialProcessor",chrismattmann,chrismattmann,Major,Resolved,Fixed,02/Sep/12 17:04,07/Sep/12 01:50,
Sub-task,OODT-492,12605910,12605909,Refactor Workflow Instance repo to store/retrieve that state information,chrismattmann,chrismattmann,Major,Resolved,Fixed,02/Sep/12 17:02,05/Sep/12 05:57,
Sub-task,OODT-490,12605907,12605909,Refactor WorkflowProcessor to push all of its state information into Workflow Instance,chrismattmann,chrismattmann,Major,Resolved,Fixed,02/Sep/12 16:50,04/Sep/12 01:05,
Sub-task,OODT-202,12510780,12510793,NonBlockWorkflow double processing and not pausing,chrismattmann,bfoster,Major,Resolved,Not A Problem,18/Jun/11 23:54,01/Sep/12 21:01,
Sub-task,OODT-203,12510781,12510793,Create a Non-Blocking threaded implementation of the Workflow Engine,chrismattmann,woollard,Major,Resolved,Fixed,18/Jun/11 23:56,01/Sep/12 21:01,
Sub-task,OODT-381,12543566,12510793,Create Runner framework to allow flexible WorkflowTask execution on different runtimes,chrismattmann,chrismattmann,Major,Resolved,Fixed,21/Feb/12 21:11,01/Sep/12 20:59,
Sub-task,OODT-310,12518953,12510793,Port WEngine to trunk,chrismattmann,chrismattmann,Major,Resolved,Fixed,16/Aug/11 04:20,01/Sep/12 20:58,
Improvement,OODT-489,12605384,,Reduce number of queries for filemanager lucene catalog,pramirez,pramirez,Major,Resolved,Fixed,29/Aug/12 15:07,30/Aug/12 15:44,
Improvement,OODT-390,12544285,,Remove Embedded Optimize from Lucene Workflow Instance Repository,pramirez,pramirez,Major,Resolved,Fixed,27/Feb/12 17:56,29/Aug/12 14:53,
Bug,OODT-486,12605010,,WorkflowInstance tries to cast null strings into dates causing exceptions on getters/setters,chrismattmann,chrismattmann,Major,Resolved,Fixed,26/Aug/12 18:04,26/Aug/12 18:43,
Bug,OODT-474,12599743,,Fixed the probem having in a configuration file ProtocolFactoryInfo.xml,chrismattmann,yhkang,Major,Resolved,Fixed,22/Jul/12 04:59,31/Jul/12 00:25,
Bug,OODT-476,12600126,,RemoteSiteFile doesn't always set RemoteSite,bfoster,bfoster,Major,Resolved,Fixed,25/Jul/12 07:39,27/Jul/12 19:08,
Task,OODT-329,12526346,,OODT PEAR channel,chrismattmann,chrismattmann,Major,Resolved,Fixed,08/Oct/11 21:59,27/Jul/12 16:44,
Improvement,OODT-462,12558589,,Include additional instructions in opendapps configuration file,cinquini,cinquini,Major,Resolved,Fixed,30/May/12 13:02,07/Jun/12 06:25,
Bug,OODT-463,12558590,,Opendapps not parsing DAS container attributes,cinquini,cinquini,Major,Resolved,Fixed,30/May/12 13:08,30/May/12 13:09,
Sub-task,OODT-262,12510844,12510793,Allow input data files to be staged in a local directory,bfoster,bfoster,Major,Resolved,Fixed,19/Jun/11 07:45,27/May/12 05:43,
Task,OODT-402,12545098,,Write default File Manager policy and associated RSS conf to automatically publish GeoRSS to Apache SIS,rlaidlaw,chrismattmann,Major,Resolved,Fixed,04/Mar/12 17:18,25/May/12 21:10,
Sub-task,OODT-453,12553197,12545098,Create default File Manager policy for LocationAwareProduct,rlaidlaw,rlaidlaw,Major,Resolved,Fixed,27/Apr/12 20:35,25/May/12 21:08,
Improvement,OODT-157,12501314,,PCS Operator User Interface web application,chrismattmann,chrismattmann,Major,Resolved,Fixed,14/Mar/11 03:08,25/May/12 21:04,
Bug,OODT-291,12510884,,TimeEventWeightedHash throws a StackOverthrow Error when epsilon is large and event duration is small,bfoster,bfoster,Major,Resolved,Fixed,19/Jun/11 18:55,25/May/12 21:03,
Sub-task,OODT-452,12553195,12545098,Move the default File Manager policy files to 'core' subdirectory,rlaidlaw,rlaidlaw,Major,Resolved,Fixed,27/Apr/12 20:28,25/May/12 21:01,
Sub-task,OODT-449,12553174,12545098,Create a default GeoRSS configuration file for the fmprod web application,rlaidlaw,rlaidlaw,Major,Resolved,Fixed,27/Apr/12 17:11,25/May/12 20:59,
Bug,OODT-459,12556712,,Filemgr Client Tool Doesn't Seem To Support Queries with WHERE Clauses Containing Multiple Conditions,bfoster,mcayanan,Major,Resolved,Won't Fix,21/May/12 17:13,21/May/12 23:51,
Bug,OODT-457,12555166,,Balance Cas-browser is missing DataTables images,skhudiky,skhudiky,Major,Resolved,Fixed,14/May/12 17:52,16/May/12 18:11,
Improvement,OODT-451,12553189,,Implement Marker File precondition,cinquini,cinquini,Major,Resolved,Fixed,27/Apr/12 19:32,08/May/12 11:49,
Improvement,OODT-445,12551516,,Extend env replace support introduced in OODT-343,ahart,ahart,Major,Resolved,Fixed,18/Apr/12 19:49,01/May/12 18:39,
Bug,OODT-444,12551513,,Utils class missing from Balance cas-browser module,ahart,ahart,Major,Resolved,Fixed,18/Apr/12 19:24,01/May/12 18:38,
Improvement,OODT-450,12553187,,Deletion of directory upon product ingestion,cinquini,cinquini,Major,Resolved,Fixed,27/Apr/12 19:17,29/Apr/12 12:13,
Sub-task,OODT-421,12546885,12510793,Make WorkflowLifecycleManager understand WorkflowStates,chrismattmann,chrismattmann,Major,Resolved,Fixed,17/Mar/12 03:34,29/Apr/12 03:44,
Improvement,OODT-442,12550928,,Apache project branding requirements: DOAP file [PATCH],chrismattmann,curcuru,Major,Resolved,Fixed,14/Apr/12 03:23,14/Apr/12 15:34,
Bug,OODT-277,12510869,,Query parser didn't allow for negative numbers for values,bfoster,bfoster,Major,Resolved,Fixed,19/Jun/11 18:00,02/Apr/12 21:01,
Improvement,OODT-290,12510883,,Make StringTransactionId use UTF8 encoding on its strings,bfoster,bfoster,Major,Resolved,Fixed,19/Jun/11 18:51,02/Apr/12 21:00,
New Feature,OODT-265,12510848,,Add ability for cas-pge to do automated product file renaming before met file creation and ingest,bfoster,bfoster,Major,Resolved,Fixed,19/Jun/11 07:50,02/Apr/12 20:59,
Improvement,OODT-281,12510873,,OptionHelpException for commons command-line parser,bfoster,bfoster,Major,Resolved,Fixed,19/Jun/11 18:32,02/Apr/12 20:53,
Improvement,OODT-258,12510840,,Improve command line arguments to file manager,chrismattmann,johnjtran,Major,Resolved,Won't Fix,19/Jun/11 07:39,02/Apr/12 20:50,
Improvement,OODT-255,12510837,,Command line parser grouping,bfoster,bfoster,Major,Resolved,Fixed,19/Jun/11 07:29,02/Apr/12 20:38,
Improvement,OODT-289,12510882,,Allow for unsorted paging across all catalogs to give option of lowering heap footprint,bfoster,bfoster,Major,Resolved,Fixed,19/Jun/11 18:50,02/Apr/12 20:37,
Improvement,OODT-276,12510868,,PathUtils replacement functionalities should use reluctant pattern greps,bfoster,bfoster,Major,Resolved,Fixed,19/Jun/11 17:59,02/Apr/12 20:32,
Bug,OODT-286,12510879,,Catalog query parser fails when bucketNames are given,bfoster,bfoster,Major,Resolved,Fixed,19/Jun/11 18:46,02/Apr/12 20:28,
Bug,OODT-269,12510852,,LoggerOutputStream doesn't dump logging info correctly,bfoster,bfoster,Major,Resolved,Fixed,19/Jun/11 07:57,02/Apr/12 20:26,
Improvement,OODT-261,12510843,,Make PGE logger stream only deal with PGE ,bfoster,bfoster,Major,Closed,Duplicate,19/Jun/11 07:44,02/Apr/12 20:19,
Sub-task,OODT-435,12548974,12510793,Refactor Graph and ParentChildWorkflow class outside of PackagedWorkflowRepository,chrismattmann,chrismattmann,Major,Resolved,Fixed,31/Mar/12 23:36,31/Mar/12 23:38,
Bug,OODT-429,12547715,,filemgr query throws NPE when sorting by key with possibly empty values,,rickdn,Major,Resolved,Fixed,23/Mar/12 00:03,26/Mar/12 21:08,
Bug,OODT-427,12547673,,"filemgr query throws ""String index out of range: -1"" when some products have undefined metadata values",,rickdn,Major,Resolved,Fixed,22/Mar/12 20:07,26/Mar/12 16:23,
Sub-task,OODT-431,12547887,12546505,fix unit test for TestMappedDataSourceCatalog,,rickdn,Major,Resolved,Fixed,23/Mar/12 21:28,23/Mar/12 21:43,
Improvement,OODT-405,12546106,,Expanded syntax for environment variable replacement,,cinquini,Major,Closed,Fixed,12/Mar/12 15:03,23/Mar/12 10:36,
New Feature,OODT-410,12546505,,DataSourceCatalog compatible with HypersonicSQL,chrismattmann,chrismattmann,Major,Resolved,Fixed,14/Mar/12 23:37,19/Mar/12 14:59,
Bug,OODT-413,12546703,,filemgr query throws NPE when some products have undefined metadata values,,rickdn,Major,Resolved,Fixed,16/Mar/12 01:37,19/Mar/12 05:09,
Sub-task,OODT-71,12492586,12510793,"Add lifecycle model supporting transition, done and waiting states",chrismattmann,chrismattmann,Major,Resolved,Fixed,07/Dec/10 07:18,17/Mar/12 03:19,
Bug,OODT-395,12544392,,SerializableMetadata.toXml() doesn't set namespace on root element,,rickdn,Major,Resolved,Fixed,28/Feb/12 08:56,02/Mar/12 15:37,
Improvement,OODT-373,12540937,,PCS OpsUI component not listed in OODT pom.xml,ahart,ahart,Major,Resolved,Fixed,02/Feb/12 15:15,28/Feb/12 19:14,
Improvement,OODT-396,12544426,,Add shutdown hook to the Workflow Manager server,chrismattmann,chrismattmann,Major,Resolved,Fixed,28/Feb/12 15:00,28/Feb/12 15:01,
Bug,OODT-389,12544217,,Implement Lucene catalog initialization at Workflow Manager startup,pramirez,pramirez,Major,Resolved,Fixed,27/Feb/12 04:06,27/Feb/12 18:08,
Improvement,OODT-382,12543670,,Implement Lucene catalog initialization at Filemanager startup,pramirez,cinquini,Major,Resolved,Fixed,22/Feb/12 12:35,27/Feb/12 17:45,
Improvement,OODT-388,12544175,,Clearly indicate location for loading globally-required modules,ahart,ahart,Major,Resolved,Fixed,26/Feb/12 16:50,26/Feb/12 16:56,
New Feature,OODT-326,12525859,,A tool to dump the File Manager catalog metadata into Solr,chrismattmann,chrismattmann,Major,Resolved,Fixed,05/Oct/11 16:57,24/Feb/12 17:22,
Improvement,OODT-371,12539277,,Improve the richness and consistency of metadata extracted from the THREDDS catalogs,chrismattmann,cinquini,Major,Resolved,Fixed,21/Jan/12 11:51,23/Feb/12 11:50,
Improvement,OODT-341,12528994,,XMLPS should be able to stream large results,chrismattmann,rickdn,Major,Resolved,Fixed,26/Oct/11 23:38,21/Feb/12 05:08,
New Feature,OODT-356,12533317,,Tool to clean Workflow Instance repositories,chrismattmann,chrismattmann,Major,Resolved,Fixed,30/Nov/11 17:16,05/Feb/12 06:21,
Bug,OODT-372,12540659,,Correct LDAPAuthenticationProvider class name,,skhudiky,Major,Resolved,Fixed,01/Feb/12 00:27,02/Feb/12 15:34,
Improvement,OODT-256,12510838,,updateMetadata needed in XmlRpcFileManager,chrismattmann,pramirez,Major,Resolved,Fixed,19/Jun/11 07:34,22/Jan/12 04:41,
Improvement,OODT-368,12537364,,Refactoring of metadata extraction functionality for opendapps module,chrismattmann,cinquini,Major,Resolved,Fixed,05/Jan/12 17:27,16/Jan/12 19:37,
Improvement,OODT-366,12536157,,Extension to opendapps module to extract ALL variables in DDS stream,chrismattmann,cinquini,Major,Resolved,Fixed,22/Dec/11 13:47,03/Jan/12 04:34,
Improvement,OODT-365,12535438,,Main class to drive opendapps profile generation,chrismattmann,cinquini,Major,Resolved,Fixed,16/Dec/11 09:58,03/Jan/12 04:30,
Improvement,OODT-367,12536723,,Integrate CAS protocol into PushPull,chrismattmann,chrismattmann,Major,Resolved,Fixed,31/Dec/11 05:04,02/Jan/12 19:04,
Improvement,OODT-364,12534852,,prevent XSS attacks via malformed query string,ahart,ahart,Major,Resolved,Fixed,12/Dec/11 23:29,21/Dec/11 20:33,
Bug,OODT-359,12533385,,CmdLineUtility is not printing action messages,bfoster,bfoster,Major,Resolved,Fixed,01/Dec/11 00:32,03/Dec/11 20:06,
Improvement,OODT-336,12527479,,xmlps should omit joining of tables that are unnecessary to fulfill query,chrismattmann,rickdn,Major,Resolved,Fixed,17/Oct/11 18:43,28/Nov/11 04:41,
Improvement,OODT-343,12530069,,Add support for basic 'environment replacement' in module config.ini files,ahart,ahart,Major,Resolved,Fixed,03/Nov/11 15:18,23/Nov/11 22:59,
Bug,OODT-347,12531027,,Crawler doesn't work when offline,pramirez,chrismattmann,Major,Closed,Fixed,10/Nov/11 17:07,11/Nov/11 06:15,
Bug,OODT-344,12530531,,Workflow Conditions and Timeout Seconds causes backwards incompat SerDe issues with XML-RPC,chrismattmann,chrismattmann,Major,Resolved,Fixed,07/Nov/11 05:45,07/Nov/11 05:49,
Bug,OODT-342,12530057,,Typo in BreadcrumbWidget class definition,ahart,ahart,Major,Resolved,Fixed,03/Nov/11 14:44,03/Nov/11 14:47,
Improvement,OODT-332,12527043,,Add a skeletal application template to the balance component,ahart,ahart,Major,Resolved,Fixed,13/Oct/11 16:44,31/Oct/11 05:20,
Bug,OODT-322,12524985,,LDAPAuthenticationProvider class requires a non-existent path,chrismattmann,skhudiky,Major,Resolved,Fixed,27/Sep/11 23:33,05/Oct/11 21:27,
Bug,OODT-321,12524982,,PEAR install of PHP filemgr is not working properly,chrismattmann,skhudiky,Major,Resolved,Fixed,27/Sep/11 23:27,05/Oct/11 21:23,
New Feature,OODT-327,12525862,,Open SSO plug-in client for CAS-SSO,chrismattmann,chrismattmann,Major,Resolved,Fixed,05/Oct/11 17:10,05/Oct/11 17:23,
Bug,OODT-61,12480242,,appendTableName property for mapping files in XMLPS breaks columnname-based lookup in ResultSet,chrismattmann,davekale,Major,Resolved,Fixed,17/Nov/10 19:29,28/Sep/11 04:23,26/Nov/10 00:00
Improvement,OODT-318,12523809,,Fix for Jenkins builds and java.io.tmpdir issue for testing via Maven,chrismattmann,chrismattmann,Major,Resolved,Fixed,21/Sep/11 02:10,25/Sep/11 00:01,
Sub-task,OODT-317,12523289,12510793,Workflow Priority Sorting,chrismattmann,chrismattmann,Major,Resolved,Fixed,16/Sep/11 04:34,17/Sep/11 20:24,
Bug,OODT-313,12522323,,Copyright statement on OODT website needs updating,chrismattmann,gstein,Major,Resolved,Fixed,08/Sep/11 20:59,08/Sep/11 21:03,
Bug,OODT-311,12519849,,Test failing related to workflow tasks and the DataSourceWorkflowRepository,chrismattmann,riverma,Major,Resolved,Fixed,23/Aug/11 17:09,23/Aug/11 17:48,
Bug,OODT-299,12514471,,Rename all Authentication properties to use Authentication instead of Auth,ahart,skhudiky,Major,Resolved,Fixed,18/Jul/11 17:22,22/Aug/11 03:30,
Sub-task,OODT-309,12518891,12510793,SequentialWorkflowProcessor doesn't need to be a Thread,chrismattmann,chrismattmann,Major,Resolved,Fixed,15/Aug/11 15:30,15/Aug/11 15:32,
Sub-task,OODT-205,12510783,12510793,WorkflowInstances should have pre-conditions as well,chrismattmann,chrismattmann,Major,Resolved,Fixed,19/Jun/11 00:02,14/Aug/11 07:08,
Sub-task,OODT-208,12510786,12510793,WorkflowConditions should be identifiable as optional or required,chrismattmann,chrismattmann,Major,Resolved,Fixed,19/Jun/11 00:06,12/Aug/11 01:18,
Sub-task,OODT-209,12510787,12510793,Workflow Manager Dynamic Workflows,chrismattmann,chrismattmann,Major,Resolved,Fixed,19/Jun/11 00:16,11/Aug/11 16:07,
Sub-task,OODT-206,12510784,12510793,WorkflowConditions should return a WorkflowConditionOutput that contains failReasons,chrismattmann,chrismattmann,Major,Resolved,Fixed,19/Jun/11 00:03,11/Aug/11 14:06,
Sub-task,OODT-211,12510789,12510793,Sub Workflows,chrismattmann,pramirez,Major,Resolved,Fixed,19/Jun/11 00:23,10/Aug/11 06:24,
Sub-task,OODT-207,12510785,12510793,WorkflowConditions should have a timeout ,chrismattmann,chrismattmann,Major,Resolved,Fixed,19/Jun/11 00:05,10/Aug/11 06:23,
Bug,OODT-300,12514548,,Product Type misconfiguration,,johnjtran,Major,Closed,Not A Problem,19/Jul/11 07:52,19/Jul/11 19:29,
Task,OODT-294,12512254,,Update OODT Website with 0.3 Release News,cgoodale,cgoodale,Major,Resolved,Fixed,29/Jun/11 20:52,08/Jul/11 05:06,01/Jul/11 00:00
Sub-task,OODT-210,12510788,12510793,Support graph-based workflows using nextTask tags,chrismattmann,chrismattmann,Major,Resolved,Fixed,19/Jun/11 00:19,05/Jul/11 03:40,
Sub-task,OODT-70,12492585,12510793,Add ability for sequential and parallel task specifications for Workflows,chrismattmann,chrismattmann,Major,Resolved,Fixed,07/Dec/10 07:02,04/Jul/11 21:29,
Improvement,OODT-279,12510871,,Make Resource Manager FAILURE and SUCCESS aware instead of just COMPLETE aware,chrismattmann,bfoster,Major,Resolved,Fixed,19/Jun/11 18:13,19/Jun/11 18:26,
Improvement,OODT-278,12510870,,CAS-PGE returns success even if product file(s) fail to ingest,chrismattmann,bfoster,Major,Resolved,Fixed,19/Jun/11 18:04,19/Jun/11 18:07,
Improvement,OODT-243,12510825,,Add method is called on already existing jobspec,chrismattmann,bfoster,Major,Resolved,Fixed,19/Jun/11 05:26,19/Jun/11 05:30,
New Feature,OODT-186,12505048,,Common base library for modular OODT web applications built using PHP,ahart,ahart,Major,Resolved,Fixed,23/Apr/11 15:04,06/Jun/11 00:59,
Improvement,OODT-198,12509296,,Add test harness for XmlRpcResourceManager,chrismattmann,chrismattmann,Major,Resolved,Fixed,05/Jun/11 04:59,05/Jun/11 05:22,
New Feature,OODT-162,12501762,,Parametric Data Model File Manager Catalog,chrismattmann,chrismattmann,Major,Resolved,Fixed,18/Mar/11 06:18,05/Jun/11 04:13,
New Feature,OODT-193,12506658,,PGE ExternMetExtractor MetWriter,chrismattmann,bfoster,Major,Resolved,Fixed,09/May/11 22:27,13/May/11 15:45,
New Feature,OODT-192,12506635,,PGE FilenameExtractorMetWriter,chrismattmann,chrismattmann,Major,Resolved,Fixed,09/May/11 16:58,13/May/11 15:44,
Improvement,OODT-156,12501313,,Rewrite Workflow Monitor webapp using Apache Wicket,chrismattmann,chrismattmann,Major,Resolved,Fixed,14/Mar/11 03:04,13/May/11 15:41,
Bug,OODT-189,12506173,,Refactor and clean up WorkflowCondition Configuration,chrismattmann,chrismattmann,Major,Resolved,Fixed,04/May/11 14:09,04/May/11 14:11,
New Feature,OODT-188,12506102,,Precondition Comparator to ignore files with a particular extension,chrismattmann,chrismattmann,Major,Resolved,Fixed,03/May/11 21:23,03/May/11 21:31,
Improvement,OODT-177,12504309,,PHP implementation of sso,ahart,ahart,Major,Resolved,Fixed,14/Apr/11 19:23,26/Apr/11 04:43,
Improvement,OODT-155,12501312,,Rewrite File Manager Browser webapp using Apache Wicket,chrismattmann,chrismattmann,Major,Resolved,Fixed,14/Mar/11 03:03,24/Apr/11 01:36,
Improvement,OODT-181,12504589,,Add documentation for metFileExt attribute on exec element in ExternMetExtractor,chrismattmann,chrismattmann,Major,Resolved,Fixed,18/Apr/11 19:44,19/Apr/11 01:55,
Improvement,OODT-179,12504469,,Upgrade PushPull FTP protocol to use Commons Net 2.2,chrismattmann,chrismattmann,Major,Resolved,Fixed,17/Apr/11 05:01,17/Apr/11 15:18,
Improvement,OODT-173,12504016,,Improvements to the Filename Extractor,chrismattmann,chrismattmann,Major,Resolved,Fixed,12/Apr/11 06:13,17/Apr/11 04:52,
Improvement,OODT-176,12504190,,Baked in file manager policy should include example of product type metadata,chrismattmann,chrismattmann,Major,Resolved,Fixed,13/Apr/11 15:31,13/Apr/11 15:35,
Bug,OODT-50,12477767,,Possible bug in grid configuration stuff,chrismattmann,davekale,Major,Resolved,Cannot Reproduce,19/Oct/10 18:11,20/Mar/11 05:47,30/Nov/10 00:00
Bug,OODT-45,12477067,,Webgrid does not save configuration on java 1.6,,smcclees,Major,Resolved,Cannot Reproduce,11/Oct/10 20:41,20/Mar/11 05:45,
New Feature,OODT-164,12501858,,AcqusitionDate Versioner,chrismattmann,chrismattmann,Major,Resolved,Fixed,19/Mar/11 06:42,20/Mar/11 04:53,
New Feature,OODT-163,12501857,,DirectoryProduct Versioner for the File Manager,chrismattmann,chrismattmann,Major,Resolved,Fixed,19/Mar/11 06:07,19/Mar/11 21:11,
New Feature,OODT-151,12500717,,Add xdocs for modules from old JPL site,chrismattmann,chrismattmann,Major,Resolved,Fixed,08/Mar/11 02:08,08/Mar/11 06:25,
Bug,OODT-140,12498579,,commons-lang version should be standardized on (2.1. vs 2.3),bfoster,bfoster,Major,Resolved,Fixed,14/Feb/11 22:13,15/Feb/11 17:06,
New Feature,OODT-135,12498204,,Process Control System Package,chrismattmann,chrismattmann,Major,Resolved,Fixed,10/Feb/11 07:39,12/Feb/11 19:11,
Bug,OODT-136,12498252,,Lack of cataloged mime type causes recoverable exception in Reference core class,chrismattmann,chrismattmann,Major,Resolved,Fixed,10/Feb/11 14:49,10/Feb/11 15:44,
Improvement,OODT-134,12498084,,Update the Website with Links and news related to 0.2 Release.,cgoodale,cgoodale,Major,Closed,Fixed,09/Feb/11 05:41,10/Feb/11 06:00,11/Feb/11 00:00
Bug,OODT-121,12496614,,"Version in trunk of components should contain ""-dev"" or ""-SNAPHSOT"" ",pramirez,pramirez,Major,Resolved,Fixed,24/Jan/11 23:24,08/Feb/11 04:41,
New Feature,OODT-127,12497493,,PCS middleware web service,,skhudiky,Major,Resolved,Duplicate,02/Feb/11 19:28,03/Feb/11 00:07,
Bug,OODT-73,12492745,,Remove references to the incubator from the project site,cgoodale,cgoodale,Major,Resolved,Fixed,08/Dec/10 15:38,10/Jan/11 22:24,18/Dec/10 00:00
Improvement,OODT-58,12479512,,update file manager to use Tika for mime-type detection,chrismattmann,ahart,Major,Resolved,Fixed,09/Nov/10 17:44,30/Dec/10 05:46,
Bug,OODT-101,12493785,,trunk doesn't get built successfully--Javadoc error,chrismattmann,davoodi,Major,Resolved,Not A Problem,21/Dec/10 19:21,24/Dec/10 06:42,
Bug,OODT-106,12494025,,Logging properties for OPeNDAP ps doesn't include required .level suffix,chrismattmann,chrismattmann,Major,Resolved,Fixed,24/Dec/10 06:38,24/Dec/10 06:40,
Bug,OODT-105,12494024,,Fix GeospatialCoverage in OPeNDAP ps,chrismattmann,chrismattmann,Major,Resolved,Fixed,24/Dec/10 06:33,24/Dec/10 06:37,
New Feature,OODT-104,12493940,,Allow const section to plumb information into profile elements,chrismattmann,chrismattmann,Major,Resolved,Fixed,23/Dec/10 02:57,24/Dec/10 06:32,
Improvement,OODT-103,12493828,,modify cas-common's cmd-line parser to throw a special OptionHelpException if no args are specified so it can be specifically trapped,bfoster,bfoster,Major,Resolved,Fixed,22/Dec/10 03:48,22/Dec/10 18:02,
Bug,OODT-100,12493784,,Error during build process regarding OPeNDAPPs,chrismattmann,davoodi,Major,Resolved,Won't Fix,21/Dec/10 19:17,22/Dec/10 01:10,
Bug,OODT-99,12493783,,trunk doesn't get built successfully--Unit test error,,davoodi,Major,Resolved,Duplicate,21/Dec/10 19:13,21/Dec/10 21:27,
Bug,OODT-96,12493695,,cas-catalog query parser fails when bucketNames are given,bfoster,bfoster,Major,Resolved,Fixed,20/Dec/10 17:39,21/Dec/10 00:43,
Bug,OODT-85,12493213,,XML configurator for opendap crashes on null pointer exceptions for some datasets,chrismattmann,vhwang,Major,Resolved,Fixed,14/Dec/10 17:14,16/Dec/10 05:38,
Question,OODT-64,12480660,,java sql BatchUpdateExeception when trying to run TestCatalogServiceLocal,,lmzxq.tom,Major,Closed,Fixed,23/Nov/10 10:22,25/Nov/10 04:45,
Bug,OODT-62,12480353,,DateTimeVersioner fails on + side of the GMT line,chrismattmann,chrismattmann,Major,Resolved,Fixed,18/Nov/10 16:28,21/Nov/10 02:35,
Bug,OODT-59,12480000,,"CAS pushpull component depends on Tika 0.8-SNAPSHOT, which now breaks compile",davekale,davekale,Major,Resolved,Fixed,15/Nov/10 21:06,15/Nov/10 21:09,15/Nov/10 00:00
