Issue Type,Issue key,Issue id,Summary,Assignee,Reporter,Priority,Status,Resolution,Created,Updated,Due Date
Improvement,PIVOT-344,12441077,Change TextInput tutorial to use TextInput suggestions list,,tvolkert,Trivial,Resolved,Won't Fix,18/Nov/09 18:13,02/May/13 02:29,
Bug,PIVOT-888,12627482,Nullpointer Exception while editing TextArea with text property two-way bounded,smartini,kaja78,Trivial,Resolved,Fixed,14/Jan/13 19:11,15/Feb/13 15:57,
Improvement,PIVOT-536,12467418,BXMLSerializer should provide a structure error object when a serializer error occurs,rwhitcomb,aappddeevv,Trivial,Resolved,Fixed,19/Jun/10 23:01,05/Nov/12 17:16,
Improvement,PIVOT-875,12610655,JSON should support using pivot.collections.Map directly,,rwhitcomb,Trivial,Resolved,Fixed,05/Oct/12 22:33,05/Oct/12 23:23,
Improvement,PIVOT-679,12492026,TableViewImageCellRenderer should render disabled rows with an opacity of 0.5f,rwhitcomb,cbartlett,Trivial,Resolved,Fixed,03/Dec/10 20:28,27/Jul/12 22:06,
Improvement,PIVOT-508,12465753,TextArea displays blinking cursor even when it's in read-only mode.,smartini,tvolkert,Trivial,Resolved,Fixed,30/May/10 22:02,04/May/12 10:52,
Improvement,PIVOT-816,12530372,"Add ""setSelectedTab(Component)"" method to TabPane to facilitate selecting tabs programmatically",rwhitcomb,rwhitcomb,Trivial,Resolved,Fixed,04/Nov/11 19:53,04/Nov/11 22:22,07/Nov/11 00:00
Improvement,PIVOT-812,12528943,Add style to TabPane to specify the tab button corner radius,rwhitcomb,rwhitcomb,Trivial,Resolved,Fixed,26/Oct/11 18:49,28/Oct/11 18:27,28/Oct/11 00:00
Improvement,PIVOT-795,12524888,Add access in TerraFileBrowserSheetSkin to allow additional fields in the dialog,rwhitcomb,rwhitcomb,Trivial,Resolved,Fixed,27/Sep/11 16:08,13/Oct/11 21:58,28/Sep/11 00:00
Improvement,PIVOT-459,12462176,Fix spacing issues in tutorial HTML,smartini,gbrown,Trivial,Open,,15/Apr/10 18:45,13/Oct/11 09:50,
Improvement,PIVOT-763,12511172,Add tri-state checkbox renderer for TableView row editors,rwhitcomb,whiro01,Trivial,Resolved,Fixed,21/Jun/11 21:45,22/Jun/11 16:37,
Wish,PIVOT-678,12492023,Consider changing TerraSuggestionPopupSkin to use a ScrollPane rather than a Panorama,,cbartlett,Trivial,Resolved,Not A Problem,03/Dec/10 19:47,22/Jun/11 10:47,
New Feature,PIVOT-746,12507823,"Add API to return Version of Pivot retrieved from ""build.properties""",gbrown,whiro01,Trivial,Resolved,Fixed,19/May/11 22:26,06/Jun/11 19:56,
Improvement,PIVOT-670,12480111,Generic types for listeners,,ikarius,Trivial,Resolved,Won't Fix,16/Nov/10 13:20,16/Nov/10 22:37,
Improvement,PIVOT-645,12474974,Remove the keyboardFolderTraversalEnabled style from TerraFileBrowserSkin ,cbartlett,cbartlett,Trivial,Resolved,Won't Fix,23/Sep/10 20:53,02/Nov/10 12:35,
Bug,PIVOT-660,12478420,Picture resample fails on some BufferedImage,,jujumonkey,Trivial,Resolved,Not A Problem,27/Oct/10 05:49,29/Oct/10 17:07,
Improvement,PIVOT-627,12473260,Painting RadioButton with null ButtonData,,m1_v1da_l0ca,Trivial,Resolved,Fixed,03/Sep/10 17:29,03/Sep/10 21:19,
Improvement,PIVOT-287,12435090,"Inconsistency between TableView, ListView, and TreeView as to when to consume arrow key events",grandinj,tvolkert,Trivial,Resolved,Fixed,08/Sep/09 11:41,16/Aug/10 14:03,
Bug,PIVOT-598,12471667,Not found url on BUILD file,,dutrieux,Trivial,Resolved,Fixed,16/Aug/10 08:38,16/Aug/10 12:27,
Wish,PIVOT-347,12441189,Add a Block Cursor,smartini,smartini,Trivial,Open,,19/Nov/09 14:16,11/Aug/10 10:37,
Improvement,PIVOT-591,12471042,add a readObject(File) method to WTKXSerializer,,ozbtech,Trivial,Resolved,Won't Fix,07/Aug/10 15:31,09/Aug/10 13:21,
Improvement,PIVOT-590,12471004,"Make ""collapsible"" an intrinsic property of TabPane",,gbrown,Trivial,Resolved,Fixed,06/Aug/10 19:49,06/Aug/10 19:49,
Bug,PIVOT-510,12465755,"If window was last on secondary monitor, if you launch without a secondary monitor it still tries to display on secondary monitor",,david.turner.apache,Trivial,Resolved,Fixed,30/May/10 22:24,29/Jun/10 18:03,
Improvement,PIVOT-532,12467408,Bad link in Data Binding tutorial,,cbartlett,Trivial,Resolved,Fixed,19/Jun/10 17:18,20/Jun/10 13:22,
Improvement,PIVOT-439,12459979,Remove the TablePane.Row.setVisible() method,tvolkert,gbrown,Trivial,Resolved,Fixed,23/Mar/10 12:04,25/Mar/10 18:54,
Improvement,PIVOT-416,12456556,Small improvements for (generated) HTML Pages,,smartini,Trivial,Open,,17/Feb/10 16:35,17/Feb/10 16:35,
Improvement,PIVOT-387,12446438,Deploy Pivot source to the maven repository,,ccadete,Trivial,Resolved,Duplicate,23/Jan/10 21:38,24/Jan/10 03:48,
Bug,PIVOT-363,12443258,Stock Tracker Demo: Inconsistent Selection Behavior when Adding New Ticket Symbol,gbrown,tvolkert,Trivial,Resolved,Fixed,14/Dec/09 11:45,16/Dec/09 14:33,
Bug,PIVOT-362,12443254,Drag&Drop in Kitchen Sink Allows One Image to Overwrite Another,gbrown,tvolkert,Trivial,Resolved,Fixed,14/Dec/09 11:18,16/Dec/09 13:36,
Bug,PIVOT-249,12434270,Compile warnings [rawtypes] when built with JDK1.7,tvolkert,tvolkert,Trivial,Resolved,Fixed,28/Aug/09 12:14,17/Nov/09 22:40,
Improvement,PIVOT-325,12437948,Allow to use SHIFT+END/HOME to select text in TextInput ,gbrown,mamonov,Trivial,Resolved,Fixed,13/Oct/09 08:02,13/Oct/09 12:40,
Improvement,PIVOT-142,12427213,Use common Shortcuts in Input fields,gbrown,smartini,Trivial,Resolved,Fixed,05/Jun/09 13:11,13/Oct/09 08:02,
Improvement,PIVOT-283,12435086,Focus traversal from the Calendar grid should traverse out of the Calendar,,tvolkert,Trivial,Closed,Duplicate,08/Sep/09 11:24,26/Sep/09 18:48,
Improvement,PIVOT-294,12435454,Rename MenuPopup#isAutoClose() to isContextMenu(),gbrown,gbrown,Trivial,Resolved,Fixed,11/Sep/09 18:23,22/Sep/09 13:27,
Task,PIVOT-262,12434504,Add @Override annotations where applicable,smartini,tvolkert,Trivial,Closed,Fixed,01/Sep/09 10:57,04/Sep/09 16:30,
Bug,PIVOT-255,12434389,Possible rounding error in TerraTableViewSkin.paint(),gbrown,tvolkert,Trivial,Resolved,Fixed,30/Aug/09 23:46,04/Sep/09 16:30,
Bug,PIVOT-253,12434378,Nested menus don't fade when closed,gbrown,tvolkert,Trivial,Resolved,Fixed,30/Aug/09 13:15,04/Sep/09 16:29,
New Feature,PIVOT-242,12434117,Add delimiter:String style to TerraFormSkin,tvolkert,tvolkert,Trivial,Resolved,Fixed,27/Aug/09 02:14,27/Aug/09 02:29,
Improvement,PIVOT-224,12432716,Support comparators in MapAdapter and SetAdapter,grandinj,gbrown,Trivial,Resolved,Fixed,10/Aug/09 20:38,11/Aug/09 13:32,
New Feature,PIVOT-209,12432316,Display column selection state in TerraTableViewSkin,gbrown,gbrown,Trivial,Resolved,Fixed,05/Aug/09 19:27,05/Aug/09 19:28,
Task,PIVOT-145,12427413,Remove timestamp from JAR files,tvolkert,gbrown,Trivial,Resolved,Fixed,08/Jun/09 22:32,15/Jun/09 22:15,
