Issue Type,Issue key,Issue id,Parent id,Summary,Assignee,Reporter,Priority,Status,Resolution,Created,Updated,Due Date
Bug,TOBAGO-772,12429525,,"Facelets, validation in popup only executed once",,dubois,Major,Closed,Pending Closed,04/Jul/09 09:13,06/Jul/16 15:09,
Bug,TOBAGO-454,12374044,,tc:bundle does not work in tc:popup labels,,diamss,Major,Closed,Pending Closed,18/Jul/07 06:32,06/Jul/16 15:08,
Bug,TOBAGO-319,12364843,,action in popup facet is not executed,,deki,Major,Closed,Workaround,13/Mar/07 18:35,06/Jul/16 15:01,
Task,TOBAGO-1518,12922308,,Migrate to jQuery 2,lofwyr,lofwyr,Major,Closed,Fixed,16/Dec/15 09:31,22/Apr/16 12:28,
Improvement,TOBAGO-1546,12951003,,Disabled images should be styled by CSS,lofwyr,lofwyr,Major,Closed,Fixed,16/Mar/16 21:22,22/Apr/16 12:28,
New Feature,TOBAGO-1541,12948422,,Use of ResourceBundles should support parameters,lofwyr,mwronka,Major,Closed,Fixed,09/Mar/16 15:18,22/Apr/16 12:28,
New Feature,TOBAGO-1361,12691596,,New Layout Manager: Flex Box <tc:flexLayout>,lofwyr,lofwyr,Major,Closed,Fixed,28/Jan/14 10:21,04/Mar/16 18:13,
Sub-task,TOBAGO-1490,12863377,12836527,Using new attributes in <tc:style> to tweak layout,lofwyr,lofwyr,Major,Closed,Fixed,11/Sep/15 13:14,02/Mar/16 11:14,
New Feature,TOBAGO-1465,12829487,,Support for header and footer HTML elements,lofwyr,lofwyr,Major,Closed,Fixed,13/May/15 08:10,17/Feb/16 15:24,
Bug,TOBAGO-1522,12926940,,AJAX-Overlay never disappears when heavily double clicking,weber,deki,Major,Closed,Fixed,04/Jan/16 10:51,01/Feb/16 08:57,
Sub-task,TOBAGO-1514,12916442,12695700,Bootstrap for SelectManyShuffle component,lofwyr,lofwyr,Major,Closed,Fixed,26/Nov/15 13:33,22/Dec/15 17:07,
Task,TOBAGO-1510,12914403,,ResourceManager: No longer need to provide measures for the themes,lofwyr,lofwyr,Major,Closed,Fixed,19/Nov/15 09:50,22/Dec/15 17:07,
Bug,TOBAGO-1094,12543497,,Using CODI and JSP results in some problems with scripts and styles on the page,lofwyr,lofwyr,Major,Closed,Fixed,21/Feb/12 15:01,11/Dec/15 13:40,
Bug,TOBAGO-856,12457952,,tx components will be created new when rerendering in JSF 1.2 and using JSP (Tobago 1.0),lofwyr,lofwyr,Major,Closed,Won't Fix,03/Mar/10 08:13,12/Nov/15 10:52,
Improvement,TOBAGO-918,12474712,,"Extension tag lib tx: Assimilate ""id"" and ""fieldId"" attributes of JSP to Facelets ",lofwyr,lofwyr,Major,Closed,Fixed,21/Sep/10 15:54,12/Nov/15 10:51,
Bug,TOBAGO-954,12481007,,FORM authentication doesn't work anymore with <tx:in>,,dubois,Major,Closed,Not A Problem,27/Nov/10 01:43,12/Nov/15 10:44,
Sub-task,TOBAGO-1495,12902251,12695700,Adapt the tc:tree to Bootstrap,lofwyr,lofwyr,Major,Closed,Fixed,03/Oct/15 11:10,11/Nov/15 08:26,
Sub-task,TOBAGO-1494,12901885,12695700,Basic tc:sheet support for Bootstrap,lofwyr,lofwyr,Major,Closed,Fixed,01/Oct/15 13:10,11/Nov/15 08:26,
Sub-task,TOBAGO-1497,12903004,12695700,Adapt the tc:messages to Bootstrap,lofwyr,lofwyr,Major,Closed,Fixed,07/Oct/15 14:07,11/Nov/15 08:26,
Sub-task,TOBAGO-1471,12836529,12836527,Remove SheetLayoutManager,lofwyr,lofwyr,Major,Closed,Fixed,09/Jun/15 12:28,11/Nov/15 08:26,
Task,TOBAGO-1363,12692832,,"Dependencies for Tobago 3.0 is Java 1.6, Servlet 3.0, JSP 2.2",lofwyr,lofwyr,Major,Closed,Fixed,03/Feb/14 11:56,11/Nov/15 08:26,
Sub-task,TOBAGO-1479,12845240,12695700,Implement tc:suggest for Bootstrap,lofwyr,lofwyr,Major,Closed,Fixed,15/Jul/15 11:45,11/Nov/15 08:26,
Task,TOBAGO-1470,12836527,,Tobago 3: Layout concept changed,lofwyr,lofwyr,Major,Closed,Fixed,09/Jun/15 12:25,11/Nov/15 08:26,
New Feature,TOBAGO-1428,12760803,,New tag <tc:section> for structured flow oriented pages,lofwyr,lofwyr,Major,Closed,Fixed,10/Dec/14 16:55,11/Nov/15 08:26,
Task,TOBAGO-1358,12688554,,Using CSS box-sizing: border-box instead of content-box,lofwyr,lofwyr,Major,Closed,Fixed,13/Jan/14 15:45,11/Nov/15 08:26,
Improvement,TOBAGO-1500,12904783,,Complete the enum list of HtmlElement and add void support,lofwyr,lofwyr,Major,Closed,Fixed,14/Oct/15 08:31,11/Nov/15 08:26,
Sub-task,TOBAGO-1493,12875811,12836527,"Consolidate interfaces LayoutContainer, LayoutBox, LayoutBase, LayoutComponent, SupportsMarkup and Configurable to Visual",lofwyr,lofwyr,Major,Closed,Fixed,18/Sep/15 09:00,11/Nov/15 08:26,
Task,TOBAGO-1355,12687459,,"Separate content of the themes ""standard"" and ""scarborough""",lofwyr,lofwyr,Major,Closed,Fixed,06/Jan/14 15:43,11/Nov/15 08:26,
Improvement,TOBAGO-1412,12726752,,Using PNG as icon format in the themes instead of GIF,lofwyr,lofwyr,Major,Closed,Fixed,11/Jul/14 08:44,11/Nov/15 08:26,
Sub-task,TOBAGO-1472,12836541,12836527,Remove TabGroupLayoutManager,lofwyr,lofwyr,Major,Closed,Fixed,09/Jun/15 13:23,11/Nov/15 08:26,
Sub-task,TOBAGO-1434,12765336,12836527,Move Layout-Manager-Logic from Server to Client,lofwyr,lofwyr,Major,Closed,Fixed,07/Jan/15 09:37,11/Nov/15 08:26,
New Feature,TOBAGO-1505,12905544,,NPE while rendering Session Secret,deki,lofwyr,Major,Closed,Fixed,16/Oct/15 14:10,11/Nov/15 08:26,
Bug,TOBAGO-815,12439953,,Type Measure doesn't work corretly with literals on JSPs.,bommel,lofwyr,Major,Closed,Fixed,05/Nov/09 16:51,16/Oct/15 13:58,
Wish,TOBAGO-1480,12845292,,Documentation on how to setup my project to work with Portlets,,hugo.dias,Major,Closed,Done,15/Jul/15 16:22,02/Oct/15 15:23,
Task,TOBAGO-1281,12654730,,Reimplementation of the input suggest control,lofwyr,lofwyr,Major,Closed,Fixed,25/Jun/13 14:10,02/Oct/15 14:44,
Bug,TOBAGO-288,12363057,,Error changing value in <tx:date> tag,deki,dubois,Major,Closed,Fixed,16/Feb/07 23:22,04/Sep/15 08:08,
Improvement,TOBAGO-1352,12687201,,Composite components for tx library,lofwyr,lofwyr,Major,Closed,Won't Fix,03/Jan/14 15:53,03/Sep/15 11:23,
Bug,TOBAGO-335,12365724,,"<f:convertNumber type=""number""> and Double object in backing bean",,dubois,Major,Closed,Won't Fix,24/Mar/07 11:50,20/Aug/15 08:57,
Bug,TOBAGO-270,12362108,,APT option values passed to the APT compiler are wrong: -Akey=value => -Akey=value=null,deki,titi-r5,Major,Closed,Not A Problem,06/Feb/07 15:57,20/Aug/15 08:55,
Bug,TOBAGO-953,12480992,,"<f:selectItem itemValue="""" itemLabel=""All"" /> item no longer NULL",deki,dubois,Major,Closed,Not A Problem,26/Nov/10 19:17,20/Aug/15 08:04,
Bug,TOBAGO-401,12369502,,"attribute ""required=true"" In <tx:in> allows blank spaces.",deki,rstnet,Major,Closed,Won't Fix,16/May/07 18:02,06/Jul/15 12:11,
Bug,TOBAGO-1453,12787298,,SelectManyRendererBase should support Collection,bommel,deki,Major,Closed,Fixed,01/Apr/15 09:18,10/Jun/15 08:27,
Bug,TOBAGO-1446,12780803,,Different behavior in render classes while re-rendering,bommel,mib,Major,Closed,Fixed,10/Mar/15 11:07,10/Jun/15 07:23,
Bug,TOBAGO-1449,12782526,,selectOneChoice with selectItem within sheet results in PropertyNotFoundException,bommel,deki,Major,Closed,Fixed,17/Mar/15 10:40,10/Jun/15 07:23,
Bug,TOBAGO-1460,12825467,,Unable to build project with newer JDKs in IntelliJ IDEA,deki,deki,Major,Closed,Fixed,28/Apr/15 09:19,10/Jun/15 07:23,
Bug,TOBAGO-1459,12824008,,Possilble NPE in SplitLayoutRenderer,weber,weber,Major,Closed,Fixed,25/Apr/15 16:58,08/Jun/15 21:29,
Bug,TOBAGO-1469,12835650,,tc:treeListbox doesn't show the current selection state,lofwyr,lofwyr,Major,Closed,Fixed,05/Jun/15 09:20,08/Jun/15 21:29,
Bug,TOBAGO-1467,12832975,,Calendar component opens console replacement popup in production,deki,crusadah,Major,Closed,Fixed,27/May/15 07:22,08/Jun/15 21:29,
Bug,TOBAGO-1450,12783302,,apache rat fails on DEPENDENCIES file,lofwyr,mkienenb,Major,Closed,Fixed,19/Mar/15 17:17,08/Jun/15 21:29,
Bug,TOBAGO-1458,12823776,,Allowed child elements of some tags are to strictly defined.,lofwyr,lofwyr,Major,Closed,Fixed,24/Apr/15 15:26,08/Jun/15 21:29,
Bug,TOBAGO-1461,12825509,,Sheet column selector immediately disposes,lofwyr,deki,Major,Closed,Fixed,28/Apr/15 11:58,08/Jun/15 21:29,
Bug,TOBAGO-1468,12833013,,"NoSuchMethodException in security module, when using EL 2.0 paranthesis in actions",lofwyr,lofwyr,Major,Closed,Fixed,27/May/15 11:24,08/Jun/15 21:29,
Bug,TOBAGO-681,12398263,,"Facelets link ""Component Tree"" in Debug Output window doesn't work",deki,dubois,Major,Closed,Cannot Reproduce,13/Jun/08 21:54,08/Jun/15 21:29,
Improvement,TOBAGO-1369,12696533,,Migrate to Selenium WebDriver,deki,deki,Major,Closed,Fixed,21/Feb/14 13:45,08/Jun/15 21:29,
Bug,TOBAGO-221,12358954,,tc:sheet -> tc:column -> tc:out does not support f:convertNumber / convertDateTime,,rohloff,Major,Closed,Cannot Reproduce,18/Dec/06 21:15,05/Jun/15 14:21,
Bug,TOBAGO-695,12404420,,Theme Scarborough missing right border off tc:box in IE 6,,swaczinna,Major,Closed,Won't Fix,16/Sep/08 09:47,05/Jun/15 14:04,
Wish,TOBAGO-268,12362038,,TLD file for facelet-extension for code completition in eclipse,,dubois,Major,Closed,Not A Problem,05/Feb/07 20:33,05/Jun/15 08:17,
Task,TOBAGO-839,12443395,,Migrate functionality of ThemeConfig to ResourceManager,lofwyr,lofwyr,Major,Closed,Fixed,15/Dec/09 14:48,29/May/15 13:30,
Bug,TOBAGO-588,12385882,,Ajax timeout is hardcoded,deki,dodo.phoenix,Major,Closed,Cannot Reproduce,09/Jan/08 15:38,19/May/15 08:04,
Improvement,TOBAGO-1448,12781816,,Possibility to sort the tc:sheet before the first rendering.,lofwyr,lofwyr,Major,Closed,Fixed,13/Mar/15 14:13,23/Apr/15 15:31,
New Feature,TOBAGO-773,12429786,,tc:sheet should auto-sort the data according to sheetState at model-reload,,mwronka,Major,Closed,Fixed,08/Jul/09 08:08,22/Mar/15 18:52,
Bug,TOBAGO-1272,12649892,,a sheet in a reload-facete forget the sort order.,lofwyr,andreas.precht,Major,Closed,Fixed,29/May/13 12:04,22/Mar/15 18:52,
Task,TOBAGO-1429,12760811,,Unify behaviour of label attribute and label facet,lofwyr,lofwyr,Major,Open,,10/Dec/14 17:34,17/Mar/15 23:32,
New Feature,TOBAGO-1430,12761066,,New tag <tx:out> as labeled version of <tc:out>,lofwyr,lofwyr,Major,Closed,Fixed,11/Dec/14 14:16,24/Feb/15 10:47,
Improvement,TOBAGO-1433,12762619,,Supported resource types should be configurable,lofwyr,weber,Major,Closed,Fixed,18/Dec/14 16:49,24/Feb/15 10:47,
Bug,TOBAGO-1432,12762289,,Problem with Ajax navigation response and timeout,weber,weber,Major,In Progress,,17/Dec/14 13:55,06/Jan/15 12:20,
Bug,TOBAGO-1431,12761722,,NPE decoding tree state,weber,weber,Major,Closed,Fixed,15/Dec/14 10:55,20/Dec/14 22:01,
Bug,TOBAGO-1423,12753005,,"Sheet: forceVerticalScrollbar=""true"" breaks column alignment",weber,weber,Major,Closed,Fixed,05/Nov/14 09:47,20/Dec/14 22:01,
Bug,TOBAGO-1425,12757659,,tx:selectManyShuttle does not submit selected values,lofwyr,crusadah,Major,Closed,Fixed,25/Nov/14 10:55,20/Dec/14 22:01,
Improvement,TOBAGO-1325,12674094,,jQuery too slow in IE8: Tobago.Util.selectWithJQuery(),lofwyr,weber,Major,Closed,Fixed,16/Oct/13 09:22,20/Dec/14 22:01,
Improvement,TOBAGO-939,12479748,,RenderedPartially support for sheet and tabGroup,lofwyr,bommel,Major,Closed,Fixed,11/Nov/10 21:01,12/Oct/14 10:34,
Bug,TOBAGO-1419,12737787,,JS error using renderedPartially in <tc:sheet>,lofwyr,lofwyr,Major,Closed,Fixed,29/Aug/14 12:09,12/Oct/14 10:34,
New Feature,TOBAGO-1418,12737338,,Possibly leave out the file extension of images and icons,lofwyr,lofwyr,Major,Closed,Fixed,28/Aug/14 08:55,12/Oct/14 10:34,
New Feature,TOBAGO-1391,12710711,,TabGroup should allow a icon in front of tab label,weber,weber,Major,Closed,Fixed,26/Apr/14 08:38,02/Oct/14 08:32,
Bug,TOBAGO-1263,12646981,,TreeListbox  did not work in 2.0,weber,weber,Major,Closed,Fixed,10/May/13 07:58,01/Oct/14 09:30,
Improvement,TOBAGO-597,12386352,,TLD file for tx facelets extensions to include in eclipse to get coding assistence and code completition,,dubois,Major,Closed,Not A Problem,16/Jan/08 07:05,28/Aug/14 13:58,
Bug,TOBAGO-679,12398030,,Usage of <tc:columnEvent before <tc:columnSelector forces a JavaScript Error,,rohloff,Major,Closed,Fixed,11/Jun/08 09:14,28/Aug/14 13:44,
Bug,TOBAGO-1417,12733257,,TabGroup: tabChangeListener is never invoked,weber,weber,Major,Closed,Fixed,11/Aug/14 15:06,22/Aug/14 13:14,
Bug,TOBAGO-1410,12726261,,Menu Dropdown did not collapse after partially action,weber,weber,Major,Closed,Fixed,09/Jul/14 08:05,22/Aug/14 13:14,
Improvement,TOBAGO-853,12457573,,JSF 2.0 support,bommel,bommel,Major,Closed,Fixed,26/Feb/10 14:33,21/Jul/14 06:07,
Improvement,TOBAGO-1139,12556283,,"Supporting ValueChangeListener, Disabled, Required, Converter, ValidatorMessage, RequiredMessage and ConverterMessage for tc:treeSelect",bommel,bommel,Major,Closed,Fixed,17/May/12 19:28,21/Jul/14 06:07,
New Feature,TOBAGO-1049,12531915,,Tree inside of the Sheet (aka TreeTable),lofwyr,lofwyr,Major,Closed,Fixed,18/Nov/11 10:46,21/Jul/14 06:07,
Bug,TOBAGO-1406,12721625,,Toolbar: click on disabled button invokes a submit,weber,weber,Major,Closed,Fixed,17/Jun/14 08:42,21/Jul/14 06:07,
Improvement,TOBAGO-1276,12652203,,Rendered attribute for rows in Sheet,weber,weber,Major,Closed,Fixed,11/Jun/13 14:00,21/Jul/14 06:07,
Improvement,TOBAGO-1404,12720846,,Improve accessKey,lofwyr,lofwyr,Major,Closed,Fixed,12/Jun/14 11:55,21/Jul/14 06:07,
New Feature,TOBAGO-1248,12642543,,Navigate to a new view with partialReload (AJAX) - (Support of CODE_RELOAD_REQUIRED),weber,weber,Major,Closed,Fixed,15/Apr/13 14:20,21/Jul/14 06:07,
Improvement,TOBAGO-1405,12721077,,DOM of tc:time should be build on client site,lofwyr,lofwyr,Major,Closed,Fixed,13/Jun/14 10:48,21/Jul/14 06:07,
New Feature,TOBAGO-1203,12608846,,Sheet-Header: Support for input components in header-cells,lofwyr,mwronka,Major,Closed,Fixed,24/Sep/12 09:35,21/Jul/14 06:07,
Bug,TOBAGO-1411,12726621,,readonly selectBooleanCheckbox and selectManyCheckbox doesn't work properly,lofwyr,deki,Major,Closed,Fixed,10/Jul/14 16:32,21/Jul/14 06:07,
Improvement,TOBAGO-1407,12722800,,Using DatePicker from jQuery UI,lofwyr,lofwyr,Major,Closed,Fixed,20/Jun/14 15:33,21/Jul/14 06:07,
Improvement,TOBAGO-616,12388077,,DefaultCommand on subforms,lofwyr,rohloff,Major,Closed,Fixed,07/Feb/08 11:51,21/Jul/14 06:07,
Bug,TOBAGO-1149,12558753,,UITreeNode should be subclass of UIColumn,bommel,bommel,Major,Closed,Fixed,31/May/12 10:07,21/Jul/14 06:07,
Bug,TOBAGO-1282,12654750,,Disabled Menus did not use disabled Icons,weber,weber,Major,Closed,Fixed,25/Jun/13 15:27,21/Jul/14 06:07,
Wish,TOBAGO-633,12390371,,Portlet support,lofwyr,deki,Major,Closed,Fixed,06/Mar/08 17:26,21/Jul/14 06:07,
Task,TOBAGO-1146,12558500,,Support for tobago-config.xml in theme plugin ,bommel,bommel,Major,Closed,Fixed,29/May/12 21:19,21/Jul/14 06:07,
Sub-task,TOBAGO-1342,12677522,12390371,Popup- and Menu-Handling for Portlets,,lofwyr,Major,Closed,Fixed,05/Nov/13 07:59,21/Jul/14 06:07,
Task,TOBAGO-1107,12551181,,"Using a TreeState object instead of ""expanded"" and ""marked"" in the tree node tag ",lofwyr,lofwyr,Major,Closed,Fixed,17/Apr/12 07:53,21/Jul/14 06:07,
New Feature,TOBAGO-564,12383855,,Out of the box filter for columns in <tc:sheet>,,tobigis,Major,Closed,Duplicate,04/Dec/07 08:36,16/Jul/14 09:40,
Bug,TOBAGO-1258,12644842,,"New attribute ""omit"" for commands",lofwyr,lofwyr,Major,Closed,Fixed,26/Apr/13 14:24,09/Jul/14 15:28,
Improvement,TOBAGO-1402,12717514,,IE 11 detection,lofwyr,lofwyr,Major,Closed,Fixed,30/May/14 12:38,06/Jun/14 13:12,
Bug,TOBAGO-1401,12717232,,popup is overlayed by pdf,lofwyr,weber,Major,Closed,Fixed,29/May/14 07:58,06/Jun/14 08:45,
New Feature,TOBAGO-1400,12717061,,Sanitize potentially malicious content in tc:textarea and tc:out,lofwyr,lofwyr,Major,Closed,Fixed,28/May/14 15:08,02/Jun/14 21:36,
Improvement,TOBAGO-1398,12714945,,TobagoConfig should not be modifiable after initialization,lofwyr,lofwyr,Major,Closed,Fixed,17/May/14 07:39,02/Jun/14 21:36,
New Feature,TOBAGO-1397,12714944,,TobagoConfig should be accessible via TobagoContext,lofwyr,lofwyr,Major,Closed,Fixed,17/May/14 07:37,02/Jun/14 21:36,
New Feature,TOBAGO-1396,12714474,,Integration of an HTML editor (WYSIWYG),lofwyr,lofwyr,Major,Closed,Fixed,15/May/14 12:59,02/Jun/14 21:36,
Improvement,TOBAGO-1399,12716297,,AjaxResponseRenderer should handle session timeout,weber,deki,Major,Closed,Fixed,23/May/14 10:05,02/Jun/14 21:35,
Bug,TOBAGO-1381,12705595,,Radio- and Checkbox-Renderer may produce an NullPointerException,lofwyr,lofwyr,Major,Closed,Fixed,31/Mar/14 08:05,27/May/14 19:04,
Improvement,TOBAGO-1382,12705655,,"New attribute ""name"" for <tc:object>",lofwyr,lofwyr,Major,Closed,Fixed,31/Mar/14 14:02,27/May/14 19:04,
Bug,TOBAGO-1374,12700696,,link attribute contains faces mapping,lofwyr,bommel,Major,Closed,Fixed,11/Mar/14 13:55,27/May/14 19:04,
Bug,TOBAGO-1384,12705940,,Switching on debugMode=true in Production mode not usable,lofwyr,lofwyr,Major,Closed,Fixed,01/Apr/14 12:45,09/May/14 16:01,
Bug,TOBAGO-1390,12710310,,"""Can't parse to any measure""",lofwyr,bstadler,Major,Closed,Fixed,24/Apr/14 13:41,09/May/14 16:01,
Bug,TOBAGO-1388,12710060,,Wandering popup,lofwyr,bstadler,Major,Closed,Fixed,23/Apr/14 15:24,09/May/14 16:01,
Bug,TOBAGO-1385,12709783,,PageRenderer not found when tobago-deprecation is in classpath,lofwyr,deki,Major,Closed,Fixed,22/Apr/14 14:30,09/May/14 16:01,
Bug,TOBAGO-1393,12711186,,Default of 'omit' attribute for command facet is TRUE instead of FALSE ,bommel,bommel,Major,Closed,Fixed,29/Apr/14 14:40,09/May/14 16:01,
Improvement,TOBAGO-1386,12709794,,ToolbarButtons in TabLabels,weber,weber,Major,Closed,Fixed,22/Apr/14 15:49,09/May/14 16:01,
Sub-task,TOBAGO-1328,12674265,12390371,Page dimension,lofwyr,lofwyr,Major,Closed,Fixed,17/Oct/13 06:55,02/May/14 17:16,
Task,TOBAGO-1228,12631960,,Setting JSF 2.0 as default version for Tobago,lofwyr,lofwyr,Major,Closed,Fixed,12/Feb/13 15:00,02/May/14 17:16,
New Feature,TOBAGO-1362,12692822,,Support dynamic list of objects for f:selectItems,lofwyr,deki,Major,Closed,Fixed,03/Feb/14 10:34,02/May/14 17:16,
Bug,TOBAGO-1316,12670302,,tx-taglib is broken with new createUniqueId() strategy from MyFaces (Facelets only),lofwyr,lofwyr,Major,Closed,Fixed,24/Sep/13 15:57,02/May/14 17:16,
Bug,TOBAGO-1359,12688559,,NPE when rendering sheet,lofwyr,deki,Major,Closed,Fixed,13/Jan/14 16:00,02/May/14 17:16,
Bug,TOBAGO-1356,12688214,,Avoid error logging for missing hover images,lofwyr,deki,Major,Closed,Fixed,10/Jan/14 10:47,02/May/14 17:16,
Bug,TOBAGO-1279,12654536,,Menu: Icons and arrow are miss on items with submenu,lofwyr,weber,Major,Closed,Fixed,24/Jun/13 16:06,02/May/14 17:16,
New Feature,TOBAGO-1378,12702833,,Implement merging of renderers config from tobago-config.xml files,weber,weber,Major,Closed,Fixed,21/Mar/14 09:44,02/May/14 17:16,
Bug,TOBAGO-1376,12701208,,tobago-theme-plugin puts backslashes in war file if build runs under Windows,lofwyr,georgpietrek,Major,Closed,Fixed,13/Mar/14 10:47,02/May/14 17:16,
New Feature,TOBAGO-1373,12698374,,Better JavaScript logging: using browser console and fill browser gaps.,lofwyr,lofwyr,Major,Closed,Fixed,03/Mar/14 08:33,02/May/14 17:16,
Bug,TOBAGO-1350,12687164,,response complete checks are missing in PhaseListeners,lofwyr,deki,Major,Closed,Fixed,03/Jan/14 11:15,02/May/14 17:15,
Bug,TOBAGO-1370,12696924,,Inserting characters by <alt>-<keypad code> did not work,lofwyr,weber,Major,Closed,Fixed,24/Feb/14 14:21,02/May/14 17:15,
Bug,TOBAGO-1192,12601392,,buttons and links rendering without javascript fragments,lofwyr,lofwyr,Major,Closed,Fixed,03/Aug/12 16:15,02/May/14 17:15,
Task,TOBAGO-900,12469915,,Evaluation of a CSS templating engine like LESS or SASS,bommel,lofwyr,Major,Closed,Fixed,22/Jul/10 13:39,18/Feb/14 13:18,
Improvement,TOBAGO-1346,12679699,,"JSON friendly HTML code (change "" with ' for attributes)",lofwyr,lofwyr,Major,Closed,Fixed,18/Nov/13 10:01,07/Jan/14 14:36,
New Feature,TOBAGO-1334,12676293,,Client Dimension should support redirect tag in naviation rules,lofwyr,michael.baedorf,Major,Closed,Fixed,29/Oct/13 08:52,07/Jan/14 14:36,
Task,TOBAGO-1333,12676285,,Refatoring: Tobago should not need its own UIViewRoot implementation,lofwyr,lofwyr,Major,Closed,Fixed,29/Oct/13 07:49,07/Jan/14 14:36,
Bug,TOBAGO-1321,12673710,,NPE in UserAgent.hasCapability,weber,weber,Major,Closed,Fixed,14/Oct/13 15:49,07/Jan/14 14:36,
Bug,TOBAGO-1351,12687196,,IDs are sometimes broken when using tx-taglib with facelets,lofwyr,lofwyr,Major,Closed,Fixed,03/Jan/14 15:06,07/Jan/14 14:36,
New Feature,TOBAGO-1171,12597448,,Support for the Content Security Policy (CSP),lofwyr,lofwyr,Major,Closed,Fixed,04/Jul/12 12:29,07/Jan/14 14:36,
Improvement,TOBAGO-1184,12599682,,Support for initializing components without javascript fragments,bommel,bommel,Major,Closed,Fixed,20/Jul/12 21:37,07/Jan/14 14:36,
Bug,TOBAGO-1322,12673711,,Input elements behind Popup are not reenabled if popup was reloaded before closing,weber,weber,Major,Closed,Fixed,14/Oct/13 15:51,07/Jan/14 14:36,
Bug,TOBAGO-1319,12672793,,SessionSecret will not be checked in 2.0.0 alpha,lofwyr,lofwyr,Major,Closed,Fixed,08/Oct/13 11:30,07/Jan/14 14:36,
Bug,TOBAGO-1323,12673877,,AJAX call breaks view state on WebSphere 8.5,lofwyr,lofwyr,Major,Closed,Fixed,15/Oct/13 13:12,07/Jan/14 14:36,
Bug,TOBAGO-1037,12526378,,Problem with viewId=null in case of JSF 2.0 with Facelets,lofwyr,lofwyr,Major,Closed,Fixed,09/Oct/11 14:51,19/Nov/13 15:53,
Bug,TOBAGO-876,12462407,,Input suggest doesn't work in a modeless popup.,lofwyr,lofwyr,Major,Closed,Fixed,19/Apr/10 08:23,11/Nov/13 10:48,
Bug,TOBAGO-1284,12654910,,tc:sheet: a disabled columnSelector allows selecting a row by clicking on background of the row,lofwyr,rohloff,Major,Closed,Fixed,26/Jun/13 11:15,11/Nov/13 10:48,
Task,TOBAGO-1177,12599630,,Update jQuery to 1.10.1,lofwyr,bommel,Major,Closed,Fixed,20/Jul/12 15:05,04/Nov/13 11:02,
Bug,TOBAGO-1240,12636537,,Submenu under the boxmenu is on the right side and paint outside the view.,lofwyr,andreas.precht,Major,Closed,Fixed,12/Mar/13 08:38,04/Nov/13 10:59,
Bug,TOBAGO-1337,12676866,,Sheet: problems forceVerticalScrollbar = true ,weber,weber,Major,Open,,31/Oct/13 14:53,31/Oct/13 16:38,
Sub-task,TOBAGO-1326,12674262,12390371,Normal Actions with Portlets,lofwyr,lofwyr,Major,Closed,Fixed,17/Oct/13 06:53,17/Oct/13 06:54,
Bug,TOBAGO-1291,12661872,,Dropdown Menu did not work on tabgroup Navigation,weber,weber,Major,Closed,Fixed,05/Aug/13 11:45,14/Oct/13 08:42,
Bug,TOBAGO-1315,12670005,,JSON Response is broken for AJAX Requests using Mojarra >= 2.1: unallowed XML header,lofwyr,lofwyr,Major,Closed,Fixed,23/Sep/13 08:43,14/Oct/13 08:42,
Bug,TOBAGO-1293,12662413,,DropDown Menu in toolbar ignores rendered attribute,weber,weber,Major,Closed,Fixed,07/Aug/13 15:53,14/Oct/13 08:42,
Bug,TOBAGO-1294,12662627,,DuplicateIdException in TabGroup navigation Menu,weber,weber,Major,Closed,Fixed,08/Aug/13 14:33,14/Oct/13 08:42,
New Feature,TOBAGO-1283,12654753,,"New attribute ""placeholder"" for input fields",lofwyr,lofwyr,Major,Closed,Fixed,25/Jun/13 15:34,14/Oct/13 08:42,
Bug,TOBAGO-1309,12666142,,sheet column header did not respect change of rendered attribute while partial reload,weber,weber,Major,Closed,Fixed,29/Aug/13 15:04,14/Oct/13 08:42,
Bug,TOBAGO-1307,12665869,,tx:date not recognized as partial request,lofwyr,michael.baedorf,Major,Closed,Fixed,28/Aug/13 08:30,14/Oct/13 08:42,
Bug,TOBAGO-1312,12668439,,ColumnSelector: sometimes the state of the checkbox differs from the sheets selection state,weber,weber,Major,Closed,Fixed,13/Sep/13 09:00,14/Oct/13 08:42,
Improvement,TOBAGO-866,12460543,,Add capabilities and update browsers in UserAgent class,bommel,lofwyr,Major,Closed,Fixed,29/Mar/10 13:13,14/Oct/13 08:42,
Bug,TOBAGO-1299,12664338,,tc:link ignores target attribute,weber,weber,Major,Closed,Fixed,19/Aug/13 12:36,14/Oct/13 08:42,
Task,TOBAGO-1290,12661395,,Rename tobago-config-1.6.xsd to tobago-config-2.0.xsd,lofwyr,lofwyr,Major,Closed,Fixed,02/Aug/13 12:52,14/Oct/13 08:42,
Bug,TOBAGO-1305,12665708,,Error layer page at submit.,weber,weber,Major,Closed,Fixed,27/Aug/13 13:36,14/Oct/13 08:42,
Bug,TOBAGO-1295,12663810,,Loading themes on JBoss 7.x.x with vfs protocol,lofwyr,tschmitz,Major,Closed,Fixed,15/Aug/13 07:57,14/Oct/13 08:42,
Bug,TOBAGO-1303,12665464,,sheet looses scroll position after refresh,weber,weber,Major,Closed,Fixed,26/Aug/13 08:01,14/Oct/13 08:42,
New Feature,TOBAGO-972,12497844,,Implement a session secret to protect against cross-side request forgery (CSRF/XSRF),lofwyr,lofwyr,Major,Closed,Fixed,07/Feb/11 13:03,08/Oct/13 11:31,
New Feature,TOBAGO-1229,12633156,,Using Facelets 2.0 from JSF 2.0 instead of Facelets 1.1 from Sun,lofwyr,lofwyr,Major,Closed,Fixed,20/Feb/13 08:44,06/Sep/13 16:39,
New Feature,TOBAGO-1287,12659743,,Readd dropDownMenu to sheet column header,weber,weber,Major,Closed,Fixed,25/Jul/13 08:52,30/Aug/13 10:27,
Bug,TOBAGO-1260,12645223,,Input-Suggest doesn't support CSP,lofwyr,lofwyr,Major,Closed,Fixed,29/Apr/13 12:48,06/Aug/13 07:47,
Task,TOBAGO-1178,12599631,,Support for current actionId in FacesContextUtils,bommel,bommel,Major,Closed,Fixed,20/Jul/12 15:15,06/Aug/13 07:47,
Bug,TOBAGO-1278,12654534,,Popup did not open when added on server,weber,weber,Major,Closed,Fixed,24/Jun/13 16:02,06/Aug/13 07:47,
Bug,TOBAGO-1288,12660040,,writeURIAttribute not yet implemented in TobagoResponseWriterBase,lofwyr,tschmitz,Major,Closed,Fixed,26/Jul/13 12:29,06/Aug/13 07:47,
Improvement,TOBAGO-1267,12646987,,NonFacesRequestServlet: allow subclasses to create own ViewRoot,weber,weber,Major,Closed,Fixed,10/May/13 08:25,06/Aug/13 07:47,
Improvement,TOBAGO-1264,12646982,,Post ClientDimension also in partial requests,weber,weber,Major,Closed,Fixed,10/May/13 08:05,06/Aug/13 07:47,
Bug,TOBAGO-1268,12647723,,Dropdown Menu actions don't work after partial reload,weber,weber,Major,Closed,Fixed,15/May/13 11:18,06/Aug/13 07:47,
New Feature,TOBAGO-1266,12646984,,Add options to client event listeners,,weber,Major,Closed,Fixed,10/May/13 08:20,06/Aug/13 07:47,
Improvement,TOBAGO-1277,12652210,,readd javascript callback to execute after partially reload,weber,weber,Major,Closed,Fixed,11/Jun/13 14:12,06/Aug/13 07:47,
Bug,TOBAGO-1285,12654942,,Actions of disabled menuItems are not disabled,weber,weber,Major,Closed,Fixed,26/Jun/13 15:10,06/Aug/13 07:47,
Bug,TOBAGO-1265,12646983,,Problem with nestet Tabgroups,weber,weber,Major,Closed,Fixed,10/May/13 08:13,06/Aug/13 07:47,
