Issue Type,Issue key,Issue id,Parent id,Summary,Assignee,Reporter,Priority,Status,Resolution,Created,Updated,Due Date
Bug,TOBAGO-1635,13023109,,"tc:messages, no line bread if text is to long",,orlowjb3,Minor,Closed,Not A Problem,24/Nov/16 08:04,24/Nov/16 08:16,
New Feature,TOBAGO-1135,12556017,,Usability for grid layout with stylesheet markups.,,andreas.precht,Minor,Closed,Won't Fix,16/May/12 11:47,18/Nov/16 20:51,
Improvement,TOBAGO-863,12459830,,Split TobagoResponseWriterImpl into a XmlResponseWriter and a normal HtmlResponseWriter and introduce a Debug Response Writer,bommel,bommel,Minor,Closed,Fixed,22/Mar/10 08:18,18/Nov/16 20:47,
New Feature,TOBAGO-813,12439546,,Possibility to render the output as XHTML,lofwyr,lofwyr,Minor,Closed,Duplicate,30/Oct/09 16:24,18/Nov/16 20:47,
New Feature,TOBAGO-727,12409023,,Seam example with use of jBPM,lofwyr,lofwyr,Minor,Closed,Later,21/Nov/08 20:45,18/Nov/16 20:29,
New Feature,TOBAGO-1566,12976947,,Enhance the check of the Facelet pages,lofwyr,lofwyr,Minor,Closed,Fixed,08/Jun/16 18:06,18/Nov/16 14:22,
Task,TOBAGO-1610,13010446,,"Attributes ""resource"" and ""jsfResource"" will be removed from tc:button, tc:link etc.",hnoeth,lofwyr,Minor,Closed,Fixed,07/Oct/16 12:34,01/Nov/16 16:05,
Improvement,TOBAGO-1587,12996546,,links doesn't support rightklick->newTab,hnoeth,hnoeth,Minor,Closed,Fixed,11/Aug/16 07:18,01/Nov/16 16:05,
New Feature,TOBAGO-1605,13006749,,New component: tc:figure ,lofwyr,lofwyr,Minor,Closed,Fixed,22/Sep/16 05:32,01/Nov/16 16:05,
Bug,TOBAGO-1607,13009905,,Focus attribute doesn't work inside popup (since bootstrap modal implementation),hnoeth,lofwyr,Minor,Closed,Fixed,05/Oct/16 15:51,01/Nov/16 16:05,
Improvement,TOBAGO-1561,12966019,,Remove AutoAccessKey (underline),hnoeth,hnoeth,Minor,Closed,Fixed,09/May/16 10:02,26/Oct/16 09:33,
Improvement,TOBAGO-1608,13010120,,"Make Bootstrap classes 'offset', 'push', 'pull' available for segment layout",,hnoeth,Minor,Closed,Duplicate,06/Oct/16 09:54,26/Oct/16 08:36,
Bug,TOBAGO-1559,12964542,,"Accesskey doesn't work with ""labelLayout""",hnoeth,lofwyr,Minor,Closed,Fixed,03/May/16 06:55,26/Oct/16 08:27,
Improvement,TOBAGO-1591,12999943,,Popup: Change the default for collapsed from false to true,lofwyr,lofwyr,Minor,Closed,Fixed,25/Aug/16 08:03,26/Oct/16 08:02,
Bug,TOBAGO-1598,13003800,,Encoding of parameter <f:param> will not rendered correctly,hnoeth,hnoeth,Minor,Closed,Fixed,09/Sep/16 09:21,20/Sep/16 06:40,
Improvement,TOBAGO-1596,13002281,,Attribute for confirmation message as supplement to the facet,lofwyr,lofwyr,Minor,Closed,Fixed,02/Sep/16 08:36,20/Sep/16 06:40,
Bug,TOBAGO-1575,12988287,,<tc:in>s flexLayout is different when using <tc:suggest>,lofwyr,mwronka,Minor,Closed,Fixed,11/Jul/16 13:39,28/Aug/16 18:31,
Bug,TOBAGO-1582,12995139,,Converter for class String will not used,lofwyr,lofwyr,Minor,Closed,Fixed,05/Aug/16 08:10,28/Aug/16 18:31,
Bug,TOBAGO-1583,12995200,,Sorting in sheet work not with Mojarra,lofwyr,lofwyr,Minor,Closed,Fixed,05/Aug/16 12:37,28/Aug/16 18:31,
Task,TOBAGO-1567,12977558,,Clean up: consolidate getFormattedValue() and other methods.,lofwyr,lofwyr,Minor,Closed,Fixed,10/Jun/16 10:04,03/Aug/16 07:58,
Sub-task,TOBAGO-1488,12861784,12695700,Toolbar for tc:box in Bootstrap,lofwyr,lofwyr,Minor,Closed,Fixed,04/Sep/15 08:53,03/Aug/16 07:58,
Bug,TOBAGO-1570,12987080,,tc:messages: Type of globalOnly should be boolean,lofwyr,lofwyr,Minor,Closed,Fixed,06/Jul/16 08:07,03/Aug/16 07:58,
Improvement,TOBAGO-1558,12963006,,Update Font-Awesome to 4.6.1,lofwyr,lofwyr,Minor,Closed,Fixed,27/Apr/16 12:16,03/Aug/16 07:58,
Task,TOBAGO-1047,12530817,,Checkstyle configuration file to find deprecated attriubutes or tags.,lofwyr,lofwyr,Minor,Closed,Fixed,09/Nov/11 04:01,08/Jun/16 18:06,
Improvement,TOBAGO-1389,12710303,,Disable Hotkey-Behaviour (autodetect accessKey from label),lofwyr,mwronka,Minor,Closed,Fixed,24/Apr/14 12:52,11/May/16 09:34,
Task,TOBAGO-1540,12948359,,Remove deprecated <tc:time> (use <tc:date>),lofwyr,lofwyr,Minor,Closed,Fixed,09/Mar/16 10:07,22/Apr/16 12:28,
Improvement,TOBAGO-1537,12946173,,"""size"" attribute for number of shown elements in <tc:selectOneListbox>, <tc:selectManyListbox>, <tc:selectManyShuffle> and <tc:treeListbox>",lofwyr,lofwyr,Minor,Closed,Fixed,02/Mar/16 15:11,22/Apr/16 12:28,
Improvement,TOBAGO-1535,12940464,,Set build requirement for Tobago 2 and 3 to Java 8 or higher,lofwyr,lofwyr,Minor,Closed,Fixed,19/Feb/16 10:42,22/Apr/16 12:28,
Bug,TOBAGO-1548,12952744,,itemValue can only handle String,lofwyr,hnoeth,Minor,Closed,Fixed,23/Mar/16 08:59,22/Apr/16 12:28,
Improvement,TOBAGO-1555,12958842,,FixCharacterEncodingFilter should be activated by default,lofwyr,lofwyr,Minor,Closed,Fixed,14/Apr/16 13:26,22/Apr/16 12:28,
Improvement,TOBAGO-1547,12951146,,ExpandedState of tree should be expandable with all parents,lofwyr,lofwyr,Minor,Closed,Fixed,17/Mar/16 10:22,22/Apr/16 12:28,
Improvement,TOBAGO-1501,12905517,,Refactoring: using further enums,lofwyr,lofwyr,Minor,Closed,Fixed,16/Oct/15 13:04,22/Apr/16 12:28,
Improvement,TOBAGO-1536,12942558,,"Check how to use ""defer"" attribute for script tags",,lofwyr,Minor,Open,,24/Feb/16 08:21,24/Feb/16 09:46,
New Feature,TOBAGO-441,12373510,,Configuration whether to use the styles from all themes or not,lofwyr,mwronka,Minor,Closed,Fixed,11/Jul/07 12:59,03/Feb/16 13:53,
Bug,TOBAGO-1507,12908194,,Unable to build Tobago without all-modules profile,deki,deki,Minor,Closed,Fixed,27/Oct/15 11:18,01/Feb/16 08:57,
Task,TOBAGO-1528,12934572,,Update commons-collections,lofwyr,lofwyr,Minor,Closed,Fixed,27/Jan/16 20:34,01/Feb/16 08:57,
Bug,TOBAGO-1509,12912448,,tx components will not be rendered,lofwyr,lofwyr,Minor,Closed,Fixed,12/Nov/15 10:58,22/Dec/15 17:07,
Task,TOBAGO-1520,12922327,,Remove border attribute for tc:image and tc:gridLayout,lofwyr,lofwyr,Minor,Closed,Fixed,16/Dec/15 10:31,22/Dec/15 17:07,
Bug,TOBAGO-1508,12912159,,"Markup ""number"" currently not working",lofwyr,lofwyr,Minor,Closed,Fixed,11/Nov/15 13:21,22/Dec/15 17:07,
Improvement,TOBAGO-609,12387369,,Options on markup in tx components,lofwyr,rstnet,Minor,Closed,Won't Fix,29/Jan/08 11:01,12/Nov/15 10:42,
Improvement,TOBAGO-1489,12863375,,Refactoring: using enums (also for attributes in taglib),lofwyr,lofwyr,Minor,Closed,Fixed,11/Sep/15 13:07,11/Nov/15 08:26,
New Feature,TOBAGO-1487,12861772,,"ARIA support code, for the renderer classes.",lofwyr,lofwyr,Minor,Closed,Fixed,04/Sep/15 08:15,11/Nov/15 08:26,
Bug,TOBAGO-1499,12903754,,ViewExpiredException not correctly thrown,lofwyr,hnoeth,Minor,Closed,Fixed,09/Oct/15 14:21,11/Nov/15 08:26,
Bug,TOBAGO-1484,12859630,,image in <tc:button> breaks <tc:segmentLayout>,lofwyr,lofwyr,Minor,Closed,Fixed,27/Aug/15 14:56,11/Nov/15 08:26,
Task,TOBAGO-1475,12838773,,"Replacing class ""Parameterized"" with the JUnit version",lofwyr,lofwyr,Minor,Closed,Fixed,18/Jun/15 12:21,11/Nov/15 08:26,
Improvement,TOBAGO-868,12460929,,Simplify use of layout,lofwyr,lofwyr,Minor,Closed,Fixed,01/Apr/10 12:25,11/Nov/15 08:26,
Improvement,TOBAGO-1463,12825942,,Define ordering in the faces-config.xml files.,lofwyr,fpaul-old,Minor,Closed,Fixed,29/Apr/15 13:09,11/Nov/15 08:26,
Improvement,TOBAGO-2,12326532,,REST Support,,ozak,Minor,Closed,Won't Fix,10/Dec/05 00:02,16/Oct/15 15:33,
Bug,TOBAGO-1466,12830616,,No need to force session creation for secret check,deki,deki,Minor,Closed,Fixed,18/May/15 08:53,16/Oct/15 14:11,
Improvement,TOBAGO-369,12368369,,Extending the Tobago Theme Config ,,pleff,Minor,Closed,Fixed,01/May/07 10:43,16/Oct/15 13:59,
Task,TOBAGO-1345,12679218,,Remove dependencies to rarely used libraries,lofwyr,lofwyr,Minor,Closed,Fixed,14/Nov/13 13:53,16/Oct/15 13:23,
Improvement,TOBAGO-1183,12599679,,Autocomplete support for tc:in,bommel,bommel,Minor,Closed,Duplicate,20/Jul/12 21:24,02/Oct/15 14:44,
Improvement,TOBAGO-251,12360903,,JSR 276: Design-Time Metadata,,bommel,Minor,Closed,Won't Fix,19/Jan/07 20:30,20/Aug/15 08:25,
Bug,TOBAGO-1478,12844571,,Accesskeys doesn't work with Tobago 1.0 and IE11,,lofwyr,Minor,Closed,Won't Fix,13/Jul/15 07:29,12/Aug/15 10:08,
Bug,TOBAGO-1474,12838439,,Wrong position of menu in IE11,lofwyr,lofwyr,Minor,Closed,Fixed,17/Jun/15 11:18,16/Jul/15 11:43,
Bug,TOBAGO-1444,12778190,,Avoid error logging for missing disabled images,bommel,deki,Minor,Closed,Fixed,27/Feb/15 11:31,10/Jun/15 07:23,
Bug,TOBAGO-1445,12778192,,Avoid error logging of ViewExpiredException in AjaxNavigationState,bommel,deki,Minor,Closed,Fixed,27/Feb/15 11:37,10/Jun/15 07:23,
Bug,TOBAGO-1457,12823447,,Sheet sort may be performed twice and possible NPE when using method binding for sorting,lofwyr,lofwyr,Minor,Closed,Fixed,23/Apr/15 15:28,08/Jun/15 21:29,
Task,TOBAGO-1464,12825971,,Remove ActionListenerImpl,deki,deki,Minor,Closed,Fixed,29/Apr/15 14:59,08/Jun/15 21:29,
Task,TOBAGO-1455,12823363,,Updating examples to Jetty 9 and Deltaspike,lofwyr,lofwyr,Minor,Closed,Fixed,23/Apr/15 09:52,08/Jun/15 21:29,
Improvement,TOBAGO-1454,12819314,,"Confiure maven-pmd-plugin over a file, to have finer possibilities",lofwyr,lofwyr,Minor,Closed,Fixed,08/Apr/15 13:27,08/Jun/15 21:29,
Bug,TOBAGO-1075,12536660,,Choosing a date by the datepicker of tx:date does not trigger the onchange event of tx:date,deki,r_jacobs@gmx.de,Minor,Closed,Not A Problem,30/Dec/11 13:40,08/Jun/15 05:52,
Bug,TOBAGO-367,12368112,,cell spanY attribute results in rendering error,,hausden,Minor,Closed,Won't Fix,26/Apr/07 10:42,06/Jun/15 06:24,
Bug,TOBAGO-784,12432959,,No line wrap in tc:sheet column when column is resized in IE,deki,swaczinna,Minor,Closed,Cannot Reproduce,13/Aug/09 09:44,05/Jun/15 14:09,
Bug,TOBAGO-785,12432960,,Right aligned columns gets right truncated when column width is reduced in IE,,swaczinna,Minor,Closed,Cannot Reproduce,13/Aug/09 09:48,05/Jun/15 13:32,
Improvement,TOBAGO-962,12494818,,CSS class tobago-sheet-row-selected has no effecr on tc:link,,swaczinna,Minor,Closed,Not A Problem,06/Jan/11 09:08,05/Jun/15 13:23,
Bug,TOBAGO-1068,12534203,,Timeout for AJAX calls will not be applied,lofwyr,lofwyr,Minor,Closed,Fixed,07/Dec/11 15:48,19/May/15 08:03,
Improvement,TOBAGO-1452,12784694,,Provide SHA-256 on the download site,lofwyr,lofwyr,Minor,Closed,Fixed,22/Mar/15 20:03,08/May/15 13:58,
Bug,TOBAGO-1447,12780868,,Add reset() function to SheetState,lofwyr,lofwyr,Minor,Closed,Fixed,10/Mar/15 14:35,22/Mar/15 18:52,
Bug,TOBAGO-1443,12776419,,If a page was't found the return code is 500 and not 404,lofwyr,lofwyr,Minor,Closed,Won't Fix,20/Feb/15 11:39,17/Mar/15 17:00,
Bug,TOBAGO-1437,12767716,,An AJAX call with 304 (not modified) and createOverlay=false leads to an browser error,lofwyr,lofwyr,Minor,Closed,Fixed,15/Jan/15 12:37,24/Feb/15 10:47,
Improvement,TOBAGO-1442,12775525,,Backward compatibility BoxRenderer,lofwyr,lofwyr,Minor,Closed,Fixed,17/Feb/15 07:36,24/Feb/15 10:47,
Improvement,TOBAGO-1440,12772383,,Minor encoding optimization,lofwyr,lofwyr,Minor,Closed,Fixed,04/Feb/15 14:58,24/Feb/15 10:47,
Bug,TOBAGO-1436,12765402,,ResourceServlet should not render an error page (only the status),lofwyr,lofwyr,Minor,Closed,Fixed,07/Jan/15 16:19,24/Feb/15 10:47,
Bug,TOBAGO-1422,12747707,,datepicker trigger icon not correctly shown inside sheet,lofwyr,deki,Minor,Closed,Fixed,13/Oct/14 12:16,20/Dec/14 22:01,
Bug,TOBAGO-1424,12755786,,Missing change facet in treeSelectItem,lofwyr,crusadah,Minor,Closed,Fixed,17/Nov/14 12:10,22/Nov/14 11:25,
Improvement,TOBAGO-1421,12745478,,MenuFacet shoud be usable in included facets,lofwyr,lofwyr,Minor,Closed,Fixed,02/Oct/14 11:57,05/Nov/14 15:23,
Bug,TOBAGO-648,12394192,,Target attribute has no effect in tc:button with link attribute,,swaczinna,Minor,Closed,Fixed,17/Apr/08 10:25,28/Aug/14 22:29,
Bug,TOBAGO-649,12394205,,SelectOneRadio doesn't render error frame in mozilla browsers,,dubois,Minor,Closed,Fixed,17/Apr/08 14:37,28/Aug/14 13:39,
Bug,TOBAGO-729,12409627,,tc:script component not working with facelets,,sub_ft1,Minor,Closed,Cannot Reproduce,02/Dec/08 08:38,28/Aug/14 13:25,
Improvement,TOBAGO-1414,12728862,,Utility method for AJAX Request detection in non-faces scenario,lofwyr,deki,Minor,Closed,Fixed,22/Jul/14 13:36,22/Aug/14 13:14,
Bug,TOBAGO-1416,12731084,,Time tag should not display date by default,lofwyr,deki,Minor,Closed,Fixed,31/Jul/14 15:15,22/Aug/14 13:14,
Improvement,TOBAGO-1415,12731023,,DatePicker look-and-feel should be more similar to previous,lofwyr,lofwyr,Minor,Closed,Fixed,31/Jul/14 09:39,19/Aug/14 17:32,
New Feature,TOBAGO-1141,12556903,,Integration of lesscss in Tobago,bommel,bommel,Minor,Closed,Fixed,22/May/12 18:54,21/Jul/14 06:07,
Improvement,TOBAGO-1163,12595671,,Add some CSS3 features to tobago-theme-speyside,bommel,bommel,Minor,Closed,Fixed,23/Jun/12 06:19,21/Jul/14 06:07,
Bug,TOBAGO-1413,12726761,,Wrong size calucation after column resizing in sheet,lofwyr,bommel,Minor,Closed,Fixed,11/Jul/14 09:23,21/Jul/14 06:07,
Improvement,TOBAGO-1158,12595221,,Define images for selectManyShuttle commands,bommel,bommel,Minor,Closed,Fixed,20/Jun/12 07:08,21/Jul/14 06:07,
Bug,TOBAGO-1150,12559530,,Make tree model independent from DefaultMutableTreeNode,lofwyr,lofwyr,Minor,Closed,Fixed,06/Jun/12 13:29,21/Jul/14 06:07,
Task,TOBAGO-1403,12718347,,Update to jQuery 1.11.1 + jQuery UI 1.10.4 (adding datepicker and slider),lofwyr,lofwyr,Minor,Closed,Fixed,04/Jun/14 09:16,21/Jul/14 06:07,
Improvement,TOBAGO-1182,12599678,,Accesskey support without rendering javascript fragments,bommel,bommel,Minor,Closed,Fixed,20/Jul/12 21:23,21/Jul/14 06:07,
New Feature,TOBAGO-1155,12595092,,Prevent for Frame Attacks aka Clickjacking,bommel,bommel,Minor,Closed,Fixed,19/Jun/12 11:59,21/Jul/14 06:07,
Improvement,TOBAGO-1408,12724145,,JsonUtils should render a Java String[] to a JavaScript array,lofwyr,lofwyr,Minor,Closed,Fixed,27/Jun/14 15:37,21/Jul/14 06:07,
Improvement,TOBAGO-1076,12537490,,Move the generated javascripts for the components to the end of the html document ,bommel,bommel,Minor,Closed,Fixed,06/Jan/12 11:01,21/Jul/14 06:07,
New Feature,TOBAGO-290,12363073,,Default Text in <tc:in/> and <tx:in/>,,madan,Minor,Closed,Fixed,17/Feb/07 07:49,25/Jun/14 05:16,
Improvement,TOBAGO-1392,12710965,,Allow different position for paging arrows in sheet,,deki,Minor,Closed,Fixed,28/Apr/14 16:58,02/Jun/14 21:36,
New Feature,TOBAGO-1395,12714424,,Set Content Type Options header to nosniff,,deki,Minor,Closed,Fixed,15/May/14 08:48,02/Jun/14 21:36,
Task,TOBAGO-1367,12695658,,Remove debugMode from ClientProperties,lofwyr,lofwyr,Minor,Closed,Fixed,18/Feb/14 09:41,27/May/14 19:04,
Bug,TOBAGO-1349,12687161,,ResourceManagerUtils must check for null images,lofwyr,deki,Minor,Closed,Fixed,03/Jan/14 10:58,02/May/14 17:16,
Bug,TOBAGO-1365,12695162,,"NPE in PageRenderer, when applicationIcon wasn't found",lofwyr,lofwyr,Minor,Closed,Fixed,14/Feb/14 08:37,02/May/14 17:16,
Task,TOBAGO-1380,12704243,,Compatibility: Providing moved renderer classes in the tobago-deprecation artifact,lofwyr,lofwyr,Minor,Closed,Fixed,28/Mar/14 13:23,02/May/14 17:16,
Bug,TOBAGO-1377,12701507,,Build fails on Windows systems,lofwyr,lofwyr,Minor,Closed,Fixed,14/Mar/14 16:14,02/May/14 17:16,
Bug,TOBAGO-1354,12687442,,Conversion of different types to Measure should be done automatically,lofwyr,lofwyr,Minor,Closed,Fixed,06/Jan/14 14:33,02/May/14 17:16,
Bug,TOBAGO-1375,12700998,,Menu disposes when parent of submenu is clicked,lofwyr,deki,Minor,Closed,Fixed,12/Mar/14 15:58,02/May/14 17:16,
New Feature,TOBAGO-1371,12697313,,"Radio buttons should render icons, if available",lofwyr,lofwyr,Minor,Closed,Fixed,26/Feb/14 06:57,02/May/14 17:15,
Sub-task,TOBAGO-1341,12677521,12390371,"Remove outer HTML code, which is not suitable for Portlets",lofwyr,lofwyr,Minor,Closed,Not A Problem,05/Nov/13 07:58,31/Mar/14 15:14,
Bug,TOBAGO-1048,12531034,,Access keys doesn't work with webkit browsers,lofwyr,lofwyr,Minor,Closed,Fixed,10/Nov/11 18:30,24/Feb/14 14:22,
Wish,TOBAGO-579,12384861,,Please move INFO messages to DEBUG,,swaczinna,Minor,Closed,Done,18/Dec/07 12:43,13/Jan/14 10:56,
Improvement,TOBAGO-1343,12677606,,Client Dimension should be stored in session (ClientProperties),lofwyr,lofwyr,Minor,Closed,Fixed,05/Nov/13 16:48,07/Jan/14 14:36,
Task,TOBAGO-1340,12677340,,Update jQuery to 1.10.2,lofwyr,lofwyr,Minor,Closed,Fixed,04/Nov/13 11:01,11/Nov/13 10:48,
Improvement,TOBAGO-1331,12675087,,"Filter xml header from facelets in the response writer, also for JSF 2.1",lofwyr,lofwyr,Minor,Closed,Fixed,22/Oct/13 18:14,11/Nov/13 10:48,
Bug,TOBAGO-1318,12672756,,Meaning of TobagoConfig.isCheckSessionSecret() and isCreateSessionSecret() is inverted,lofwyr,lofwyr,Minor,Closed,Fixed,08/Oct/13 06:38,11/Nov/13 10:48,
Bug,TOBAGO-1320,12672794,,SessionSecret not compatible with portlets,lofwyr,lofwyr,Minor,Closed,Fixed,08/Oct/13 11:32,11/Nov/13 10:48,
Bug,TOBAGO-1339,12677338,,IE8: Menu may trigger an resize event when the window is maximized,lofwyr,lofwyr,Minor,Closed,Fixed,04/Nov/13 10:44,11/Nov/13 10:48,
Bug,TOBAGO-1317,12672596,,Make ClientProperties robust against locale=null,lofwyr,lofwyr,Minor,Closed,Fixed,07/Oct/13 09:41,04/Nov/13 15:07,
Improvement,TOBAGO-1086,12540521,,Filter xml header from facelets in the response writer,lofwyr,lofwyr,Minor,Closed,Fixed,31/Jan/12 10:06,22/Oct/13 18:21,
Bug,TOBAGO-1224,12626564,,The onexit script from tc:script is invoke by browser reload,,andreas.precht,Minor,Closed,Not A Problem,08/Jan/13 15:19,21/Oct/13 14:17,
Bug,TOBAGO-1314,12669088,,Version detection works not correctly for JSF 2.1,lofwyr,lofwyr,Minor,Closed,Fixed,17/Sep/13 19:32,14/Oct/13 08:42,
Improvement,TOBAGO-1302,12665378,,Add support for a theme resources index file per theme,bommel,bommel,Minor,Closed,Fixed,24/Aug/13 15:11,14/Oct/13 08:42,
Improvement,TOBAGO-1300,12664353,,Enable change of the delay for the image overlay on ajax reload,weber,weber,Minor,Closed,Fixed,19/Aug/13 14:26,14/Oct/13 08:42,
Task,TOBAGO-1298,12664336,,Re-implement TobagoConfigParser,lofwyr,lofwyr,Minor,Closed,Fixed,19/Aug/13 12:26,14/Oct/13 08:42,
New Feature,TOBAGO-1310,12667590,,Support for the CSP header field: Content-Security-Policy-Report-Only,lofwyr,lofwyr,Minor,Closed,Fixed,09/Sep/13 14:35,14/Oct/13 08:42,
Bug,TOBAGO-1296,12664066,,Problem with config value preventFrameAttacks when cascading,lofwyr,lofwyr,Minor,Closed,Fixed,16/Aug/13 13:31,14/Oct/13 08:42,
Bug,TOBAGO-1311,12668438,,Method prepareRender() will not be called for tree nodes in sheets,,lofwyr,Minor,Open,,13/Sep/13 08:55,16/Sep/13 09:12,
Bug,TOBAGO-1199,12608023,,Input-suggest-list doesn't close by tab-switching,lofwyr,andreas.precht,Minor,Closed,Fixed,18/Sep/12 08:02,06/Aug/13 07:47,
New Feature,TOBAGO-1153,12560507,,Better look and feel for the tc:file upload,bommel,lofwyr,Minor,Closed,Fixed,13/Jun/12 14:02,06/Aug/13 07:47,
Improvement,TOBAGO-1174,12598755,,Easier handling of Selenium tests,lofwyr,lofwyr,Minor,Closed,Fixed,13/Jul/12 20:28,06/Aug/13 07:47,
New Feature,TOBAGO-1273,12650619,,"New Attribute visible or hidden for ""layoutet"" tags",lofwyr,mwronka,Minor,Closed,Fixed,03/Jun/13 11:20,06/Aug/13 07:47,
Task,TOBAGO-1275,12651055,,Change code style for html5 data attributes: separate words.,lofwyr,lofwyr,Minor,Closed,Fixed,05/Jun/13 08:26,06/Aug/13 07:47,
Improvement,TOBAGO-1261,12646977,,Keyboard navigation in Menubar,weber,weber,Minor,Closed,Fixed,10/May/13 07:42,06/Aug/13 07:47,
Improvement,TOBAGO-895,12466983,,Support for selection of subtrees on <tc:tree>,lofwyr,rohloff,Minor,Closed,Fixed,15/Jun/10 11:03,06/Aug/13 07:47,
Task,TOBAGO-1179,12599632,,Update of slf4j to 1.6.6 and logback to 1.0.6,bommel,bommel,Minor,Closed,Fixed,20/Jul/12 15:30,06/Aug/13 07:47,
Task,TOBAGO-1221,12617473,,Remove JSF 1.1/1.2 and JDK 1.4 support,lofwyr,lofwyr,Minor,Closed,Fixed,23/Nov/12 20:12,06/Aug/13 07:47,
New Feature,TOBAGO-1175,12599227,,Popups should be draggable,lofwyr,r_jacobs@gmx.de,Minor,Closed,Fixed,18/Jul/12 08:05,06/Aug/13 07:47,
Bug,TOBAGO-1274,12650838,,tx:date should relay the markups also to the date picker,lofwyr,lofwyr,Minor,Closed,Fixed,04/Jun/13 08:07,06/Aug/13 07:47,
Bug,TOBAGO-1259,12645211,,"Type the tc:sheet rows attribute should be ""java.lang.Integer""",lofwyr,lofwyr,Minor,Closed,Fixed,29/Apr/13 09:41,06/Aug/13 07:47,
Bug,TOBAGO-1271,12649692,,Javascript failure by partial reload of an tc:in with IE8,lofwyr,andreas.precht,Minor,Closed,Fixed,28/May/13 12:55,06/Aug/13 07:47,
Task,TOBAGO-1172,12598134,,Normalize filenames of the JavaScript and CSS resources,lofwyr,lofwyr,Minor,Closed,Fixed,10/Jul/12 07:34,06/Aug/13 07:47,
Task,TOBAGO-1173,12598147,,Refactor Scripting of the Date/Time/Calender components,lofwyr,lofwyr,Minor,Closed,Fixed,10/Jul/12 09:22,06/Aug/13 07:47,
Improvement,TOBAGO-632,12390370,,PanelRenderer should write style attribute,bommel,weber,Minor,Closed,Fixed,06/Mar/08 17:12,28/May/13 09:59,
Bug,TOBAGO-1162,12595670,,Missing accesskey support in tc:selectBooleanCheckbox,bommel,bommel,Minor,Closed,Fixed,23/Jun/12 06:08,28/May/13 09:59,
Bug,TOBAGO-1040,12527545,,Problems with findComponent and MyFaces Core 2.0,bommel,bommel,Minor,Closed,Fixed,18/Oct/11 05:45,28/May/13 09:59,
Bug,TOBAGO-506,12379665,,"renderedPartially doesn't work with tc:cell, tc:tab and tc:tabgroup",,zhamdi,Minor,Closed,Not A Problem,04/Oct/07 14:28,28/May/13 09:59,
Bug,TOBAGO-494,12378757,,tx:date popup doesn't resize when browser's text size preference is modified,,zhamdi,Minor,Closed,Cannot Reproduce,20/Sep/07 14:18,28/May/13 09:59,
Improvement,TOBAGO-656,12394857,,Move to the merged apt-maven-plugin from codehaus ,bommel,bommel,Minor,Closed,Fixed,27/Apr/08 09:56,28/May/13 09:59,
Improvement,TOBAGO-1050,12532170,,"Sheet header should also have a ""first"" markup to CSS styling",lofwyr,lofwyr,Minor,Closed,Fixed,21/Nov/11 16:35,28/May/13 09:59,
Bug,TOBAGO-1151,12559553,,Define default values for preferredWidth for some input components,lofwyr,lofwyr,Minor,Closed,Fixed,06/Jun/12 15:50,28/May/13 09:59,
Bug,TOBAGO-620,12388258,,Missing COMPONENT_TYPE in UIProgress,bommel,bommel,Minor,Closed,Fixed,09/Feb/08 08:42,28/May/13 09:59,
Bug,TOBAGO-1168,12596830,,"'""' and '\' are not escaped inside inputSuggest",bommel,bommel,Minor,Closed,Fixed,02/Jul/12 22:13,28/May/13 09:59,
New Feature,TOBAGO-1039,12526804,,SelectManyShuttle component ,bommel,bommel,Minor,Closed,Fixed,12/Oct/11 06:51,28/May/13 09:59,
Sub-task,TOBAGO-190,12355436,12354854,"I18n for the javascript is needed to work with style ""long"" and ""full""",,lofwyr,Minor,Closed,Fixed,13/Nov/06 08:21,28/May/13 09:59,
Improvement,TOBAGO-503,12379094,,Ajax requests needs a different content-type.,weber,weber,Minor,Closed,Fixed,26/Sep/07 08:26,28/May/13 09:59,
Improvement,TOBAGO-618,12388205,,Improved caching in ResourceServlet and allow configuration of copy buffer size in ResourceServlet,bommel,bommel,Minor,Closed,Fixed,08/Feb/08 16:18,28/May/13 09:59,
New Feature,TOBAGO-280,12362564,,markup attribute for the tree,lofwyr,lofwyr,Minor,Closed,Fixed,12/Feb/07 10:31,28/May/13 09:59,
Improvement,TOBAGO-1033,12525670,,Replace usages of TobagoFacesContext with FacesContext.getAttributes or ExternalContext.getRequestMap ,bommel,bommel,Minor,Closed,Fixed,04/Oct/11 14:04,28/May/13 09:58,
Bug,TOBAGO-1157,12595217,,Missing minimum height for selectManyShuttle,bommel,bommel,Minor,Closed,Fixed,20/Jun/12 06:35,28/May/13 09:58,
Bug,TOBAGO-313,12364443,,"Misleading Error Message, if Cookies are deactivated",,hausden,Minor,Closed,Fixed,08/Mar/07 12:03,28/May/13 09:58,
Bug,TOBAGO-1134,12556015,,Theme properties does not work with [markup] extension when there is no default.,lofwyr,andreas.precht,Minor,Closed,Fixed,16/May/12 11:44,28/May/13 09:58,
Improvement,TOBAGO-621,12388572,,Avoid empty class in option element of tc:selectXXX,bommel,bommel,Minor,Closed,Fixed,13/Feb/08 18:23,28/May/13 09:58,
Task,TOBAGO-1003,12511100,,Clean up javascript for sheet,lofwyr,lofwyr,Minor,Closed,Fixed,21/Jun/11 15:15,28/May/13 09:58,
Bug,TOBAGO-1167,12596111,,"<tx:menuCheckbox> and <tx:menuRadio> should have the attributes ""id"" and ""fieldId""",lofwyr,lofwyr,Minor,Closed,Fixed,27/Jun/12 15:29,28/May/13 09:58,
Bug,TOBAGO-1142,12556980,,Endless loop when having the file /WEB-INF/classes/META-INF/tobago-config.xml,lofwyr,lofwyr,Minor,Closed,Fixed,23/May/12 11:02,28/May/13 09:58,
Improvement,TOBAGO-1022,12521443,,Support for a default validator in input components like JSF 2.0 (JSR-303),lofwyr,bommel,Minor,Closed,Fixed,06/Sep/11 12:58,28/May/13 09:58,
Improvement,TOBAGO-622,12388693,,Examples for dynamic markup,idus,idus,Minor,Closed,Fixed,14/Feb/08 17:34,28/May/13 09:58,
Task,TOBAGO-412,12370451,,Removing deprecated code/functionallity - fix naming conventions,lofwyr,lofwyr,Minor,Closed,Fixed,29/May/07 14:53,28/May/13 09:58,
Bug,TOBAGO-1161,12595560,,Double AJAX request shows an error in the area,lofwyr,lofwyr,Minor,Closed,Fixed,22/Jun/12 09:53,28/May/13 09:58,
Bug,TOBAGO-1241,12637167,,Duplicate include of theme resources,lofwyr,weber,Minor,Closed,Fixed,15/Mar/13 09:32,28/May/13 09:46,
Bug,TOBAGO-1251,12642914,,"tc:link is calculated to narrow when using ""auto"", especially when images are used",lofwyr,mwronka,Minor,Closed,Fixed,17/Apr/13 12:37,28/May/13 09:46,
Bug,TOBAGO-1245,12641539,,broken Tooltips on tc:tab and tc:box,lofwyr,rohloff,Minor,Closed,Fixed,09/Apr/13 07:46,28/May/13 09:46,
Bug,TOBAGO-1250,12642743,,Wait-Animation while submit doesn't work on some browsers,lofwyr,lofwyr,Minor,Closed,Fixed,16/Apr/13 14:38,28/May/13 09:46,
Bug,TOBAGO-1270,12648598,,"The textAlign attribute of tc:flowLayout on JSP doesn't work on Tomcat, when using a string literal",lofwyr,lofwyr,Minor,Closed,Fixed,21/May/13 11:47,28/May/13 09:46,
Bug,TOBAGO-1249,12642685,,The size/dimension of the page should be accessible via TobagoContext,lofwyr,lofwyr,Minor,Closed,Fixed,16/Apr/13 09:16,28/May/13 09:46,
Bug,TOBAGO-1191,12601349,,"""on before submit"" funkctions should not cancel the submit, when there is no return value",lofwyr,lofwyr,Minor,Closed,Fixed,03/Aug/12 11:05,28/May/13 09:44,
Task,TOBAGO-1144,12557020,,Check licences of dependencies of the demo application,bommel,lofwyr,Minor,Closed,Fixed,23/May/12 15:35,28/May/13 09:44,
