Sub-task,,PIG-5259,13079168,12694824,Add line numbers to bytecode for debugging,rohini,rohini,Major,Open,,12/Jun/17 09:54,12/Jun/17 09:54,
Sub-task,,PIG-5258,13079167,12694824,Bytecode generation for LoadFunc and StoreFunc,rohini,rohini,Major,Open,,12/Jun/17 09:50,12/Jun/17 09:50,
Sub-task,,PIG-5257,13079159,12694824,Bytecode generation for EvalFunc,rohini,rohini,Major,Open,,12/Jun/17 09:25,12/Jun/17 09:25,
Improvement,,PIG-5251,13077039,,Bump joda-time to 2.9.9,dbist13,dbist13,Major,Resolved,Fixed,03/Jun/17 01:39,05/Jun/17 16:37,
Improvement,,PIG-5242,13074794,,Evaluate DataFrame API for Pig on Spark,nkollar,nkollar,Major,Open,,25/May/17 09:40,02/Jun/17 09:21,
Improvement,,PIG-5250,13076647,,"REGEX_EXTRACT, REGEX_EXTRACT_ALL and REGEX_SEARCH should compile Pattern once",,rohini,Major,Resolved,Invalid,01/Jun/17 20:45,01/Jun/17 20:49,
Bug,,PIG-5225,13064797,,Several unit tests are not annotated with @Test,nkollar,nkollar,Major,Resolved,Fixed,18/Apr/17 17:08,01/Jun/17 19:54,
Improvement,,PIG-5247,13076162,,Investigate stopOnFailure feature with Spark execution engine,szita,szita,Major,Open,,31/May/17 11:05,01/Jun/17 09:15,
Improvement,,PIG-3368,12655204,,doc pig flatten operator applied to empty vs null bag,,hazen,Major,Resolved,Duplicate,27/Jun/13 19:09,31/May/17 20:24,
Bug,,PIG-5249,13076294,,Group followed by Limit does not have combiner optimization in Tez,,rohini,Major,Open,,31/May/17 19:56,31/May/17 19:59,
Improvement,Patch Available,PIG-5216,13062692,,Customizable Error Handling for Loaders in Pig,chenjunz,chenjunz,Major,Resolved,Fixed,08/Apr/17 21:07,31/May/17 19:00,
Bug,,PIG-4623,12842939,,Fixed the 'new line' character inside double-quote causing the csv parsing failure,ken11223,ken11223,Major,Reopened,,06/Jul/15 17:29,26/May/17 22:42,07/Jul/15 00:00
Improvement,,PIG-3346,12650784,,New property that controls the number of combined splits,cheolsoo,cheolsoo,Major,Reopened,,04/Jun/13 00:52,26/May/17 22:42,
Bug,,PIG-3176,12631695,,Pig can't use $HOME in Grunt,russell.jurney,russell.jurney,Major,Reopened,,11/Feb/13 09:21,26/May/17 22:42,
Bug,,PIG-4412,12774012,,Race condition in writing multiple outputs from STREAM op,jwills,jwills,Major,Reopened,,10/Feb/15 23:12,26/May/17 22:42,
Bug,Patch Available,PIG-3226,12634790,,Groovy UDF support may fail to load script under some circumstances,herberts,herberts,Major,Reopened,,01/Mar/13 10:56,26/May/17 22:42,
Bug,,PIG-5106,13034858,,Optimize when mapreduce.input.fileinputformat.input.dir.recursive set to true,dbist13,rohini,Major,Patch Available,,13/Jan/17 23:44,26/May/17 22:36,
Bug,Patch Available,PIG-4515,12823361,,org.apache.pig.builtin.Distinct throws ClassCastException,,mikkokupsu,Major,Patch Available,,23/Apr/15 09:44,26/May/17 22:36,
Improvement,,PIG-4656,12855638,,Improve String serialization and comparator performance in BinInterSedes,rohini,rohini,Major,Patch Available,,12/Aug/15 18:44,26/May/17 22:36,
Bug,Patch Available,PIG-5115,13037855,,Builtin AvroStorage generates incorrect avro schema when the same pig field name appears in the alias,anyili,anyili,Major,Patch Available,,25/Jan/17 21:57,26/May/17 22:36,
Improvement,Patch Available,PIG-4539,12828138,,New PigUnit,shadanan,shadanan,Major,Patch Available,,07/May/15 21:32,26/May/17 22:36,
Improvement,,PIG-3911,12710457,,Define unique fields with @OutputSchema,lbendig,lbendig,Major,Patch Available,,24/Apr/14 23:58,26/May/17 22:36,
Bug,,PIG-1919,12501829,,order-by on bag gives error only at runtime,jcoveney,thejas,Major,Open,,18/Mar/11 21:28,26/May/17 22:35,
New Feature,,PIG-3452,12667175,,Framework to fail-fast jobs based on exceptions in UDFs (useful for assert),,aniket486,Major,Open,,05/Sep/13 20:29,26/May/17 22:35,
Bug,,PIG-3920,12712527,,Case statement support,,llddy,Major,Open,,06/May/14 08:24,26/May/17 22:35,
Bug,,PIG-3190,12632726,,Add LuceneTokenizer and SnowballTokenizer to Pig - useful text tokenization,russell.jurney,russell.jurney,Major,Open,,17/Feb/13 00:44,26/May/17 22:35,
Improvement,,PIG-2631,12549400,,Pig should allow self joins,,jcoveney,Major,Open,,03/Apr/12 21:08,26/May/17 22:35,
New Feature,,PIG-2880,12603689,,Pig current releases lack a UDF charAt.This UDF returns the char value at the specified index.,,sabir ayappalli,Major,Open,,16/Aug/12 05:52,26/May/17 22:35,
Improvement,,PIG-3104,12625164,,XMLLoader return Pig tuple/map/bag representation of the DOM of XML documents,daijy,russell.jurney,Major,Open,,24/Dec/12 07:46,26/May/17 22:35,
Bug,,PIG-3486,12670693,,Pig hitting OOM while using PigRunner.run(),rohini,vivekp,Major,Open,,26/Sep/13 12:04,26/May/17 22:35,
Improvement,,PIG-2624,12549286,,Handle recursive inclusion of scripts in JRuby UDFs,,jcoveney,Major,Open,,03/Apr/12 08:23,26/May/17 22:35,
Bug,,PIG-3928,12712902,,Reducer estimator gets wrong configuration for ORDER_BY job,,aniket486,Major,Open,,07/May/14 18:03,26/May/17 22:35,
New Feature,,PIG-3111,12625590,,ToAvro to convert any Pig record to an Avro bytearray,russell.jurney,russell.jurney,Major,Open,,31/Dec/12 20:47,26/May/17 22:35,
Test,,PIG-2981,12611931,,add e2e tests for DateTime  data type,anlilin,thejas,Major,Open,,15/Oct/12 23:15,26/May/17 22:35,
Bug,,PIG-4016,12721793,,Pull test/e2e/pig/lib/*.jar automatically if missing,daijy,daijy,Major,Open,,17/Jun/14 21:57,26/May/17 22:35,
Improvement,,PIG-3764,12694824,,Compile physical operators to bytecode,rohini,julienledem,Major,Open,,12/Feb/14 19:55,26/May/17 22:35,
Bug,,PIG-3146,12629733,,Can't 'import re' in Pig 0.10/0.10.1: ImportError: No module named re,,russell.jurney,Major,Open,,29/Jan/13 17:22,26/May/17 22:35,
Bug,,PIG-3912,12710988,,Evalfunc's getCacheFiles should also support local mode,,aniket486,Major,Open,,28/Apr/14 18:22,26/May/17 22:35,
Improvement,,PIG-3259,12638692,,Optimize byte to Long/Integer conversions,prkommireddi,prkommireddi,Major,Open,,23/Mar/13 23:50,26/May/17 22:35,
Sub-task,,PIG-4095,12731227,12694352,Collapse multiple OR conditions to IN and BETWEEN,,rohini,Major,Open,,01/Aug/14 00:00,26/May/17 22:35,
Bug,,PIG-2630,12549399,,"Issue with setting ""b = a;""",,jcoveney,Major,Open,,03/Apr/12 21:06,26/May/17 22:35,
Improvement,,PIG-1967,12503546,,"deprecate current syntax for casting relation as scalar, to use explicit cast to tuple",thejas,thejas,Major,Open,,06/Apr/11 19:40,26/May/17 22:35,
Bug,,PIG-3830,12703115,,HiveColumnarLoader throwing FileNotFoundException on Hadoop 2,,jarcec,Major,Open,,24/Mar/14 02:19,26/May/17 22:35,
Improvement,,PIG-3473,12669780,,"org.apache.pig.Expression should support ""is null"" and ""not"" operations",,aniket486,Major,Open,,21/Sep/13 00:05,26/May/17 22:35,
Improvement,,PIG-2633,12549432,,Create a SchemaBag which generates a Bag with a known Schema via code gen,jcoveney,jcoveney,Major,Open,,04/Apr/12 00:34,26/May/17 22:35,
Bug,,PIG-3427,12664162,,Columns pruning does not work with DereferenceExpression,,aniket486,Major,Open,,16/Aug/13 22:48,26/May/17 22:35,
New Feature,,PIG-3453,12667416,,Implement a Storm backend to Pig,thedatachef,pradeepg26,Major,Open,,07/Sep/13 00:10,26/May/17 22:35,
Sub-task,,PIG-4096,12731347,12694352,Implement predicate pushdown evaluation in OrcStorage,,rohini,Major,Open,,01/Aug/14 16:38,26/May/17 22:35,
Improvement,,PIG-3010,12613697,,Allow UDF's to flatten themselves,jcoveney,jcoveney,Major,Open,,26/Oct/12 18:33,26/May/17 22:35,
Improvement,,PIG-3981,12717991,,Use Tez counter to collect per output stats,daijy,daijy,Major,Open,,02/Jun/14 21:03,26/May/17 22:35,
Bug,,PIG-3188,12632644,,pig.script.submitted.timestamp not always consistent for jobs launched in a given script,billgraham,billgraham,Major,Open,,15/Feb/13 20:02,26/May/17 22:35,
New Feature,,PIG-2641,12550292,,"Create toJSON function for all complex types: tuples, bags and maps",russell.jurney,russell.jurney,Major,Open,,09/Apr/12 23:19,26/May/17 22:35,
Wish,,PIG-3866,12706593,,Create ThreadLocal classloader per PigContext,r4_ruchir,r4_ruchir,Major,Open,,04/Apr/14 09:14,26/May/17 22:35,
Improvement,,PIG-2628,12549294,,Allow in line scripting UDF definitions,,jcoveney,Major,Open,,03/Apr/12 08:54,26/May/17 22:35,
Test,,PIG-2681,12554006,,TestDriverPig.countStores() does not correctly count the number of stores for pig scripts using variables for the alias,,araceli,Major,Open,,04/May/12 21:23,26/May/17 22:35,
Bug,,PIG-3571,12679075,,Early termination when processing limit,daijy,daijy,Major,Open,,13/Nov/13 19:01,26/May/17 22:35,
Bug,,PIG-3005,12613526,,TestLargeFile#testOrderBy is failing,,jcoveney,Major,Open,,25/Oct/12 17:57,26/May/17 22:35,
Task,,PIG-3127,12628762,,Add e2e testing for BigInteger and BigDecimal data type,gates,jcoveney,Major,Open,,22/Jan/13 18:45,26/May/17 22:35,
Sub-task,,PIG-4049,12725644,12704071,Improve performance of Limit following an Orderby on Tez,,rohini,Major,Open,,06/Jul/14 19:54,26/May/17 22:35,
Improvement,,PIG-3254,12637871,,Fail a failed Pig script quicker,,daijy,Major,Open,,20/Mar/13 01:01,26/May/17 22:35,
Improvement,,PIG-4045,12724379,,Add e2e tests for AvroStorage,daijy,daijy,Major,Open,,30/Jun/14 04:28,26/May/17 22:35,
Improvement,,PIG-3157,12630561,,"Move LENGTH from Piggybank to builtin, make LENGTH work for multiple types similar to SIZE",russell.jurney,russell.jurney,Major,Open,,03/Feb/13 02:32,26/May/17 22:35,
Improvement,,PIG-4072,12729613,,secondary sort optimizer to support multiple predecessors,,daijy,Major,Open,,24/Jul/14 23:19,26/May/17 22:35,
Bug,,PIG-2591,12546508,,Unit tests should not write to /tmp but respect java.io.tmpdir,,thw,Major,Open,,15/Mar/12 00:16,26/May/17 22:35,
Bug,,PIG-3083,12622956,,Introduce new syntax that let's you project just the columns that come from a given :: prefix,,jcoveney,Major,Open,,07/Dec/12 19:34,26/May/17 22:35,
Bug,,PIG-3953,12715389,,Ordering on date doesn't work,,benvermeersch,Major,Open,,20/May/14 09:14,26/May/17 22:35,
Bug,,PIG-2446,12536110,,Fix map input bytes for hadoop 20.203+,daijy,daijy,Major,Open,,22/Dec/11 01:35,26/May/17 22:35,
Bug,,PIG-2461,12537654,,Simplify schema syntax for cast,,daijy,Major,Open,,07/Jan/12 22:58,26/May/17 22:35,
New Feature,,PIG-2625,12549287,,Allow use of JRuby for control flow,,jcoveney,Major,Open,,03/Apr/12 08:24,26/May/17 22:35,
Improvement,,PIG-3133,12628829,,Revamp algebraic interface to actually return classes,,jcoveney,Major,Open,,23/Jan/13 00:48,26/May/17 22:35,
Improvement,,PIG-3055,12616493,,Make it possible to register new script engines,gbowyer@fastmail.co.uk,gbowyer@fastmail.co.uk,Major,Open,,16/Nov/12 22:21,26/May/17 22:35,
Bug,,PIG-3857,12706033,,Pig auto local mode should not override conf with all the default properties,,aniket486,Major,Open,,01/Apr/14 19:57,26/May/17 22:35,
New Feature,,PIG-1804,12495520,,Alow Jython function to implement Algebraic and/or Accumulator interfaces,szita,julienledem,Major,Patch Available,,13/Jan/11 18:21,26/May/17 10:09,
Sub-task,,PIG-5241,13074757,12727944,Specify the hdfs path directly to spark and avoid the unnecessary download and upload in SparkLauncher.java,nkollar,kellyzly,Major,Open,,25/May/17 06:27,25/May/17 16:39,
Sub-task,,PIG-5240,13074750,12727944,Fix TestPigRunner#simpleMultiQueryTest3 in spark mode for wrong inputStats,,kellyzly,Major,Open,,25/May/17 05:34,25/May/17 13:32,
Sub-task,,PIG-5239,13074716,12727944,"Investigate why there are duplicated A[3,4] inTestLocationInPhysicalPlan#test in spark mode",,kellyzly,Major,Open,,25/May/17 02:41,25/May/17 04:58,
Improvement,,PIG-4914,12974376,,Add testcase for join with special characters in chararray,rohini,rohini,Major,Open,,31/May/16 22:28,25/May/17 04:43,
Bug,,PIG-4910,12972523,,Assert wrongly pushed up in optimizer,daijy,daijy,Major,Open,,24/May/16 21:26,24/May/17 23:03,
Bug,,PIG-5059,13020807,,Pig 0.16 e2e Types_Order tests failed with Sort check failed,,Konstantin_Harasov,Major,Open,,15/Nov/16 13:58,24/May/17 23:03,
Bug,,PIG-5075,13026884,,Pig ORCStorage with Snappy Compression will fail with NoClassDefFoundError org/iq80/snappy/Snappy,,prabhujoseph,Major,Open,,09/Dec/16 05:59,24/May/17 23:03,
Improvement,,PIG-4653,12853890,,"Remove unwanted config set on Tez DAG, vertices and edges",rohini,rohini,Major,Open,,10/Aug/15 16:55,24/May/17 23:03,
Bug,,PIG-4922,12976206,,Deadlock between SpillableMemoryManager and InternalSortedBag$SortedDataBagIterator,rohini,rohini,Major,Open,,06/Jun/16 21:21,24/May/17 23:03,
Improvement,,PIG-4735,12913019,,PartitionerDefinedVertexManager should do slowstart,daijy,rohini,Major,Open,,13/Nov/15 23:30,24/May/17 23:03,
Improvement,,PIG-4872,12958583,,More POPartialAgg processing and spill improvements,rohini,rohini,Major,Open,,13/Apr/16 19:36,24/May/17 23:03,
Improvement,,PIG-4912,12973552,,Tez code does not differentiate between cache archives and files,dbist13,rohini,Major,Open,,27/May/16 20:24,24/May/17 23:03,
Improvement,,PIG-5220,13063575,,Improve NestedLimitOptimizer to handle general limit push up,daijy,daijy,Major,Open,,12/Apr/17 17:58,24/May/17 23:03,
Bug,,PIG-5030,13004213,,kill command only kill application the session launches in Tez mode,daijy,daijy,Major,Open,,12/Sep/16 05:04,24/May/17 23:03,
Bug,,PIG-4626,12843349,,[Pig on Tez] OOM in case of multiple outputs and POPartialAgg,rohini,rohini,Major,Open,,07/Jul/15 23:31,24/May/17 23:03,
Bug,,PIG-4740,12914700,,e2e tests for PIG-4417: repo fetching for register,daijy,daijy,Major,Open,,20/Nov/15 01:19,24/May/17 23:03,
Bug,,PIG-4416,12774384,,Fix or comment piggybank tests with ExecType.LOCAL,,mohitsabharwal,Major,Open,,11/Feb/15 23:45,24/May/17 23:03,
Improvement,,PIG-4555,12830325,,Add -XX:+UseNUMA for Tez jobs,rohini,rohini,Major,Open,,15/May/15 22:06,24/May/17 23:03,
Improvement,,PIG-4738,12914625,,Implement StoreResources.getShipFiles() for all piggybank LoadFunc/StoreFunc/EvalFunc,,rohini,Major,Open,,19/Nov/15 21:50,24/May/17 23:03,
Bug,,PIG-5219,13063515,,IndexOutOfBoundsException when loading multiple directories with different schemas using OrcStorage,daijy,omertl,Major,Open,,12/Apr/17 14:42,24/May/17 23:03,
Bug,,PIG-4694,12902819,,MultiStorageOutputFormat does not honor mapreduce.base.outputname,,rohini,Major,Open,,06/Oct/15 21:10,24/May/17 23:03,
Bug,,PIG-4652,12853065,,[Pig on Tez] Key Comparison is slower than mapreduce,,rohini,Major,Open,,07/Aug/15 22:10,24/May/17 23:03,
Bug,,PIG-4647,12851134,,OrcStorage should refer to shaded kryo,,rohini,Major,Open,,03/Aug/15 15:50,24/May/17 23:03,
Improvement,,PIG-4341,12757323,,Add CMX support to pig.tmpfilecompression.codec,fang fang chen,fang fang chen,Major,Open,,24/Nov/14 03:20,24/May/17 23:03,
Sub-task,,PIG-4249,12750867,12704071,Size estimation should be done in sampler instead of sample aggregator,,rohini,Major,Open,,27/Oct/14 20:19,24/May/17 23:03,
Bug,,PIG-5076,13027802,,Pig 0.15.0 cannot STORE the same alias onto HDFS and Mysql both?,daijy,joanlynn,Major,Open,,13/Dec/16 14:54,24/May/17 23:03,
Improvement,,PIG-4573,12832793,,Set minimal configured required for Tez,rohini,rohini,Major,Open,,26/May/15 17:40,24/May/17 23:03,
New Feature,,PIG-4566,12831986,,Reimplement PIG-4066: An optimization for ROLLUP operation in Pig,daijy,daijy,Major,Open,,21/May/15 22:52,24/May/17 23:03,
Task,,PIG-4672,12862869,,Document performance implication for Hive UDF,daijy,daijy,Major,Open,,09/Sep/15 21:42,24/May/17 23:03,
Improvement,,PIG-4962,12992566,,Estimate smaller Tez AM memory for smaller count of tasks,,rohini,Major,Open,,26/Jul/16 12:21,24/May/17 23:03,
Bug,,PIG-4959,12992125,,Tez autoparallelism estimation for skewed join is higher than mapreduce,rohini,rohini,Major,Open,,25/Jul/16 01:14,24/May/17 23:03,
Improvement,,PIG-4428,12776572,,Support UDFContext style getProperties() for different UDFs in Tez ObjectCache,rohini,rohini,Major,Open,,20/Feb/15 23:22,24/May/17 23:03,
Improvement,,PIG-4567,12831998,,Allow UDFs to specify a counter increment other than default of 1,,prkommireddi,Major,Open,,21/May/15 23:32,24/May/17 23:03,
Bug,,PIG-4958,12992112,,Tez autoparallelism estimation for order by is higher than mapreduce,rohini,rohini,Major,Open,,24/Jul/16 21:06,24/May/17 23:03,
Bug,,PIG-4415,12774377,,Fix or comment tests with ExecType.LOCAL,,mohitsabharwal,Major,Open,,11/Feb/15 23:01,24/May/17 23:03,
Sub-task,,PIG-4658,12855728,12853065,Reduce key comparisons in TezAccumulativeTupleBuffer,rohini,rohini,Major,Open,,12/Aug/15 23:56,24/May/17 23:03,
Sub-task,,PIG-4785,12933858,12704071,Optimize multi-query plan for diamond shape edges,rohini,rohini,Major,Open,,25/Jan/16 16:28,24/May/17 23:03,
Bug,,PIG-4932,12980841,,Cache files not loaded when using 'limit' operator,daijy,hem1891,Major,Open,,20/Jun/16 12:58,24/May/17 23:03,
Bug,Patch Available,PIG-4745,12916248,,DataBag should protect content of passed list of tuples,mikkokupsu,mikkokupsu,Major,Resolved,Invalid,25/Nov/15 19:40,24/May/17 22:46,
Bug,Patch Available,PIG-2699,12555163,,Reduce the number of instances of Load and Store Funcs down to 2+1. It should be 1 in the front-end and 1 in the backend,julienledem,julienledem,Major,Closed,Fixed,14/May/12 17:37,24/May/17 16:20,
Bug,,PIG-2648,12550592,,MapReduceLauncher squashes unchecked exceptions,,alexlevenson,Major,Resolved,Duplicate,11/Apr/12 21:46,24/May/17 16:20,
Bug,,PIG-3113,12625920,,Shell command execution hangs job,,sgtgrumbles,Major,Resolved,Duplicate,03/Jan/13 21:49,15/May/17 22:12,
Improvement,,PIG-5233,13071948,,Use Kryo serialization instead of Java serialization for Spark,,nkollar,Major,Open,,15/May/17 11:14,15/May/17 11:15,
Bug,,PIG-5208,13060774,,Two HBase Loads Followed By a Merge Join Fails in Mapreduce or Tez Mode,,wattsinabox,Major,Open,,31/Mar/17 19:33,09/May/17 17:49,
Sub-task,,PIG-5197,13059164,12727944,Replace IndexedKey with PigNullableWritable in spark branch,,kellyzly,Major,Resolved,Won't Fix,25/Mar/17 17:54,08/May/17 03:50,
Bug,,PIG-4854,12954196,,Merge spark branch to trunk,,pallavi.rao,Major,Resolved,Fixed,29/Mar/16 05:19,04/May/17 01:34,
Bug,,PIG-5230,13067258,,Fix the RuntimeException throws in SecondaryKeySortUtil,kellyzly,kellyzly,Major,Resolved,Fixed,27/Apr/17 06:31,28/Apr/17 08:55,
Bug,,PIG-5217,13062860,,Pig Streaming over python multiprocessing,,bharatpattani,Major,Open,,10/Apr/17 10:55,28/Apr/17 06:54,
Bug,,PIG-5227,13066104,,Cannot get avro schema! Input path hdfs://### might be empty.,,bmwer253,Major,Open,,22/Apr/17 19:54,22/Apr/17 19:54,
Sub-task,,PIG-5130,13042906,13047313,Union_3 e2e test failing on Spark,,nkollar,Major,Resolved,Duplicate,14/Feb/17 11:23,19/Apr/17 15:07,
Sub-task,,PIG-5206,13060614,12954221,Support outer join for SkewedJoin in spark mode,kexianda,kexianda,Major,Resolved,Duplicate,31/Mar/17 08:56,19/Apr/17 06:55,
Sub-task,,PIG-4788,12934665,12727944,the value BytesRead metric info always returns 0 even the length of input file is not 0 in spark engine,kellyzly,kellyzly,Major,Resolved,Duplicate,28/Jan/16 02:35,12/Apr/17 21:05,
Sub-task,,PIG-5169,13047329,13047313,SkewedJoin_13 is failing with spark exec type,,nkollar,Major,Resolved,Duplicate,01/Mar/17 14:11,12/Apr/17 02:26,
Sub-task,,PIG-4846,12952294,12954221,Use pigmix to test the performance of pig on spark,kellyzly,kellyzly,Major,Open,,22/Mar/16 02:13,10/Apr/17 01:50,
Bug,,PIG-5213,13061371,,Some tests fail with errors,,anuphal,Major,Open,,04/Apr/17 08:33,04/Apr/17 10:09,
Sub-task,,PIG-5168,13047327,13047313,SkewedJoin_12 is failing with spark exec type,,nkollar,Major,Resolved,Duplicate,01/Mar/17 14:07,04/Apr/17 08:00,
Sub-task,,PIG-5172,13047336,13047313,StreamingPerformance_2 is failing with spark exec type,,nkollar,Major,Resolved,Duplicate,01/Mar/17 14:19,29/Mar/17 10:28,
Sub-task,,PIG-5196,13058598,12954221,Enable persist/cache mechanism in Pig,kexianda,kexianda,Major,Open,,23/Mar/17 13:52,23/Mar/17 13:52,
Bug,,PIG-5193,13058123,,Pig Streaming does not untar cached files,,vparakh,Major,Resolved,Fixed,22/Mar/17 06:54,22/Mar/17 19:50,
Bug,,PIG-5189,13056460,,Support spark.yarn.archive for spark branch,,kellyzly,Major,Open,,15/Mar/17 22:00,17/Mar/17 06:32,
Sub-task,,PIG-5192,13056807,12727944,Remove schema tuple reference overhead for replicate join hashmap in POFRJoinSpark,,kellyzly,Major,Open,,16/Mar/17 21:50,16/Mar/17 21:51,
Bug,,PIG-5190,13056496,,ant docs issue by pig-5110,,jswudi,Major,Resolved,Invalid,16/Mar/17 00:57,16/Mar/17 02:25,
Bug,,PIG-2746,12560124,,Pig doesn't detect all forms of compression extensions properly,,qwertymaniac,Major,Reopened,,11/Jun/12 06:35,08/Mar/17 12:28,
Bug,Patch Available,PIG-5160,13047085,,"SchemaTupleFrontend.java is not thread safe, cause PigServer thrown NPE in multithread env",anyili,anyili,Major,Patch Available,,28/Feb/17 20:37,03/Mar/17 15:57,
Bug,,PIG-5151,13045358,,Few TestNativeMapReduce UT fails,,yeshavora,Major,Resolved,Duplicate,22/Feb/17 19:49,03/Mar/17 09:01,
Bug,,PIG-5152,13045360,,testPredeployedJar Unit test fails,,yeshavora,Major,Resolved,Duplicate,22/Feb/17 19:53,01/Mar/17 13:53,
Sub-task,,PIG-5138,13045133,13044741,fix TestCounters unit test failure after PIG-5132,,kellyzly,Major,Resolved,Duplicate,22/Feb/17 08:25,01/Mar/17 13:43,
Bug,,PIG-1513,12469941,,Pig doesn't handle empty input directory,rding,rding,Major,Closed,Fixed,22/Jul/10 18:49,24/Feb/17 16:01,
Sub-task,,PIG-5149,13045145,13044741,fix TestPredeployedJar unit test failure after PIG-5132,kellyzly,kellyzly,Major,Resolved,Duplicate,22/Feb/17 08:30,23/Feb/17 16:08,
Sub-task,,PIG-5147,13045143,13044741,fix TestMultiQuery unit test failure after PIG-5132,,kellyzly,Major,Resolved,Duplicate,22/Feb/17 08:29,22/Feb/17 15:18,
Bug,,PIG-5121,13039356,,"Backport PIG-4916, PIG-4921 and PIG-4957 to 0.16 branch",daijy,daijy,Major,Resolved,Fixed,01/Feb/17 01:33,08/Feb/17 07:15,
Improvement,,PIG-4913,12974300,,Reduce jython function initiation during compilation,szita,rohini,Major,Patch Available,,31/May/16 17:43,07/Feb/17 13:25,
Bug,,PIG-5124,13040247,,JSONStorage not working,,shravan.padakanti,Major,Open,,03/Feb/17 21:31,03/Feb/17 21:31,
Bug,Patch Available,PIG-2845,12600405,,Configure hadoop.tmp.dir under build/tmp for MiniCluster tests,,julienledem,Major,Open,,27/Jul/12 00:38,01/Feb/17 23:39,
Test,Patch Available,PIG-2914,12607159,,Logs from MiniCluster are too verbose in tests,,julienledem,Major,Open,,12/Sep/12 00:47,01/Feb/17 23:39,
Bug,,PIG-5123,13039593,,"I am trying to create string from bag using BagToString function as BagToString(languages_dist,'"",""') as languages. But it creates extra \ before double quote.",,shravan.padakanti,Major,Open,,01/Feb/17 20:52,01/Feb/17 20:52,
Bug,,PIG-5116,13038420,,Pig Job failed because ConcurrentModificationException() arised,,MaxFaber,Major,Open,,27/Jan/17 11:30,01/Feb/17 05:09,
Improvement,,PIG-4853,12954046,,Fetch inputs before starting outputs,rohini,rohini,Major,Closed,Fixed,28/Mar/16 18:47,27/Jan/17 23:45,
Bug,,PIG-5114,13037647,,Getting error 1006-unable to iterate alias for r,,Ssamaddar,Major,Open,,25/Jan/17 10:59,26/Jan/17 15:13,
Bug,,PIG-5113,13037646,,Not a valid JAR,,MaxFaber,Major,Resolved,Not A Problem,25/Jan/17 10:57,26/Jan/17 01:26,
Bug,,PIG-5089,13034015,,Failing to execute Jobs on Apache Vanilla,,MaxFaber,Major,Open,,11/Jan/17 23:43,18/Jan/17 09:06,
Task,,PIG-3498,12672238,,Make pig binary work on both HBase version 0.94 and 0.95,,jarcec,Major,Resolved,Incomplete,03/Oct/13 23:32,13/Jan/17 22:11,
New Feature,,PIG-3390,12659374,,Make pig working with HBase 0.95,jarcec,jarcec,Major,Closed,Fixed,23/Jul/13 17:07,13/Jan/17 22:03,
Bug,,PIG-4535,12827617,,Pig 0.14.0 with HBase 1.0.0(upgraded dependecy) unresolved dependency error for required hbase jars,,Swati,Major,Resolved,Duplicate,06/May/15 11:12,13/Jan/17 22:01,
Improvement,,PIG-5084,13032704,,Do ReadOnceBag in Tez for multiple inputs,,rohini,Major,Open,,06/Jan/17 22:08,06/Jan/17 22:08,
Bug,,PIG-3591,12681618,,Refactor POPackage to separate MR specific code from packaging,mwagner,mwagner,Major,Closed,Fixed,27/Nov/13 17:53,06/Jan/17 21:35,
Bug,Patch Available,PIG-3046,12615922,,An empty file name in -Dpig.additional.jars throws an error,prkommireddi,cheolsoo,Major,Closed,Fixed,13/Nov/12 17:14,04/Jan/17 09:02,
Bug,,PIG-5077,13028422,,Problem running pigunit sample test,,pplamen,Major,Resolved,Not A Bug,15/Dec/16 16:05,04/Jan/17 05:19,
Bug,,PIG-5069,13023590,,Skewed Join is crashing job,,soldenoche,Major,Resolved,Duplicate,27/Nov/16 17:40,19/Dec/16 19:20,
Bug,,PIG-3440,12665829,,MultiQuery to work with custom partitioner,knoguchi,daijy,Major,Open,,28/Aug/13 00:35,12/Dec/16 20:18,
Wish,,PIG-5071,13026398,,MapReduce concurrency Could Be Better,,wattsinabox,Major,Resolved,Won't Fix,07/Dec/16 16:46,08/Dec/16 14:30,
Bug,,PIG-3891,12708343,,FileBasedOutputSizeReader does not calculate size of files in sub-directories,nkollar,rohini,Major,Resolved,Fixed,14/Apr/14 19:01,02/Dec/16 17:38,
Sub-task,,PIG-5029,13004189,12954221,Optimize sort case when data is skewed,kellyzly,kellyzly,Major,Patch Available,,12/Sep/16 01:50,23/Nov/16 07:28,
Bug,,PIG-5065,13021755,,Unable to read records from multiple files written with OrcStorage,,romankotelnikov,Major,Open,,18/Nov/16 13:39,18/Nov/16 22:17,
Bug,,PIG-5058,13020801,,Pig 0.16 e2e Types_Order tests failed with Sort check failed,,Konstantin_Harasov,Major,Open,,15/Nov/16 13:45,15/Nov/16 13:45,
Improvement,,PIG-419,12403789,,Combiner optimizations extended to nested foreach statements as well,thejas,anandm,Major,Open,,05/Sep/08 20:43,10/Nov/16 18:54,
Improvement,,PIG-4536,12827785,,LIMIT and DISTINCT inside nested foreach should have combiner optimization,,rohini,Major,Open,,06/May/15 19:35,10/Nov/16 18:54,
Sub-task,,PIG-4746,12916562,12727944,Ensure spark can be run as PIG action in Oozie,Pratyy,pallavi.rao,Major,Open,,27/Nov/15 07:24,04/Nov/16 03:14,
Bug,,PIG-5050,13014994,,Cleanup e2e tests turing_jython.conf,daijy,daijy,Major,Resolved,Duplicate,25/Oct/16 06:39,25/Oct/16 06:39,
Bug,,PIG-5042,13011921,,Pig with Tez requires a staging directory with submitter ownership,,BigDataOrange,Major,Open,,13/Oct/16 08:17,24/Oct/16 06:39,
Sub-task,,PIG-4890,12966658,12954221,Run pigmix on spark on yarn with multiple nodes,,kellyzly,Major,Resolved,Duplicate,10/May/16 08:54,21/Oct/16 17:29,
