Bug,,PIG-3882,12707826,,Multiquery off mode execution is not done in batch and very inefficient,rohini,rohini,Major,Closed,Fixed,10/Apr/14 23:13,07/Jul/14 18:08,
Bug,,PIG-3451,12667156,,EvalFunc<T> ctor reflection to determine value of type param T is brittle,hazen,hazen,Major,Closed,Fixed,05/Sep/13 18:33,07/Jul/14 18:08,
Improvement,,PIG-3653,12687651,,Add support for pre-deployed jars,tmwoodruff,tmwoodruff,Major,Closed,Fixed,07/Jan/14 14:35,07/Jul/14 18:08,
Bug,,PIG-3737,12692556,,Bundle dependent jars in distribution in %PIG_HOME%/lib folder,daijy,shuainie,Major,Closed,Fixed,31/Jan/14 18:20,07/Jul/14 18:08,
Bug,,PIG-3607,12682727,,PigRecordReader should report progress for each inputsplit processed,rohini,rohini,Major,Closed,Fixed,04/Dec/13 17:18,07/Jul/14 18:08,
Bug,,PIG-3801,12699555,,Auto local mode does not call storeSchema,aniket486,aniket486,Major,Closed,Fixed,08/Mar/14 00:58,07/Jul/14 18:08,
Task,,PIG-3519,12674165,,Remove dependency on uber avro-tools jar,jarcec,jarcec,Major,Closed,Fixed,16/Oct/13 17:55,07/Jul/14 18:08,
Bug,,PIG-3582,12679788,,"Document SUM, MIN, MAX, and AVG functions for BigInteger and BigDecimal",harichinnan,cheolsoo,Major,Closed,Fixed,18/Nov/13 18:24,07/Jul/14 18:08,
Bug,,PIG-3887,12708166,,TestMRJobStats is broken in trunk,cheolsoo,cheolsoo,Major,Closed,Fixed,13/Apr/14 22:24,07/Jul/14 18:08,
Bug,,PIG-3377,12657551,,New AvroStorage throws NPE when storing untyped map/array/bag,jadler,cheolsoo,Major,Closed,Fixed,13/Jul/13 00:35,07/Jul/14 18:08,
Bug,,PIG-3747,12693491,,Update skewed join documentation,cheolsoo,cheolsoo,Major,Closed,Fixed,06/Feb/14 03:44,07/Jul/14 18:08,
Bug,,PIG-3515,12673676,,Shell commands are limited from OS buffer,andronat,andronat,Major,Closed,Fixed,14/Oct/13 12:38,07/Jul/14 18:08,
Bug,,PIG-3739,12692696,,The Warning_4 e2e test is broken in trunk,aniket486,cheolsoo,Major,Closed,Fixed,02/Feb/14 05:15,07/Jul/14 18:08,
Bug,,PIG-3825,12702792,,Stats collection needs to be changed for hadoop2 (with auto local mode),aniket486,aniket486,Major,Closed,Fixed,21/Mar/14 02:07,07/Jul/14 18:08,
Bug,,PIG-3730,12692067,,Performance issue in SelfSpillBag,rajesh.balamohan,rajesh.balamohan,Major,Closed,Fixed,29/Jan/14 16:06,07/Jul/14 18:08,
Bug,Patch Available,PIG-3726,12691390,,Ranking empty records leads to NullPointerException,jarcec,mtelizhyn,Major,Closed,Fixed,27/Jan/14 15:05,07/Jul/14 18:08,
Bug,,PIG-3806,12700851,,PigServer constructor throws NPE after PIG-3765,aniket486,aniket486,Major,Closed,Fixed,11/Mar/14 23:14,07/Jul/14 18:08,
New Feature,,PIG-3573,12679258,,Provide StoreFunc and LoadFunc for Accumulo,elserj,elserj,Major,Closed,Fixed,14/Nov/13 18:03,07/Jul/14 18:08,
Improvement,,PIG-3731,12692179,,Ability to specify local-mode specific configuration (useful for local/auto-local mode),aniket486,aniket486,Major,Closed,Fixed,29/Jan/14 23:33,07/Jul/14 18:08,
Bug,,PIG-3640,12686086,,Retain intermediate files for debugging purpose in batch mode,cheolsoo,cheolsoo,Major,Closed,Fixed,23/Dec/13 00:43,07/Jul/14 18:08,
Bug,,PIG-3511,12673307,,Security: Pig temporary directories might have world readable permissions,rohini,aniket486,Major,Closed,Fixed,10/Oct/13 20:58,07/Jul/14 18:08,
Bug,,PIG-3867,12706597,,Added hadoop home to build classpath for build pig with unit test on windows,ssvinarchukhorton,ssvinarchukhorton,Major,Closed,Fixed,04/Apr/14 09:31,07/Jul/14 18:08,
Bug,,PIG-3679,12690085,,e2e StreamingPythonUDFs_10 fails in trunk,cheolsoo,cheolsoo,Major,Closed,Fixed,21/Jan/14 19:05,07/Jul/14 18:08,
Improvement,,PIG-3885,12708005,,AccumuloStorage incompatible with Accumulo 1.6.0,elserj,elserj,Major,Closed,Fixed,11/Apr/14 18:49,07/Jul/14 18:08,
Bug,,PIG-3832,12703335,,Fix piggybank test compilation failure after PIG-3449,rohini,rohini,Major,Closed,Fixed,24/Mar/14 22:21,07/Jul/14 18:08,
Bug,,PIG-4030,12722885,,"TestGrunt, TestPigRunner fail after PIG-3892",daijy,daijy,Major,Closed,Fixed,20/Jun/14 22:03,07/Jul/14 18:08,
Improvement,,PIG-3793,12698509,,Provide info on number of LogicalRelationalOperator(s) used in the script through LogicalPlanData,prkommireddi,prkommireddi,Major,Closed,Fixed,03/Mar/14 21:20,07/Jul/14 18:08,
Bug,,PIG-3909,12709959,,Type Casting issue,daijy,polisan,Major,Closed,Fixed,23/Apr/14 07:35,07/Jul/14 18:08,
Bug,,PIG-3643,12686533,,Nested Foreach with UDF and bincond is broken,cheolsoo,rohini,Major,Closed,Fixed,27/Dec/13 16:27,07/Jul/14 18:08,
New Feature,Patch Available,PIG-3238,12635485,,Pig current releases lack a UDF Stuff(). This UDF deletes a specified length of characters and inserts another set of characters at a specified starting point.,nezihyigitbasi,sonuprathap,Major,Closed,Fixed,06/Mar/13 03:29,07/Jul/14 18:08,
Bug,Patch Available,PIG-3623,12684473,,HBaseStorage: setting loadKey and noWAL to false doesn't have any affect,nezihyigitbasi,mstefaniak,Major,Closed,Fixed,13/Dec/13 14:53,07/Jul/14 18:08,
Bug,Patch Available,PIG-3836,12703816,,Pig signature has has guava version dependency,amatsukawa,amatsukawa,Major,Closed,Fixed,26/Mar/14 20:46,07/Jul/14 18:08,
Bug,,PIG-3682,12690409,,mvn-inst target does not install pig-h2.jar into local .m2,raluri,raja@cmbasics.com,Major,Closed,Fixed,22/Jan/14 21:22,07/Jul/14 18:08,
Bug,Patch Available,PIG-3566,12678114,,Cannot set useMatches of REGEX_EXTRACT_ALL and REGEX_EXTRACT,nezihyigitbasi,nezihyigitbasi,Major,Closed,Fixed,07/Nov/13 23:55,07/Jul/14 18:08,
Bug,,PIG-3989,12718976,,PIG_OPTS does not work with some version of HADOOP,daijy,daijy,Major,Closed,Fixed,06/Jun/14 23:47,07/Jul/14 18:08,
Bug,,PIG-3913,12711345,,Pig should use job's jobClient wherever possible (fixes local mode counters),aniket486,aniket486,Major,Closed,Fixed,30/Apr/14 00:13,07/Jul/14 18:08,
Wish,,PIG-3117,12626350,,A debug mode in which pig does not delete temporary files,ihadanny,ihadanny,Major,Closed,Fixed,07/Jan/13 13:43,07/Jul/14 18:08,
Bug,Patch Available,PIG-3802,12699666,,Fix TestBlackAndWhitelistValidator failures,prkommireddi,prkommireddi,Major,Closed,Fixed,09/Mar/14 02:19,07/Jul/14 18:08,
Bug,,PIG-3868,12706600,,Fix Iterator_1 e2e test on windows,ssvinarchukhorton,ssvinarchukhorton,Major,Closed,Fixed,04/Apr/14 09:41,07/Jul/14 18:08,
Bug,,PIG-3674,12689439,,Fix TestAccumuloPigCluster on Hadoop 2,elserj,daijy,Major,Closed,Fixed,17/Jan/14 06:38,07/Jul/14 18:08,
Bug,,PIG-3860,12706304,,Refactor PigStatusReporter and PigLogger for non-MR execution engine,cheolsoo,cheolsoo,Major,Closed,Fixed,02/Apr/14 21:51,07/Jul/14 18:08,
Improvement,,PIG-3800,12699313,,Documentation for Pig whitelist and blacklist features,prkommireddi,prkommireddi,Major,Closed,Fixed,07/Mar/14 01:11,07/Jul/14 18:07,
Sub-task,,PIG-3471,12669655,12666475,Add a base abstract class for ExecutionEngine,cheolsoo,cheolsoo,Major,Closed,Fixed,20/Sep/13 13:55,07/Jul/14 18:07,
Bug,,PIG-3590,12681421,,remove PartitionFilterOptimizer from trunk,aniket486,aniket486,Major,Closed,Fixed,26/Nov/13 21:42,07/Jul/14 18:07,
Bug,Patch Available,PIG-3526,12674395,,Unions with Enums do not work with AvroStorage,jadler,jadler,Major,Closed,Fixed,17/Oct/13 20:29,07/Jul/14 18:07,
Bug,,PIG-3997,12719125,,Issue on Pig docs ( Testing and Diagnostics ),zjffdu,zjffdu,Major,Closed,Fixed,09/Jun/14 07:23,07/Jul/14 18:07,
Bug,,PIG-3871,12706664,,Replace org.python.google.* with com.google.* in imports,cheolsoo,cheolsoo,Major,Closed,Fixed,04/Apr/14 17:13,07/Jul/14 18:07,
Bug,,PIG-3652,12687585,,Pigmix parser (PigPerformanceLoader) deletes chars during parsing ,kereno,keren3000,Major,Closed,Fixed,07/Jan/14 03:34,07/Jul/14 18:07,
Bug,,PIG-3807,12700853,,Pig creates wrong schema after dereferencing nested tuple fields with sorts,daijy,ddreyfus,Major,Closed,Fixed,11/Mar/14 23:24,07/Jul/14 18:07,
Bug,Patch Available,PIG-3936,12713958,,DBStorage fails on storing nulls for non varchar columns,jeremykarn,jeremykarn,Major,Closed,Fixed,13/May/14 17:59,07/Jul/14 18:07,
Bug,,PIG-3771,12696100,,Piggybank Avrostorage makes a lot of namenode calls in the backend,rohini,rohini,Major,Closed,Fixed,19/Feb/14 22:52,07/Jul/14 18:07,
Bug,,PIG-3888,12708223,,Direct fetch doesn't differentiate between frontend and backend sides,lbendig,lbendig,Major,Closed,Fixed,14/Apr/14 10:51,07/Jul/14 18:07,
Bug,Patch Available,PIG-3945,12714987,,Ant not sending hadoopversion to piggybank sub-ant,mrflip,mrflip,Major,Closed,Fixed,18/May/14 02:44,07/Jul/14 18:07,
Bug,Patch Available,PIG-3902,12709088,,PigServer creates cycle,thedatachef,thedatachef,Major,Closed,Fixed,17/Apr/14 16:15,07/Jul/14 18:07,
Bug,,PIG-3722,12691160,,Udf deserialization for registered classes fails in local_mode,aniket486,aniket486,Major,Closed,Fixed,24/Jan/14 23:40,07/Jul/14 18:07,
Bug,,PIG-3798,12699094,,registered jar in pig script are appended to the classpath multiple times,cheolsoo,dotanp,Major,Closed,Fixed,06/Mar/14 08:33,07/Jul/14 18:07,
Bug,,PIG-4021,12722360,,Fix TestHBaseStorage failure after auto local mode change (PIG-3463),daijy,daijy,Major,Closed,Fixed,18/Jun/14 22:14,07/Jul/14 18:07,
Bug,,PIG-3990,12719036,,ant docs is broken in trunk/branch-0.13,cheolsoo,cheolsoo,Major,Closed,Fixed,07/Jun/14 23:06,07/Jul/14 18:07,
Bug,,PIG-3929,12712912,,pig.temp.dir should allow to substitute vars as hadoop configuration does,aniket486,aniket486,Major,Closed,Fixed,07/May/14 18:34,07/Jul/14 18:07,
Bug,,PIG-3944,12714949,,PigNullableWritable toString method throws NPE on null value,mauzhang,mauzhang,Major,Closed,Fixed,17/May/14 08:16,07/Jul/14 18:07,
Bug,,PIG-3752,12693839,,Fix e2e Parallel test for Windows,daijy,daijy,Major,Closed,Fixed,07/Feb/14 07:31,07/Jul/14 18:07,
Bug,,PIG-3675,12689440,,Documentation for AccumuloStorage,elserj,daijy,Major,Closed,Fixed,17/Jan/14 06:41,07/Jul/14 18:07,
Bug,,PIG-3895,12708377,,Pigmix run script has compilation error,rohini,rohini,Major,Closed,Fixed,14/Apr/14 21:25,07/Jul/14 18:07,
Improvement,,PIG-3966,12717041,,Document variable input arguments of UDFs,lbendig,lbendig,Major,Closed,Fixed,28/May/14 13:26,07/Jul/14 18:07,
Bug,,PIG-3639,12686030,,TestRegisteredJarVisibility is broken in trunk,cheolsoo,cheolsoo,Major,Closed,Fixed,21/Dec/13 23:32,07/Jul/14 18:07,
Improvement,,PIG-3914,12711648,,Change TaskContext to abstract class,cheolsoo,cheolsoo,Major,Closed,Fixed,01/May/14 01:26,07/Jul/14 18:07,
Bug,,PIG-3662,12688343,,Static loadcaster in BinStorage can cause exception,lbendig,lbendig,Major,Closed,Fixed,10/Jan/14 22:18,07/Jul/14 18:07,
Task,,PIG-3485,12670636,,Remove CastUtils.bytesToMap(byte[] b) method from LoadCaster interface,cheolsoo,cheolsoo,Major,Closed,Fixed,26/Sep/13 04:53,07/Jul/14 18:07,
Bug,,PIG-3612,12682927,,Storing schema does not work cross cluster with PigStorage and JsonStorage,rohini,rohini,Major,Closed,Fixed,05/Dec/13 15:46,07/Jul/14 18:07,
Task,,PIG-3740,12692767,,Document direct fetch optimization,lbendig,cheolsoo,Major,Closed,Fixed,03/Feb/14 04:00,07/Jul/14 18:07,
Bug,,PIG-3553,12676733,,HadoopJobHistoryLoader fails to load job history on hadoop v 1.2,lgiri,lgiri,Major,Closed,Fixed,30/Oct/13 22:45,07/Jul/14 18:07,
Bug,,PIG-3285,12643728,,Jobs using HBaseStorage fail to ship dependency jars,ndimiduk,ndimiduk,Major,Closed,Fixed,19/Apr/13 23:30,07/Jul/14 18:07,
Sub-task,,PIG-3942,12714915,12704072,Util.buildPp() is incompatible with Non-MR execution engine,cheolsoo,cheolsoo,Major,Closed,Fixed,17/May/14 00:23,07/Jul/14 18:07,
Bug,,PIG-3960,12716157,,Compile fail against Hadoop 2.4.0 after PIG-3913,daijy,daijy,Major,Closed,Fixed,22/May/14 18:27,07/Jul/14 18:07,
Bug,Patch Available,PIG-3673,12689415,,Divide by zero error in runpigmix.pl script,suhassatish,suhassatish,Major,Closed,Fixed,17/Jan/14 01:58,07/Jul/14 18:07,
Bug,,PIG-3958,12716117,,TestMRJobStats is broken in 0.13 and trunk,aniket486,cheolsoo,Major,Closed,Fixed,22/May/14 16:18,07/Jul/14 18:07,
Bug,,PIG-3967,12717208,,Grunt fail if we running more statement after first store,daijy,daijy,Major,Closed,Fixed,29/May/14 04:16,07/Jul/14 18:07,
Improvement,Patch Available,PIG-3844,12704122,,Make ScriptState InheritableThreadLocal for threads that need it,amatsukawa,amatsukawa,Major,Closed,Fixed,27/Mar/14 22:34,07/Jul/14 18:07,
New Feature,,PIG-3463,12669121,,Pig should use hadoop local mode for small jobs,aniket486,aniket486,Major,Closed,Fixed,17/Sep/13 21:21,07/Jul/14 18:07,
Bug,,PIG-3776,12696826,,Conflicting versions of jline is present in trunk ,cheolsoo,cheolsoo,Major,Closed,Fixed,23/Feb/14 23:14,07/Jul/14 18:07,
Bug,Patch Available,PIG-3617,12683914,,problem with temp file deletion in MAPREDUCE operator,nezihyigitbasi,nezihyigitbasi,Major,Closed,Fixed,10/Dec/13 20:26,07/Jul/14 18:07,
Bug,,PIG-3812,12701392,,Several clean-ups in PigStats and JobStats ,cheolsoo,cheolsoo,Major,Closed,Fixed,14/Mar/14 00:48,07/Jul/14 18:07,
New Feature,Patch Available,PIG-3765,12695118,,Ability to disable Pig commands and operators,prkommireddi,prkommireddi,Major,Closed,Fixed,14/Feb/14 00:42,07/Jul/14 18:07,
Improvement,,PIG-3484,12670635,,Make the size of pig.script property configurable,cheolsoo,cheolsoo,Major,Closed,Fixed,26/Sep/13 04:42,07/Jul/14 18:07,
Bug,,PIG-3796,12698748,,PigStats output bytes written not collected for relative paths,rohini,rohini,Major,Closed,Fixed,04/Mar/14 22:09,07/Jul/14 18:07,
Bug,,PIG-4037,12723455,,"TestHBaseStorage, TestAccumuloPigCluster has failures with hadoopversion=23",daijy,rohini,Major,Closed,Fixed,24/Jun/14 20:12,07/Jul/14 18:07,
Bug,,PIG-3746,12693488,,NPE is thrown if Pig fails before PigStats is intialized,cheolsoo,cheolsoo,Major,Closed,Fixed,06/Feb/14 03:20,07/Jul/14 18:07,
Bug,,PIG-4029,12722858,,TestMRCompiler is broken after PIG-3874,daijy,daijy,Major,Closed,Fixed,20/Jun/14 20:09,07/Jul/14 18:07,
Wish,,PIG-4005,12720363,,depend on hbase-hadoop2-compat rather than hbase-hadoop1-compat when hbaseversion is 95,daijy,in-chief,Major,Closed,Fixed,10/Jun/14 15:18,07/Jul/14 18:07,
Bug,,PIG-3469,12669315,,Skewed join can cause unrecoverable NullPointerException when one of its inputs is missing.,jarcec,xton,Major,Closed,Fixed,18/Sep/13 19:26,07/Jul/14 18:07,
Bug,,PIG-3627,12684949,,"Json storage : Doesn't work in cases , where other Store Functions (like PigStorage / AvroStorage) do work. ",ssvinarchukhorton,jayunit100,Major,Closed,Fixed,16/Dec/13 13:26,07/Jul/14 18:07,
Bug,,PIG-3672,12689398,,Pig should not check for hardcoded file system implementations,rohini,suhassatish,Major,Closed,Fixed,16/Jan/14 23:30,07/Jul/14 18:07,
Bug,,PIG-3949,12715304,,HiveColumnarStorage compile failure with Hive 0.14.0,daijy,daijy,Major,Closed,Fixed,19/May/14 21:49,07/Jul/14 18:07,
Improvement,,PIG-3505,12672726,,Make AvroStorage sync interval take default from io.file.buffer.size ,rohini,rohini,Major,Closed,Fixed,08/Oct/13 00:13,07/Jul/14 18:07,
Bug,,PIG-3717,12690788,,AvroStorage is not filtering hidden files on directory recursion,jarcec,jarcec,Major,Closed,Fixed,23/Jan/14 15:44,07/Jul/14 18:07,
Bug,,PIG-3837,12703857,,ant pigperf target is broken in trunk,cheolsoo,cheolsoo,Major,Closed,Fixed,26/Mar/14 23:17,07/Jul/14 18:07,
Bug,,PIG-3632,12685247,,Add option to configure cacheBlocks in HBaseStorage,rohini,rohini,Major,Closed,Fixed,17/Dec/13 20:54,07/Jul/14 18:07,
Bug,Patch Available,PIG-3373,12656103,,XMLLoader returns non-matching nodes when a tag name spans through the block boundary,aseldawy,aseldawy,Major,Closed,Fixed,03/Jul/13 19:46,07/Jul/14 18:07,
Improvement,,PIG-3388,12659356,,No support for Regex for row filter in org.apache.pig.backend.hadoop.hbase.HBaseStorage,lbendig,vikramsi,Major,Closed,Fixed,23/Jul/13 15:31,07/Jul/14 18:07,
Bug,,PIG-3858,12706174,,PigLogger/PigStatusReporter is not set for fetch tasks,lbendig,lbendig,Major,Closed,Fixed,02/Apr/14 13:43,07/Jul/14 18:07,
Improvement,,PIG-3884,12707948,,Move multi store counters to PigStatsUtil from MRPigStatsUtil,rohini,rohini,Major,Closed,Fixed,11/Apr/14 14:08,07/Jul/14 18:07,
Bug,,PIG-3976,12717678,,Typo correction in JobStats breaks Oozie,rohini,rohini,Major,Closed,Fixed,30/May/14 22:54,07/Jul/14 18:07,
Improvement,,PIG-3778,12697071,,Log list of running jobs along with progress,rohini,rohini,Major,Closed,Fixed,25/Feb/14 05:25,07/Jul/14 18:07,
Bug,,PIG-3561,12677454,,Clean up PigStats and JobStats after PIG-3419,cheolsoo,cheolsoo,Major,Closed,Fixed,04/Nov/13 21:33,07/Jul/14 18:07,
Bug,,PIG-3464,12669166,,Mark ExecType and ExecutionEngine interfaces as evolving,cheolsoo,cheolsoo,Major,Closed,Fixed,18/Sep/13 01:27,07/Jul/14 18:07,
Bug,,PIG-3811,12701378,,PigServer.registerScript() wraps exception incorrectly on parsing errors,prkommireddi,prkommireddi,Major,Closed,Fixed,13/Mar/14 22:58,07/Jul/14 18:07,
Bug,Patch Available,PIG-3509,12672920,,Exception swallowing in TOP,vrajaram,vrajaram,Major,Closed,Fixed,08/Oct/13 22:53,07/Jul/14 15:58,
Bug,Patch Available,PIG-4042,12724130,,Casting isn't handled properly when using IndexableLoadFunc,,bridiver,Major,Open,,27/Jun/14 14:29,28/Jun/14 21:44,
Improvement,,PIG-2490,12539636,,Add UDF function chaining syntax,,ciemo,Major,Open,,24/Jan/12 17:21,27/Jun/14 12:49,
Sub-task,,PIG-4040,12723915,12666475,Fix compilation failure due in Pig on Tez due to TEZ-1127 change,,rohini,Major,Resolved,Duplicate,26/Jun/14 16:54,26/Jun/14 22:49,
Bug,,PIG-4026,12722488,,Missing method error,,mustafa adib,Major,Resolved,Fixed,19/Jun/14 12:45,20/Jun/14 08:06,
Bug,,PIG-3987,12718470,,Unjustified cast error when performing a UNION,,giovannibotta,Major,Resolved,Won't Fix,04/Jun/14 21:08,20/Jun/14 01:34,
Bug,,PIG-4007,12720518,,GROUP ALL on an empty table produces no output,,mrflip,Major,Open,,11/Jun/14 06:23,12/Jun/14 04:16,
Improvement,,PIG-2424,12534857,,"Add OUTER_FLATTEN operator which, on an empty bag, returns null instead of throwing away the row",jcoveney,jcoveney,Major,Open,,12/Dec/11 23:51,11/Jun/14 06:34,
Bug,,PIG-3992,12719045,,`package-info.java' files of contrib/zebra do not generate java byte code of version 1.7 when target 1.7 is passed to javac.,,in-chief,Major,Resolved,Won't Fix,08/Jun/14 04:06,10/Jun/14 15:20,
New Feature,,PIG-2620,12548398,,Customizable Error Handling in Pig,lbendig,dvryaboy,Major,Open,,27/Mar/12 22:21,05/Jun/14 19:36,
Bug,,PIG-3980,12717880,,"PigStorage with -tagFile options replaces first tupple always, even when not selecting it with foreach command",,k1aus,Major,Open,,02/Jun/14 09:50,02/Jun/14 09:50,
Bug,,PIG-3880,12707776,,"After compiling trunk, I am seeing ClassLoaderObjectInputStream ClassNotFoundException.",,medined,Major,Resolved,Fixed,10/Apr/14 19:37,30/May/14 14:41,
Bug,,PIG-3964,12716731,,TestMRJobStats fail after PIG-3913,,daijy,Major,Resolved,Duplicate,27/May/14 05:50,27/May/14 22:22,
Bug,,PIG-3513,12673498,,Upgrade snappy.java to 1.1.0-M4,daijy,daijy,Major,Resolved,Duplicate,11/Oct/13 21:44,26/May/14 02:34,
Bug,,PIG-3676,12689442,,Put piggybank.jar into lib directory in distribution,daijy,daijy,Major,Resolved,Duplicate,17/Jan/14 06:56,25/May/14 19:13,
Improvement,,PIG-2361,12531285,,Update builtin UDFs to use @OutputSchema,lbendig,dvryaboy,Major,Open,,14/Nov/11 07:33,24/May/14 21:22,
Bug,,PIG-3943,12714947,,inconsistency between DefaultAbstractBag readFields and write methods ,mauzhang,mauzhang,Major,Open,,17/May/14 07:59,22/May/14 04:18,
Improvement,Patch Available,PIG-3952,12715329,,PigStorage accepts '-tagSplit' to return full split information,,mrflip,Major,Patch Available,,19/May/14 23:58,21/May/14 23:35,
Bug,,PIG-3461,12668882,,Rewrite PartitionFilterOptimizer to make it work for all the cases,aniket486,aniket486,Major,Closed,Fixed,16/Sep/13 20:38,21/May/14 03:16,
Bug,,PIG-3951,12715323,,"Disambiguating, possibly consolidating ""pigsmoke"" with tests from test.smoke.file",,jayunit100,Major,Open,,19/May/14 23:32,19/May/14 23:34,
Improvement,,PIG-3877,12707687,,Getting Geo Latitude/Longitude from Address Lines,rekhajoshm,rekhajoshm,Major,Patch Available,,10/Apr/14 11:45,18/May/14 03:36,
New Feature,,PIG-3873,12707403,,Geo distance calculation using Haversine,rekhajoshm,rekhajoshm,Major,Patch Available,,09/Apr/14 11:00,18/May/14 02:55,
Task,Patch Available,PIG-2444,12536078,,Remove the Zebra *.xml documentation files from the TRUNK and Branch-10,daijy,chandec,Major,Closed,Fixed,21/Dec/11 19:59,15/May/14 01:29,
Bug,,PIG-3745,12693464,,Document auto local mode for pig,aniket486,aniket486,Major,Resolved,Fixed,05/Feb/14 23:06,14/May/14 15:50,
Bug,,PIG-3917,12711911,, Task process exit with nonzero status of -1. how to solve this?,,devendrans,Major,Open,,02/May/14 09:43,13/May/14 20:48,
Bug,,PIG-3853,12704364,,Pig does not kill all the jobs during shutdown for hadoop2,aniket486,aniket486,Major,Open,,28/Mar/14 21:03,13/May/14 18:35,
New Feature,,PIG-2117,12509844,,support use of relational operators supported within nested-foreach in expressions,,thejas,Major,In Progress,,10/Jun/11 16:19,12/May/14 18:18,
Bug,,PIG-2668,12552740,,projection pushdown should work through Split ,,aniket486,Major,Open,,25/Apr/12 21:40,12/May/14 18:17,
New Feature,,PIG-2784,12596742,,Framework for dynamic query optimization,,jay23jack,Major,Open,,02/Jul/12 20:45,12/May/14 18:17,
Bug,,PIG-3362,12654278,,Fix pig tests to use safer/faster test patterns,,aniket486,Major,In Progress,,21/Jun/13 23:49,12/May/14 18:17,
Bug,,PIG-3927,12712737,,Pig HCatLoader does not set 'hive.io.file.readcolumn.ids' properly during partition pushdown,,chitnis,Major,Open,,07/May/14 01:56,07/May/14 01:56,
Bug,,PIG-3919,12712476,,Inner FOREACH of nested FOREACH should have access to main-body aliases,,mrflip,Major,Open,,06/May/14 01:48,06/May/14 01:50,
New Feature,,PIG-2066,12507027,,Accumulators should be able to early-terminate,jcoveney,dvryaboy,Major,Closed,Fixed,12/May/11 18:44,01/May/14 22:02,
New Feature,,PIG-3735,12692464,,UDF to data cleanse the dirty data with expected pattern,rekhajoshm,rekhajoshm,Major,Open,,31/Jan/14 09:17,29/Apr/14 22:50,
Improvement,Patch Available,PIG-3904,12709242,,Pig support windows i18n,,lizhao,Major,Open,,18/Apr/14 10:41,25/Apr/14 00:09,
Bug,,PIG-3910,12710021,,Cannot use DUMP command in macro,,ory,Major,Open,,23/Apr/14 12:22,24/Apr/14 23:24,
Bug,,PIG-2924,12608249,,PigStats should not be assuming all Storage classes to be file-based storage,cheolsoo,qwertymaniac,Major,Closed,Fixed,19/Sep/12 14:37,23/Apr/14 01:10,
Task,,PIG-3613,12683116,,UDF for SimilarityMatching between strings with matching scores,rekhajoshm,rekhajoshm,Major,Open,,06/Dec/13 13:49,22/Apr/14 17:47,
Bug,,PIG-3907,12709638,,In-Built function COR does not work with any other numeric type other than double. ,,rishi.pandey,Major,Open,,21/Apr/14 22:14,21/Apr/14 22:17,
Bug,,PIG-3897,12708862,,very generic stack trace and root cause missing,,shriny,Major,Open,,16/Apr/14 18:09,18/Apr/14 16:42,
Bug,,PIG-3903,12709126,,Configure mapred.min.split.size to be same as pig.maxCombinedSplitSize,rohini,rohini,Major,Open,,17/Apr/14 19:18,18/Apr/14 04:23,
Bug,,PIG-3896,12708392,,PigServer - Batch ,,shriny,Major,Open,,14/Apr/14 22:42,16/Apr/14 21:04,
Bug,,PIG-2878,12603687,,Pig current releases lack a UDF equalIgnoreCase.This function returns a Boolean value indicating whether string left is equal to string right. This check is case insensitive.,shamib007,arjunkr,Major,Closed,Fixed,16/Aug/12 05:27,16/Apr/14 19:50,
Bug,,PIG-3753,12693947,,LOGenerate generates null schema,daijy,daijy,Major,Closed,Fixed,07/Feb/14 17:45,15/Apr/14 20:45,
Task,,PIG-3572,12679257,,Fix all unit test for during build pig with Hadoop 2.X on Windows.,ssvinarchukhorton,ssvinarchukhorton,Major,Closed,Fixed,14/Nov/13 17:55,15/Apr/14 20:45,
Bug,Patch Available,PIG-3552,12676731,,UriUtil used by reducer estimator should support viewfs,amatsukawa,amatsukawa,Major,Closed,Fixed,30/Oct/13 22:25,15/Apr/14 20:45,
Bug,,PIG-3549,12676237,,"Print hadoop jobids for failed, killed job",aniket486,aniket486,Major,Closed,Fixed,28/Oct/13 22:53,15/Apr/14 20:45,
Bug,,PIG-3480,12670332,,TFile-based tmpfile compression crashes in some cases,dvryaboy,dvryaboy,Major,Closed,Fixed,24/Sep/13 18:32,15/Apr/14 20:45,
Bug,,PIG-3774,12696418,,Piggybank Over UDF get wrong result,daijy,daijy,Major,Closed,Fixed,20/Feb/14 23:20,15/Apr/14 20:45,
Bug,,PIG-3779,12697214,,Assert constructs ConstantExpression with null when no comment is given,thedatachef,cheolsoo,Major,Closed,Fixed,25/Feb/14 21:03,15/Apr/14 20:45,
Task,,PIG-3529,12674849,,Upgrade HBase dependency from 0.95-SNAPSHOT to 0.96,jarcec,jarcec,Major,Closed,Fixed,21/Oct/13 17:37,15/Apr/14 20:45,
Bug,,PIG-3492,12671642,,ColumnPrune dropping used column due to LogicalRelationalOperator.fixDuplicateUids changes not propagating,knoguchi,knoguchi,Major,Closed,Fixed,01/Oct/13 18:57,15/Apr/14 20:45,
Bug,,PIG-3827,12702811,,Custom partitioner is not picked up with secondary sort optimization,daijy,prkommireddi,Major,Closed,Fixed,21/Mar/14 06:09,15/Apr/14 20:45,
Bug,,PIG-3794,12698551,,pig -useHCatalog fails using pig command line interface on HDInsight,ehans,ehans,Major,Closed,Fixed,04/Mar/14 01:51,15/Apr/14 20:45,
Bug,,PIG-3592,12681625,,Should not try to create success file for non-fs schemes like hbase,rohini,rohini,Major,Closed,Fixed,27/Nov/13 18:15,15/Apr/14 20:45,
Bug,,PIG-3820,12702487,,TestAvroStorage fail on some OS,daijy,daijy,Major,Closed,Fixed,19/Mar/14 21:23,15/Apr/14 20:45,
Bug,,PIG-3826,12702793,,Outer join with PushDownForEachFlatten generates wrong result,daijy,daijy,Major,Closed,Fixed,21/Mar/14 02:12,15/Apr/14 20:45,
Bug,,PIG-3593,12681656,,Import jython standard module fail on cluster,daijy,daijy,Major,Closed,Fixed,27/Nov/13 20:56,15/Apr/14 20:45,
Bug,,PIG-3530,12674869,,Some e2e tests is broken due to PIG-3480,daijy,daijy,Major,Closed,Fixed,21/Oct/13 18:55,15/Apr/14 20:44,
Bug,,PIG-3677,12689600,,ConfigurationUtil.getLocalFSProperties can return an inconsistent property set,rohini,rohini,Major,Closed,Fixed,17/Jan/14 23:42,15/Apr/14 20:44,
Bug,,PIG-3833,12703532,,Relation loaded by AvroStorage with schema is projected incorrectly in foreach statement.,jeongjinku,jeongjinku,Major,Closed,Fixed,25/Mar/14 17:56,15/Apr/14 20:44,
Bug,,PIG-3512,12673482,,Reducer estimater is broken by PIG-3497,daijy,daijy,Major,Closed,Fixed,11/Oct/13 19:18,15/Apr/14 20:44,
